id,author_id,title,isbn,isbn13,country_code,image_url,small_image_url,publication_year,publication_month,publication_day,language_code,publisher,is_ebook,work_id,total_editions_count,total_added_by,total_rating_sum,total_rating_count,total_text_reviews_count,rating_dist,original_publication_year,original_publication_month,original_publication_day,average_rating,ratings_count,text_reviews_count,authors_ids,authors_names,authors_average_rating,translators_ids,translators_names,translators_average_rating,description
30060523,142051,Devant Dieu,,,TR,https://i.gr-assets.com/images/S/compressed.photo.goodreads.com/books/1462009768l/30060523._SX98_.jpg,https://i.gr-assets.com/images/S/compressed.photo.goodreads.com/books/1462009768l/30060523._SY75_.jpg,1937,,,fre,Eugène Fasquelle Editeur,false,50473531,1,2,0,0,0,5:0|4:0|3:0|2:0|1:0|total:0,,,,0.00,0,0,['142051'],['Maurice Maeterlinck'],['3.79'],[],[],[],"De tous ses beaux livres, poétiques et profonds, Devant Dieu de Maurice Maeterlinck est le plus tourmenté et peut-être le plus beau. Il vérifie ma thèse d’après laquelle le penseur, le poète, comme l’homme d’action, bénéficient à un certain âge d’une seconde jeunesse, que symbolise une nouvelle dentition. La biologie, comme il arrive, avait écarté de la foi Maeterlinck, nature substantiellement chrétienne par la pitié et l’esprit de justice. À sa crise biologique, nous devons La Vie des abeilles, Les Termites et autres œuvres si originales que traverse une crise métaphysique, annoncée par La Sagesse et la Destinée. Mais voici l’inquiétude de la mort et celle de l’après-mort et donc du divin. Chemin faisant, une foule de thèmes symphoniques traversent l’esprit de cette grande âme et la font vibrer lyriquement. Car Maeterlinck est, avant tout, un lyrique et l’on retrouve en lui la combinaison, intellectuelle et sensible, qui fait la pérennité de Goethe. Enfin partout on découvre en lui le courage et cette sincérité voulue, qui est comme la fleur du courage. Détaché de lui-même, comme il convient, il déplorera de devoir quitter ce monde, avant d’y avoir compris goutte ; mais il sent aussi que c’est le sort universel. Nous n’avons d’ailleurs aucun mérite à une résignation qui nous est imposée de partout.<br /><br />De ce collier de pierres précieuses qu’est Devant Dieu (sans agenouillement, hélas !) je veux examiner quelques-unes.<br /><br />Le bref chapitre La Vie des morts traite de la période mentale qui suit la mort, d’après certains auteurs spirites anglais. Ces vues sont évidemment fantaisistes, mais souvent ingénieuses : « Tout se passe et s’agence comme si la même vie, après un instant de sommeil, continuait dans une existence à peine différente ». Telle est la femme de Svidrigaïloff, dans Crime et Châtiment, qui revient, après sa mort, trouver son brutal époux, pour lui faire remarquer qu’il a oublié de remonter la pendule. Les occupations des morts rappellent, en incorporel et en flottant, celles des vivants. Aucun besoin de boire, de manger, ni de dormir. Les promenades sont possibles, mais planées et flottantes comme en rêve. Ni maladie, ni déclinance, ni vieillesse. Le vieillard rétrograde jusqu’à la vingtième ou vingt-cinquième année, comme dans le roman de Duvernois, et l’enfant qui meurt se développe et grandit jusqu’à la jeunesse, où sa mère le reconnaîtra, même si elle l’a perdu en bas âge. Il y a, dans ces conceptions, bien des réminiscences littéraires et philosophiques. « D’un autre côté, dit Maeterlinck, pour être juste, on peut faire observer que notre corps, avant de s’effriter dans la tombe, a laissé une image dans l’espace, ou dans la mémoire du temps, et qu’il n’est pas impossible que quelque chose puisse se former, s’agglutiner ou se coaguler autour de cette image et lui rendre une apparence de vie ».<br /><br />Plus loin : « Si vous pouviez encore agir et penser : quelle serait la première chose que vous feriez après votre mort ? » Sardou disait : « À peine mort, je fiche le camp pour Constantinople. » Je dirais, moi : « Je ferais un article ou je commencerais un roman. » Mais où je ne m’accorde plus avec Maeterlinck, c’est quand il écrit : « J’écoute avec déférence les renseignements et les conseils que me donnent un mathématicien, un physicien, un chimiste, un historien, un ingénieur, un médecin, etc. Mais non point ceux d’un théologien, parce que je suis son égal, puisqu’il ignore Dieu aussi totalement que je le fais. » J’éprouve moi, tout le contraire. Certains travaux de théologie, par exemple la Parousie, du cardinal Billot, ou l’encyclique Pascendi, me satisfont complètement l’esprit, par leur rigueur qualitative (il y a une géométrie et une analytique du divin), alors que devant les travaux des savants je me répète toujours la formule célèbre : « C’est ça, et puis ce n’est peut-être pas ça... » J’ai vu tous les dogmes scientifiques de ma jeunesse s’ébouler successivement en cinquante ans, au lieu que l’humble catéchisme n’a pas bougé et que je découvre sans cesse, comme tous les croyants, du nouveau dans les Évangiles.<br /><br />Voici, par contre, dans la même dilection, une remarque de Maeterlinck bien pénétrante : « J’ignore si le Christ était Dieu, mais il m’apprit à voir un Dieu plus humain, plus pur et meilleur que le Dieu que j’aurais imaginé, s’il n’était venu sur la terre. » La civilisation ne souffre-t-elle pas en ce moment du retrait, ou du reflux, de cette société des nations qu’on appelait la Chrétienté et de la baisse d’une spiritualité presque entièrement réfugiée dans les cloîtres ? Or, les besoins spirituels de la personne humaine sont de tous les instants, comme ses besoins organiques.<br /><br />J’attache un prix considérable à la pensée que voici : « Notre pensée est-elle un produit de notre cerveau, comme le parfum est un produit de la fleur ; ou notre cerveau n’est-il qu’un récepteur d’ondes ? » La découverte des ondes est, en effet, destinée à bouleverser toutes les notions dont se contentaient les matérialistes, de 1880 à 1905. Par elle nous savons que le domaine de l’invisible est peuplé, non seulement de forces, mais de formes inconnues, que « tout est plein d’âmes et de démons », comme disait la philosophie grecque. Il se peut très bien que l’appareil encéphalique soit d’abord un détecteur, un émetteur, un récepteur d’ondes, sans compter d’autres fonctions, dont la plus mystérieuse est celle du langage. La splendeur unique de la musique d’un Beethoven ou d’un Bach n’est-elle pas due à ce que l’encéphale de ces génies sut capter l’harmonie des sphères ? La faculté du langage articulé apparaît déjà comme tout autre chose que ce que croyaient Broca et Charcot, dans leur naïve et rudimentaire doctrine matérialiste des localisations cérébrales. C’est ainsi qu’en quatre lignes Maeterlinck nous ouvre des perspectives infinies. Cela, c’est le propre du véritable poète. Au lieu que les remarques, parfois élégantes, mais bornées, de Valéry, par exemple, ne trouvent en moi nul écho. Ce sont d’aimables petites vieilles, propres et fardées, qui n’inspirent plus aucun désir.<br /><br />De ces hauteurs, notre poète et penseur nous ramène sur la terre : « Un fait nouveau, peut-être capital, c’est que, depuis nos derniers moyens de locomotion et de communication, notamment depuis l’avion et surtout depuis le télégraphe et la T.S.F., nous avons complètement changé les proportions entre la terre et nous. » Il ajoute que nous sommes trop grands et trop rapides pour le globe terrestre. C’est exact. Tout cela pourrait nous mener, d’ici x années, à l’exploration planétaire, et peut-être (voir André Godard, lui aussi un très grand penseur) à la constatation d’une rédemption intersidérale... Maeterlinck ajoute que, pour rétablir l’équilibre, nous devrions vivre plus longtemps. Mais ceux qui ont connu, pendant leur longue existence, de dures ou de terribles traverses, ne seront pas de cet avis. Le règlement moyen de la vie humaine apparaît comme fondé sur une somme de joies et de douleurs, à peu près équivalente dans l’ensemble, sans tenir compte des sommets et des abîmes.<br /><br />« N’est-ce pas une erreur de partir de ce principe que la nature est logique, raisonnable et intelligente à notre façon ? Cette présomption, trop facilement acceptée, n’est-elle pas à la source de la plupart de nos déboires ? »<br /><br />Certainement et M. Charles Nicolle, à diverses reprises, a exprimé cela magnifiquement. Il n’y a presque rien de commun entre la raison humaine et la nature, entre les démarches de cette raison et celles de la nature. Chacune d’elles suit son chemin, de son côté. Je ferai remarquer à ce sujet les analogies intellectuelles saisissantes entre certains groupes de pensées de Charles Nicolle, dans son ouvrage La Destinée humaine (Alcan, éditeur), et des groupes de pensées correspondants de Maeterlinck dans Devant Dieu. Toutefois, elles ont conduit, ces pensées quasi similaires, le premier à accepter la solution catholique et le second à la repousser, ce qui est d’autant plus curieux que Charles Nicolle était un homme de laboratoire, un expérimentateur hors ligne et que Maeterlinck est un homme de plein air, un méditatif synthétique.<br /><br />Pour les panthéistes, Dieu est une sommation de la nature, alors que, pour un Pascal, par exemple, Notre-Seigneur Jésus-Christ est l’incarnation de Dieu. Maeterlinck déclare Dieu incompréhensible et inaccessible à la raison. Charles Nicolle pense que c’est la nature qui est incompréhensible et inaccessible à la raison. Quoi qu’il en soit, le mouvement actuel des esprits en Occident (voir les travaux si originaux de Massis) est aux antipodes de ce qu’il était il y a soixante ans, alors que le matérialisme régnait et qu’on croyait que le microscope et l’histologie allaient nous livrer les lois des tissus humains. Tous les principes matérialistes sont tombés. Les prétendues lois de l’évolution ont cédé la place à la mutation. Le darwinisme et le lamarckisme sont battus en brèche de tous les côtés, et le professeur Tissot, au Muséum, dans un silence des académies et facultés désapprobateur et impressionnant, vient de développer la thèse séduisante, appuyée par de nombreuses observations, de l’origine endogène des microbes de la tuberculose, bouleversant ainsi le dogme pastorien. Ceci sans préjudice des travaux allemands sur la déficience fondamentale, sur la distinction essentielle, déjà posée par les Grecs, de l’âme (psyché) et de l’esprit (nous). Comme on dit, l’école tremble. Mais ceci nous entraînerait trop loin.<br /><br />L’unité de la belle vie philosophique, littéraire et scientifique de Maeterlinck tient dans ce mot : la curiosité universelle, et dans la formule : « Je suis homme et rien de ce qui est humain ne m’est étranger. » Certaines vastes intelligences prennent, au bout du compte, leur parti de l’inconnaissable. Certaines autres ne s’y résignent pas. Le maître de Devant Dieu est de ces dernières. Il a reçu en don une phrase fluide et claire, qui est une des plus belles de notre littérature et dont le charme est comparable à celui d’un parfum exquis. Enfin son ascension, intellectuelle et sensible, n’est pas close.<br /><br />Léon DAUDET,<br />L’heure qui tourne,<br />Éditions de la Nouvelle France,<br />1945."
52444210,142051,Oeuvres (Coffret - 3 volumes),2870277482,,TR,https://s.gr-assets.com/assets/nophoto/book/111x148-bcc042a9c91a29c1d680899eff700a03.png,https://s.gr-assets.com/assets/nophoto/book/50x75-a91bf249278a81aabab721ef782c4a74.png,,,,,,false,73074235,1,1,0,0,0,5:0|4:0|3:0|2:0|1:0|total:0,,,,0.00,0,0,['142051'],['Maurice Maeterlinck'],['3.79'],[],[],[],
50573514,142051,"Les Disciples A Saïs, Et Les Fragments De Novalis...",1012299112,9781012299118,TR,https://i.gr-assets.com/images/S/compressed.photo.goodreads.com/books/1579624831l/50573514._SX98_.jpg,https://i.gr-assets.com/images/S/compressed.photo.goodreads.com/books/1579624831l/50573514._SY75_.jpg,2019,4,4,,Wentworth Press,false,75569202,3,0,0,0,0,5:0|4:0|3:0|2:0|1:0|total:0,,,,0.00,0,0,"['142051', '187510']","['Maurice Maeterlinck', 'Novalis']","['3.79', '3.91']",[],[],[],"This work has been selected by scholars as being culturally important, and is part of the knowledge base of civilization as we know it. This work was reproduced from the original artifact, and remains as true to the original work as possible. Therefore, you will see the original copyright references, library stamps (as most of these works have been housed in our most important libraries around the world), and other notations in the work.<br /><br />This work is in the public domain in the United States of America, and possibly other nations. Within the United States, you may freely copy and distribute this work, as no entity (individual or corporate) has a copyright on the body of the work.<br /><br />As a reproduction of a historical artifact, this work may contain missing or blurred pages, poor pictures, errant marks, etc. Scholars believe, and we concur, that this work is important enough to be preserved, reproduced, and made generally available to the public. We appreciate your support of the preservation process, and thank you for being an important part of keeping this knowledge alive and relevant."
30495354,142051,News of Spring and Other Nature Studies,1354848926,9781354848920,TR,https://i.gr-assets.com/images/S/compressed.photo.goodreads.com/books/1465646052l/30495354._SX98_.jpg,https://i.gr-assets.com/images/S/compressed.photo.goodreads.com/books/1465646052l/30495354._SY75_.jpg,2016,4,27,,Palala Press,false,51018542,7,0,0,0,0,5:0|4:0|3:0|2:0|1:0|total:0,,,,0.00,0,0,['142051'],['Maurice Maeterlinck'],['3.79'],[],[],[],"This work has been selected by scholars as being culturally important, and is part of the knowledge base of civilization as we know it. This work was reproduced from the original artifact, and remains as true to the original work as possible. Therefore, you will see the original copyright references, library stamps (as most of these works have been housed in our most important libraries around the world), and other notations in the work.This work is in the public domain in the United States of America, and possibly other nations. Within the United States, you may freely copy and distribute this work, as no entity (individual or corporate) has a copyright on the body of the work.As a reproduction of a historical artifact, this work may contain missing or blurred pages, poor pictures, errant marks, etc. Scholars believe, and we concur, that this work is important enough to be preserved, reproduced, and made generally available to the public. We appreciate your support of the preservation process, and thank you for being an important part of keeping this knowledge alive and relevant."
25623820,142051,"Maurice Maeterlinck - The Buried Temple, & The Unknown Guest",,,TR,https://s.gr-assets.com/assets/nophoto/book/111x148-bcc042a9c91a29c1d680899eff700a03.png,https://s.gr-assets.com/assets/nophoto/book/50x75-a91bf249278a81aabab721ef782c4a74.png,,,,,,true,45436203,1,3,0,0,0,5:0|4:0|3:0|2:0|1:0|total:0,2008,11,7,0.00,0,0,['142051'],['Maurice Maeterlinck'],['3.79'],[],[],[],
38550274,142051,The Plays of Maurice Maeterlinck: Princess Maleine the Intruder the Blind the Seven Princess (Classic Reprint),0267908903,9780267908905,TR,https://i.gr-assets.com/images/S/compressed.photo.goodreads.com/books/1519007953l/38550274._SX98_.jpg,https://i.gr-assets.com/images/S/compressed.photo.goodreads.com/books/1519007953l/38550274._SX50_.jpg,2018,8,2,,Forgotten Books,false,60173353,1,1,0,0,0,5:0|4:0|3:0|2:0|1:0|total:0,,,,0.00,0,0,['142051'],['Maurice Maeterlinck'],['3.79'],[],[],[],"Excerpt from The Plays of Maurice Maeterlinck: Princess Maleine the Intruder the Blind the Seven Princess<br /><br />Old Hjalmar? Listen: I dare not say all I know but one of my uncles is Chamberlain to Hjalmar. Well, then, if I had a daughter, I would not give her to Prince Hjalmar.<br /><br />About the Publisher<br /><br />Forgotten Books publishes hundreds of thousands of rare and classic books. Find more at <a target=""_blank"" href=""http://www.forgottenbooks.com"" rel=""nofollow"">www.forgottenbooks.com</a><br /><br />This book is a reproduction of an important historical work. Forgotten Books uses state-of-the-art technology to digitally reconstruct the work, preserving the original format whilst repairing imperfections present in the aged copy. In rare cases, an imperfection in the original, such as a blemish or missing page, may be replicated in our edition. We do, however, repair the vast majority of imperfections successfully; any imperfections that remain are intentionally left to preserve the state of such historical works."
12450005,142051,The Great Beyond,,2940018480334,TR,https://s.gr-assets.com/assets/nophoto/book/111x148-bcc042a9c91a29c1d680899eff700a03.png,https://s.gr-assets.com/assets/nophoto/book/50x75-a91bf249278a81aabab721ef782c4a74.png,,,,eng,,true,17433129,6,6,0,0,0,5:0|4:0|3:0|2:0|1:0|total:0,1947,,,0.00,0,0,['142051'],['Maurice Maeterlinck'],['3.79'],[],[],[],"This work has been selected by scholars as being culturally important, and is part of the knowledge base of civilization as we know it. This work was reproduced from the original artifact, and remains as true to the original work as possible. Therefore, you will see the original copyright references, library stamps (as most of these works have been housed in our most important libraries around the world), and other notations in the work. This work is in the public domain in the United States of America, and possibly other nations. Within the United States, you may freely copy and distribute this work, as no entity (individual or corporate) has a copyright on the body of the work.As a reproduction of a historical artifact, this work may contain missing or blurred pages, poor pictures, errant marks, etc. Scholars believe, and we concur, that this work is important enough to be preserved, reproduced, and made generally available to the public. We appreciate your support of the preservation process, and thank you for being an important part of keeping this knowledge alive and relevant."
32004495,142051,Le Miracle de Saint Antoine; Farce En Deux Actes,1372996478,9781372996474,TR,https://s.gr-assets.com/assets/nophoto/book/111x148-bcc042a9c91a29c1d680899eff700a03.png,https://s.gr-assets.com/assets/nophoto/book/50x75-a91bf249278a81aabab721ef782c4a74.png,2016,8,28,,Wentworth Press,false,52648998,3,0,0,0,0,5:0|4:0|3:0|2:0|1:0|total:0,,,,0.00,0,0,['142051'],['Maurice Maeterlinck'],['3.79'],[],[],[],"This work has been selected by scholars as being culturally important, and is part of the knowledge base of civilization as we know it. This work was reproduced from the original artifact, and remains as true to the original work as possible. Therefore, you will see the original copyright references, library stamps (as most of these works have been housed in our most important libraries around the world), and other notations in the work.<br /><br />This work is in the public domain in the United States of America, and possibly other nations. Within the United States, you may freely copy and distribute this work, as no entity (individual or corporate) has a copyright on the body of the work.<br /><br />As a reproduction of a historical artifact, this work may contain missing or blurred pages, poor pictures, errant marks, etc. Scholars believe, and we concur, that this work is important enough to be preserved, reproduced, and made generally available to the public. We appreciate your support of the preservation process, and thank you for being an important part of keeping this knowledge alive and relevant."
30060499,142051,La grande féerie. Immensité de l'univers - Notre terre - Influences sidérales,,,TR,https://i.gr-assets.com/images/S/compressed.photo.goodreads.com/books/1462009198l/30060499._SX98_.jpg,https://i.gr-assets.com/images/S/compressed.photo.goodreads.com/books/1462009198l/30060499._SY75_.jpg,1929,,,fre,Eugène Fasquelle Editeur,false,50473498,2,0,0,0,0,5:0|4:0|3:0|2:0|1:0|total:0,,,,0.00,0,0,['142051'],['Maurice Maeterlinck'],['3.79'],[],[],[],
27036105,142051,"Maurice Maeterlinck, Literary Collection",1517498945,9781517498948,TR,https://s.gr-assets.com/assets/nophoto/book/111x148-bcc042a9c91a29c1d680899eff700a03.png,https://s.gr-assets.com/assets/nophoto/book/50x75-a91bf249278a81aabab721ef782c4a74.png,2015,9,24,,Createspace Independent Publishing Platform,false,66707218,1,0,0,0,0,5:0|4:0|3:0|2:0|1:0|total:0,,,,0.00,0,0,['142051'],['Maurice Maeterlinck'],['3.79'],[],[],[],"Maurice Polydore Marie Bernard Maeterlinck (29 August 1862 - 6 May 1949) was a Belgian playwright, poet, and essayist who was a Fleming, but wrote in French. He was awarded the Nobel Prize in Literature in 1911 ""in appreciation of his many-sided literary activities, and especially of his dramatic works, which are distinguished by a wealth of imagination and by a poetic fancy, which reveals, sometimes in the guise of a fairy tale, a deep inspiration, while in a mysterious way they appeal to the readers' own feelings and stimulate their imaginations."" The main themes in his work are death and the meaning of life. His plays form an important part of the Symbolist movement. In this book: The Blue Bird: A Fairy Play in Six Acts Translator: Alexander Teixeira De Mattos The Life of the Bee Translator: Alfred Sutro Our Friend the Dog Translator: Alexander Teixeira de Mattos Wisdom and Destiny Translator: Alexander Teixeira De Mattos Alfred Sutro The Wrack of the Storm Translator: Alexander Teixeira De Mattos The Double Garden Translator: Alexander Teixeira De Mattos Alfred Sutro P�ll�as and M�lisande Translator: Richard Hovey The Buried Temple Translator: Alfred Sutro The Burgomaster of Stilemonde, A Play in Three Acts Translator: Alexander Teixeira De Mattos"
20283059,142051,Drei mystische Spiele; Die sieben Prinzessinnen / Alladine und Palomides / Der Tod des Tintagiles,1230458522,9781230458526,TR,https://s.gr-assets.com/assets/nophoto/book/111x148-bcc042a9c91a29c1d680899eff700a03.png,https://s.gr-assets.com/assets/nophoto/book/50x75-a91bf249278a81aabab721ef782c4a74.png,2013,9,12,ger,Theclassics.Us,false,28117264,1,1,0,0,0,5:0|4:0|3:0|2:0|1:0|total:0,2013,9,12,0.00,0,0,['142051'],['Maurice Maeterlinck'],['3.79'],[],[],[],"Dieses historische Buch kann zahlreiche Tippfehler und fehlende Textpassagen aufweisen. Kaufer konnen in der Regel eine kostenlose eingescannte Kopie des originalen Buches vom Verleger herunterladen (ohne Tippfehler). Ohne Indizes. Nicht dargestellt. 1904 edition. Auszug: ...die dem deinen gleichen... Astolaine hat unsere Flucht und die unserer Schwestern schon vorbereitet... ALLADINE: Was hat sie dazu gesagt? PALOMIDES: Nichts, nichts... Du wirst alles rings um meines Vaters Schloss sehen, wenn du tagelang uber Meere und durch Walder gereist bist; du wirst Seen und Berge erblicken... nicht wie diese hier unter einem Himmel, der wie ein Hohlengewolbe ist, und mit schwarzen Baumen, welche die Sturme hinmorden... sondern einen Himmel, unter dem man nichts mehr furchtet, Walder in ewigem Grun und Blumen, die nie verbluhen... ALLADINE: Hat sie geweint? PALOMIDES: Wonach fragst du da?... Das ist eine Sache, von der wir zu reden nicht das Recht haben, verstehst du?... Es ist dies ein Leben, das an unserm armen Leben nicht teil hat, und dem die Liebe nur schweigend nahen darf... Wir stehen hier wie zwei Bettler in Lumpen, wenn ich daran denke... Geh, geh! Ich konnte dir Dinge sagen... ALLADINE: Palomides... Was hast du?... PALOMIDES: Geh, geh!... Ich habe Thranen gesehen, die von weiter her kamen, als aus den Augen... Es ist etwas anderes... Es kann indessen sein, dass wir recht haben... aber wie bedaure ich es, also recht zu haben, mein Gott!... Geh... ich werde dir morgen sagen... morgen... morgen... (Sie gehen getrennt ab.) III. Auftritt Ein Gang vor Alladines Gemach (Astolaine kommt mit den Schwestern des Palomides.) ASTOLAINE: Die Pferde warten im Walde, aber Palomides will nicht fliehen, und doch ist euer Leben in Gefahr und das seine. Ich erkenne meinen 55 armen Vater nicht mehr. Er hat einen starren Gedanken, der seinen Verstand trubt. Drei Tage sind es nun, dass ich ihm auf Schritt und Tritt..."
