id,author_id,title,isbn,isbn13,country_code,image_url,small_image_url,publication_year,publication_month,publication_day,language_code,publisher,is_ebook,work_id,total_editions_count,total_added_by,total_rating_sum,total_rating_count,total_text_reviews_count,rating_dist,original_publication_year,original_publication_month,original_publication_day,average_rating,ratings_count,text_reviews_count,authors_ids,authors_names,authors_average_rating,translators_ids,translators_names,translators_average_rating,description
845080,142051,"Hothouses: poems, 1889",0691088381,9780691088389,TR,https://s.gr-assets.com/assets/nophoto/book/111x148-bcc042a9c91a29c1d680899eff700a03.png,https://s.gr-assets.com/assets/nophoto/book/50x75-a91bf249278a81aabab721ef782c4a74.png,2003,3,30,eng,Princeton University Press,false,830606,3,47,55,16,5,5:4|4:3|3:7|2:0|1:2|total:16,1889,,,3.44,14,4,['142051'],['Maurice Maeterlinck'],['3.79'],['27112'],['Richard Howard'],['4.07'],"On May 31, 1889, a young Belgian lawyer from a wealthy bourgeois family in Ghent published a book of 33 poems in 155 copies. Maurice Maeterlinck's legal career was floundering but his road to literary greatness had just begun. Long overshadowed by the plays that later won him the Nobel Prize, <i>Serres chaudes</i> (<i>Hothouses</i>) nonetheless came to be widely regarded as one of the cornerstones of literary Modernism after Baudelaire. While Max Nordau soon seized upon Maeterlinck's--tumult of images--as symptomatic of a pervasive social malaise, decades later Antonin Artaud pronounced, ""Maeterlinck was the first to introduce the multiple riches of the subconscious into literature.""<br /><br /><br /> Richard Howard's translation of this quietly radical work is the first to be published in nearly a century, and the first to accurately convey Maeterlinck's elusive visionary force. The poems, some of them in free verse (new to Belgium at the time), combine the decadent symbolism and the language of dislocation that Maeterlinck later perfected in his dramas. <i>Hothouses</i> reflects the influence not only of French poets including Verlaine and Rimbaud, but also of Whitman. As for the title, the author said it was ""a natural choice, Ghent . . . abounding in greenhouses.""<br /><br /><br /> The poems, whose English translations appear opposite the French originals, are accompanied by reproductions of seven woodcuts by Georges Minne that appeared in the original volume, and by an early prose text by Maeterlinck imaginatively describing a painting by the sixteenth-century Flemish artist Pieter Brueghel.<br /><br /><br /> A feat of daring power extraordinarily immediate and inventive, <i>Hothouses</i> will appeal to all lovers of poetry, and in particular to those interested in Modernism. Maeterlinck's enormous fame may have faded, but twentieth-century writers such as Beckett are still our masters who testify to its undying influence."
13626338,142051,The Inner Beauty,1176726986,9781176726987,TR,https://s.gr-assets.com/assets/nophoto/book/111x148-bcc042a9c91a29c1d680899eff700a03.png,https://s.gr-assets.com/assets/nophoto/book/50x75-a91bf249278a81aabab721ef782c4a74.png,2010,,,,Nabu Press,false,19231463,20,82,54,13,3,5:5|4:5|3:3|2:0|1:0|total:13,1910,,,4.15,6,3,['142051'],['Maurice Maeterlinck'],['3.79'],[],[],[],"This is a reproduction of a book published before 1923. This book may have occasional imperfections such as missing or blurred pages, poor pictures, errant marks, etc. that were either part of the original artifact, or were introduced by the scanning process. We believe this work is culturally important, and despite the imperfections, have elected to bring it back into print as part of our continuing commitment to the preservation of printed works worldwide. We appreciate your understanding of the imperfections in the preservation process, and hope you enjoy this valuable book."
3100468,142051,بعد چهارم,,,TR,https://s.gr-assets.com/assets/nophoto/book/111x148-bcc042a9c91a29c1d680899eff700a03.png,https://s.gr-assets.com/assets/nophoto/book/50x75-a91bf249278a81aabab721ef782c4a74.png,2008,,,per,,false,3131629,1,32,53,15,1,5:4|4:3|3:5|2:3|1:0|total:15,,,,3.53,15,1,['142051'],['Maurice Maeterlinck'],['3.79'],[],[],[],
349255,142051,A Miracle of St. Antony,0887348521,9780887348525,TR,https://i.gr-assets.com/images/S/compressed.photo.goodreads.com/books/1334611423l/349255._SX98_.jpg,https://i.gr-assets.com/images/S/compressed.photo.goodreads.com/books/1334611423l/349255._SY75_.jpg,2002,1,1,,Players Press,false,339527,24,20,51,14,0,5:3|4:4|3:6|2:1|1:0|total:14,1920,,,3.64,9,0,"['142051', '114839']","['Maurice Maeterlinck', 'William-Alan Landes']","['3.79', '3.46']",[],[],[],
12882563,142051,Пьесы,5983581694,9785983581692,TR,https://i.gr-assets.com/images/S/compressed.photo.goodreads.com/books/1327790983l/12882563._SX98_.jpg,https://i.gr-assets.com/images/S/compressed.photo.goodreads.com/books/1327790983l/12882563._SX50_.jpg,2008,,,,Флюид,false,18035792,8,25,51,11,0,5:7|4:4|3:0|2:0|1:0|total:11,1999,,,4.64,9,0,['142051'],['Maurice Maeterlinck'],['3.79'],[],[],[],
15115170,142051,Bulles Bleues. Herinneringen van geluk,,9789020949070,TR,https://i.gr-assets.com/images/S/compressed.photo.goodreads.com/books/1345129861l/15115170._SX98_.jpg,https://i.gr-assets.com/images/S/compressed.photo.goodreads.com/books/1345129861l/15115170._SX50_.jpg,2011,,,nl,Lannoo,false,20770185,4,28,49,14,0,5:2|4:4|3:7|2:1|1:0|total:14,1948,10,1,3.50,12,0,['142051'],['Maurice Maeterlinck'],['3.79'],[],[],[],
1672574,142051,از جهان تا ابدیت,,,TR,https://s.gr-assets.com/assets/nophoto/book/111x148-bcc042a9c91a29c1d680899eff700a03.png,https://s.gr-assets.com/assets/nophoto/book/50x75-a91bf249278a81aabab721ef782c4a74.png,2007,,,per,,false,1667585,1,26,48,12,1,5:7|4:1|3:2|2:1|1:1|total:12,,,,4.00,12,1,['142051'],['Maurice Maeterlinck'],['3.79'],[],[],[],
510950,142051,"The Plays of Maurice Maeterlinck: Alladine and Palomides, Pelleas and Melisande, Home and the Death of Tintagiles",142549045X,9781425490454,TR,https://s.gr-assets.com/assets/nophoto/book/111x148-bcc042a9c91a29c1d680899eff700a03.png,https://s.gr-assets.com/assets/nophoto/book/50x75-a91bf249278a81aabab721ef782c4a74.png,2006,5,5,,Kessinger Publishing,false,498951,5,24,46,13,1,5:1|4:6|3:5|2:1|1:0|total:13,2006,5,5,3.54,12,1,['142051'],['Maurice Maeterlinck'],['3.79'],[],[],[],"This scarce antiquarian book is a facsimile reprint of the original. Due to its age, it may contain imperfections such as marks, notations, marginalia and flawed pages. Because we believe this work is culturally important, we have made it available as part of our commitment for protecting, preserving, and promoting the world's literature in affordable, high quality, modern editions that are true to the original work."
21422270,142051,ژاندارک,,,TR,https://s.gr-assets.com/assets/nophoto/book/111x148-bcc042a9c91a29c1d680899eff700a03.png,https://s.gr-assets.com/assets/nophoto/book/50x75-a91bf249278a81aabab721ef782c4a74.png,,,,,,false,40728485,1,25,46,12,1,5:3|4:5|3:3|2:1|1:0|total:12,,,,3.83,12,1,['142051'],['Maurice Maeterlinck'],['3.79'],[],[],[],
4740109,142051,افكار كوچك و دنياي بزرگ,,,TR,https://s.gr-assets.com/assets/nophoto/book/111x148-bcc042a9c91a29c1d680899eff700a03.png,https://s.gr-assets.com/assets/nophoto/book/50x75-a91bf249278a81aabab721ef782c4a74.png,1957,,,per,انتشارات انيشتين,false,4804729,1,45,43,11,4,5:6|4:2|3:1|2:0|1:2|total:11,1957,,,3.91,11,4,['142051'],['Maurice Maeterlinck'],['3.79'],['804355'],['ذبیح\u200cالله منصوری'],['3.81'],
4740077,142051,جهان بزرگ و هستي,,,TR,https://s.gr-assets.com/assets/nophoto/book/111x148-bcc042a9c91a29c1d680899eff700a03.png,https://s.gr-assets.com/assets/nophoto/book/50x75-a91bf249278a81aabab721ef782c4a74.png,1957,,,per,انتشارات انيشتين,false,4804697,1,32,43,11,3,5:5|4:3|3:0|2:3|1:0|total:11,1957,,,3.91,11,3,['142051'],['Maurice Maeterlinck'],['3.79'],['804355'],['ذبیح\u200cالله منصوری'],['3.81'],
31449501,142051,دنیای پس از مرگ,,,TR,https://i.gr-assets.com/images/S/compressed.photo.goodreads.com/books/1471253124l/31449501._SX98_.jpg,https://i.gr-assets.com/images/S/compressed.photo.goodreads.com/books/1471253124l/31449501._SX50_.jpg,,,,,,false,52152364,1,25,39,9,0,5:4|4:4|3:1|2:0|1:0|total:9,,,,4.33,9,0,['142051'],['Maurice Maeterlinck'],['3.79'],[],[],[],
12844836,142051,La vita delle api - La vita delle termiti - La vita delle formiche,,,TR,https://s.gr-assets.com/assets/nophoto/book/111x148-bcc042a9c91a29c1d680899eff700a03.png,https://s.gr-assets.com/assets/nophoto/book/50x75-a91bf249278a81aabab721ef782c4a74.png,1991,,,ita,Newton & Compton Editori srl,false,71048864,4,31,38,9,0,5:4|4:3|3:2|2:0|1:0|total:9,,,,4.22,5,0,['142051'],['Maurice Maeterlinck'],['3.79'],[],[],[],
6065514,142051,مرگ و زندگی,,,TR,https://s.gr-assets.com/assets/nophoto/book/111x148-bcc042a9c91a29c1d680899eff700a03.png,https://s.gr-assets.com/assets/nophoto/book/50x75-a91bf249278a81aabab721ef782c4a74.png,,,,per,,false,6241828,1,17,38,11,0,5:2|4:3|3:4|2:2|1:0|total:11,,,,3.45,11,0,['142051'],['Maurice Maeterlinck'],['3.79'],[],[],[],
2658539,142051,اشرف مخلوقات,,,TR,https://s.gr-assets.com/assets/nophoto/book/111x148-bcc042a9c91a29c1d680899eff700a03.png,https://s.gr-assets.com/assets/nophoto/book/50x75-a91bf249278a81aabab721ef782c4a74.png,2008,,,per,,false,2683321,1,22,36,11,1,5:2|4:2|3:4|2:3|1:0|total:11,,,,3.27,11,1,['142051'],['Maurice Maeterlinck'],['3.79'],[],[],[],
3307005,142051,در برابر خدا,,,TR,https://s.gr-assets.com/assets/nophoto/book/111x148-bcc042a9c91a29c1d680899eff700a03.png,https://s.gr-assets.com/assets/nophoto/book/50x75-a91bf249278a81aabab721ef782c4a74.png,2008,,,,,false,3344183,1,26,36,8,0,5:5|4:2|3:1|2:0|1:0|total:8,2008,,,4.50,8,0,['142051'],['Maurice Maeterlinck'],['3.79'],[],[],[],
34438836,142051,آثار موریس مترلینگ,,9786001900679,TR,https://i.gr-assets.com/images/S/compressed.photo.goodreads.com/books/1488364918l/34438836._SX98_.jpg,https://i.gr-assets.com/images/S/compressed.photo.goodreads.com/books/1488364918l/34438836._SX50_.jpg,2015,,,per,نگارستان کتاب,false,55547017,1,24,35,8,4,5:5|4:2|3:0|2:1|1:0|total:8,2015,,,4.38,8,4,['142051'],['Maurice Maeterlinck'],['3.79'],['804355'],['ذبیح\u200cالله منصوری'],['3.81'],تقریبا این کتاب خلاصه‌ای از علوم غیبی و یک نوع انموزج و کتاب مبتدی برای کسانی می‌باشد که فرصت مطالعه در علوم غیبی را ندارند. من ادعا نمی‌کنم که در این کتاب چیزی می‌گویم که دیگران نمی‌توانند بگویند. هر کس، ولو با داشتن اطلاعات عمومی قلیل، وارد این عرصه شود و بخواهد چیزی بفهمد، می‌تواند کتابی شاید بهتر از این بنویسد؛
3160779,142051,The Buried Temple,142807564X,9781428075641,TR,https://s.gr-assets.com/assets/nophoto/book/111x148-bcc042a9c91a29c1d680899eff700a03.png,https://s.gr-assets.com/assets/nophoto/book/50x75-a91bf249278a81aabab721ef782c4a74.png,2007,3,1,eng,IndyPublish.com,false,3192508,40,30,34,9,3,5:3|4:2|3:3|2:1|1:0|total:9,1902,,,3.78,4,2,['142051'],['Maurice Maeterlinck'],['3.79'],[],[],[],"The author writes only for the thoughtful, for those who see a purpose in life and an ideal of character to be achieved. This book must be read with the critical faculty awake, that what is strong and helpful for each may be taken and the remainder left behind. A series of five essays which show remarkable insight and sensitive perception into the things pertaining to the life of the spirit. Essays included are entitled: Mystery of Justice; Evolution of Mystery; Kingdom of Matter; The Past; Luck."
11361244,142051,"Stories by Foreign Authors: Polish, Greek, Belgian, Hungarian",,,TR,https://s.gr-assets.com/assets/nophoto/book/111x148-bcc042a9c91a29c1d680899eff700a03.png,https://s.gr-assets.com/assets/nophoto/book/50x75-a91bf249278a81aabab721ef782c4a74.png,,,,eng,,true,15159065,19,35,31,8,1,5:4|4:1|3:2|2:0|1:1|total:8,1901,,,3.88,7,0,"['25619', '142051', '918246', '5412595', '483082']","['Henryk Sienkiewicz', 'Maurice Maeterlinck', 'Camille Lemonnier', 'Δημήτριος Βικέλας', 'Mór Jókai']","['3.85', '3.79', '3.38', '3.72', '3.92']",[],[],[],
326460,142051,Before The Great Silence,0405095937,9780405095931,TR,https://s.gr-assets.com/assets/nophoto/book/111x148-bcc042a9c91a29c1d680899eff700a03.png,https://s.gr-assets.com/assets/nophoto/book/50x75-a91bf249278a81aabab721ef782c4a74.png,1977,1,1,,Arno Press,false,317102,4,18,28,7,1,5:3|4:1|3:3|2:0|1:0|total:7,1934,1,1,4.00,5,0,['142051'],['Maurice Maeterlinck'],['3.79'],[],[],[],
4989094,142051,The Blue Bird and The Betrothal,0932785026,9780932785022,TR,https://s.gr-assets.com/assets/nophoto/book/111x148-bcc042a9c91a29c1d680899eff700a03.png,https://s.gr-assets.com/assets/nophoto/book/50x75-a91bf249278a81aabab721ef782c4a74.png,1985,8,1,eng,Philosophical Publishing Company,false,5055594,1,17,27,7,1,5:3|4:1|3:2|2:1|1:0|total:7,1985,6,,3.86,7,1,['142051'],['Maurice Maeterlinck'],['3.79'],[],[],[],A fantasy/fable play.
1691708,142051,Aglavaine And Selysette: A Drama In Five Acts,158963232X,9781589632325,TR,https://s.gr-assets.com/assets/nophoto/book/111x148-bcc042a9c91a29c1d680899eff700a03.png,https://s.gr-assets.com/assets/nophoto/book/50x75-a91bf249278a81aabab721ef782c4a74.png,2001,5,1,eng,Fredonia Books (NL),false,1688592,29,17,25,7,1,5:2|4:2|3:2|2:0|1:1|total:7,1896,,,3.57,6,1,['142051'],['Maurice Maeterlinck'],['3.79'],[],[],[],
19014035,142051,The Betrothal A Sequel to the Blue Bird,,,TR,https://s.gr-assets.com/assets/nophoto/book/111x148-bcc042a9c91a29c1d680899eff700a03.png,https://s.gr-assets.com/assets/nophoto/book/50x75-a91bf249278a81aabab721ef782c4a74.png,,,,,,true,27037086,34,9,24,5,0,5:4|4:1|3:0|2:0|1:0|total:5,1922,,,4.80,4,0,['142051'],['Maurice Maeterlinck'],['3.79'],['1319502'],['Alexander Teixeira de Mattos'],['3.93'],
26009854,142051,نمادگرایی (سمبولیسم) درادبیات نمایشی ١,,,TR,https://i.gr-assets.com/images/S/compressed.photo.goodreads.com/books/1528933776l/26009854._SX98_.jpg,https://i.gr-assets.com/images/S/compressed.photo.goodreads.com/books/1528933776l/26009854._SX50_.jpg,1989,7,,per,برگ,false,45929067,1,28,23,7,0,5:3|4:0|3:2|2:0|1:2|total:7,1989,7,1,3.29,7,0,"['7857295', '142051']","['فرهاد ناظرزاده کرمانی', 'Maurice Maeterlinck']","['3.32', '3.79']",[],[],[],به همراه ترجمه نمایشنامه ناخوانده از موریس مترلینک
3160781,142051,The Buried Temple and Our Friend the Dog,1406593931,9781406593938,TR,https://s.gr-assets.com/assets/nophoto/book/111x148-bcc042a9c91a29c1d680899eff700a03.png,https://s.gr-assets.com/assets/nophoto/book/50x75-a91bf249278a81aabab721ef782c4a74.png,2008,2,22,,Dodo Press,false,3192504,1,11,23,5,1,5:3|4:2|3:0|2:0|1:0|total:5,1913,,,4.60,5,1,"['142051', '3958829']","['Maurice Maeterlinck', 'Cecil Alden']","['3.79', '4.23']",['187449'],['Alfred Sutro'],['3.88'],"Maurice Polydore Marie Bernard, Count Maeterlinck (1862-1949) was a Belgian poet, playwright, and essayist writing in French. He was awarded the Nobel Prize in Literature in 1911. The main themes in his work are death and the meaning of life. He had written poems and short novels during his studies. In 1889, he became famous overnight after his first play, La Princesse Maleine, had received enthusiastic praise from Octave Mirbeau, the literary critic of Le Figaro (1890). In the following years, he wrote a series of symbolist plays characterized by fatalism and mysticism, most importantly The Intruder (1890), The Blind (1890) and Pelleas and Melisande (1892). With the play Aglavaine et Selysette he began to create characters, especially female characters, more in control of their destinies. After that he published his Douze Chansons (1896), Treasure of the Humble (1896), The Life of the Bee (1901), and Ariadne and Bluebeard (1902). In 1903, Maeterlinck received the Triennial Prize for Dramatic Literature from the Belgian government. His other works include Wisdom and Destiny (1898), and The Wrack of the Storm (1916)."
1219423,142051,Our Eternity 1913,1417979968,9781417979967,TR,https://s.gr-assets.com/assets/nophoto/book/111x148-bcc042a9c91a29c1d680899eff700a03.png,https://s.gr-assets.com/assets/nophoto/book/50x75-a91bf249278a81aabab721ef782c4a74.png,,,,,,false,1207900,27,13,20,5,2,5:1|4:3|3:1|2:0|1:0|total:5,2004,10,15,4.00,5,2,['142051'],['Maurice Maeterlinck'],['3.79'],[],[],[],
38647469,142051,اندیشه‌های یک مغز بزرگ -خداوهستی- افکار کوچک و دنیای بزرگ,,9789648155327,TR,https://i.gr-assets.com/images/S/compressed.photo.goodreads.com/books/1519130828l/38647469._SX98_.jpg,https://i.gr-assets.com/images/S/compressed.photo.goodreads.com/books/1519130828l/38647469._SY75_.jpg,2007,,,per,نگارستان کتاب,false,60258209,1,12,20,5,0,5:3|4:1|3:0|2:0|1:1|total:5,,,,4.00,5,0,['142051'],['Maurice Maeterlinck'],['3.79'],['13425132'],['ذبیح الله منصوری'],['4.01'],اگر ما صد مرتبه باهوش‌تر و چیز فهم‌تر از این بودیم، دنیایی که به نظر ما می‌رسد چندان مشابهتی با دنیای کنونی نداشت و اگر هزار مرتبه از این چیز فهم‌تر بودیم تفاوت دنیایی که به نظرمان می‌رسید به این دنیا زیادتر می‌شد زیرا دنیا جز خود ما و جز آنچه در خود می‌بینیم و از خود می‌فهمیم چیز دیگری است. زندگی ما لحظه‌ای است که به پایان می‌رسد و دنیای لایتناهی جز یک لحظه بی‌پایان چیز دیگر نیست. ولی حقیقت این است که زندگی ما هرگز به پایان نمی‌رسد و همواره در دنیای بی‌پایان خواهیم بود منتهی نخواهیم دانست که این موجود باقی خود ما هستیم. احتمال می‌رود که تمام تصورات ما درباره دنیای بعد از مرگ و تمام پیش‌بینی‌های ما برای آن به هیچ وجه با حقیقت تطبیق ننماید و پس از مرگ همه چیز به زندگی و سیر عادی خود ادامه دهد و جاویدان باشد ولی ما از آن مطلع نخواهیم شد. بعد از مرگ دنیا در وجود ما زنده است و ما هم در درون دنیا زنده هستیم ولی چون شخصیت یعنی فکر و شعور دنیوی را از دست داده‌ایم چیزی نخواهیم فهمید.
14448772,142051,Joyzelle,1589632397,9781589632394,TR,https://s.gr-assets.com/assets/nophoto/book/111x148-bcc042a9c91a29c1d680899eff700a03.png,https://s.gr-assets.com/assets/nophoto/book/50x75-a91bf249278a81aabab721ef782c4a74.png,2002,12,29,,Fredonia Books (NL),false,20091157,27,12,17,6,1,5:0|4:2|3:2|2:1|1:1|total:6,1903,,,2.83,6,1,['142051'],['Maurice Maeterlinck'],['3.79'],[],[],[],
3160774,142051,The Burgomaster of Stilemonde: A Play in Three Acts,1589632516,9781589632516,TR,https://s.gr-assets.com/assets/nophoto/book/111x148-bcc042a9c91a29c1d680899eff700a03.png,https://s.gr-assets.com/assets/nophoto/book/50x75-a91bf249278a81aabab721ef782c4a74.png,2001,5,14,eng,Fredonia Books (NL),false,3192497,26,13,17,5,1,5:1|4:1|3:2|2:1|1:0|total:5,1919,,,3.40,1,0,['142051'],['Maurice Maeterlinck'],['3.79'],['1319502'],['Alexander Teixeira de Mattos'],['3.93'],
29344748,142051,Ο Ναός της Τύχης και άλλα κείμενα,,,TR,https://i.gr-assets.com/images/S/compressed.photo.goodreads.com/books/1456498831l/29344748._SX98_.jpg,https://i.gr-assets.com/images/S/compressed.photo.goodreads.com/books/1456498831l/29344748._SX50_.jpg,2006,11,,gre,Εκδόσεις Πατάκη,false,49581547,1,5,16,4,1,5:1|4:2|3:1|2:0|1:0|total:4,,,,4.00,4,1,['142051'],['Maurice Maeterlinck'],['3.79'],['19070568'],['Χαρά Μπακονικόλα-Γεωργοπούλου'],['4.17'],"Το βιβλίο αυτό περιέχει επτά δοκίμια διαφορετικού ύφους και θεματικής, προκειμένου ο Έλληνας αναγνώστης (στον οποίο ο Μάτερλινκ εξακολουθεί να παραμένει σχεδόν άγνωστος) να πάρει μια γεύση από την προσματική ευαισθησία του συγγραφέα.<br /><br />Ο τόμος περιέχει έναν πρόλογο με θέμα ""Ο Μάτερλινκ και το δοκίμιο"" και επτά κείμενα του Μάτερλινκ: Ο θάνατος του μικρού σκύλου, ένα συγκινησιακό μανιφέστο ζωοφιλίας, Ο ναός της τύχης, ένας ψύχραιμος λίβελος ενάντια στην αυτοκρατορία των τυχερών παιχνιδιών, Εγκώμιο του ξίφους, ο συγγραφέας εξαιρεί την ηθική ποιότητα της ξιφομαχίας, Το σύγχρονο δράμα, εκφράζεται το ζητούμενο για ένα θέατρο που να ""παροντοποιεί"" στη σκηνή το αόρατο, το άρρητο, τους παλμούς του σύμπαντος, Περί ειλικρίνειας, συνδέεται άρρηκτα η αμεσότητα της αγάπης και το ύψιστο σημείο ταύτισης δύο προσώπως με την απόλυτη ειλικρίνεια, Τα αρώματα, μια δραματικότατη περιγραφή των ""βασανιστηρίων"" στα οποία υποβάλλονται τα άνθη, προκειμένου να προδώσουν - να παραδώσουν - το μυστικό του αρωματός τους στην αρωματοβιομηχανία. Το ατύχημα, ερμηνεύονται τα ατυχήματα ως αποτέλεσμα μιας ατελούς ή αποπροσανατολισμένης προσπάθειας του ενστίκτου ή του ασυνείδητου, τα οποία ο άνθρωπος, από άγνοια, αποκαλεί τυχαία συμβάντα."
27308907,142051,მეტერლინკ II ტომი,9789941009,,TR,https://i.gr-assets.com/images/S/compressed.photo.goodreads.com/books/1445969113l/27308907._SX98_.jpg,https://i.gr-assets.com/images/S/compressed.photo.goodreads.com/books/1445969113l/27308907._SY75_.jpg,2008,,,kat,სიესტა,false,47360087,14,7,15,3,1,5:3|4:0|3:0|2:0|1:0|total:3,2013,9,12,5.00,2,1,"['142051', '5361383']","['Maurice Maeterlinck', 'დათო აკრიანი']","['3.79', '4.02']",[],[],[],მორის მეტერლინკის პიესების სრული კრებულის მეორე ტომში შესულია შემდეგი პიესები:<br /><br />”არიადნე და ლურჯწვერა ანუ ამაო განთავისუფლება”;<br /><br />”და ბეატრის”;<br /><br />”მონნა ვანნა”;<br /><br />”ჟუაზელლ”;<br /><br />”წმინდა ანტუანის სასწაული”;<br /><br />”ლურჯი ფრინველი”;<br /><br />”სტილმონდის ბურბომისტრი”;<br /><br />”ცხოვრების მარილი”;<br /><br />”პრინცესა იზაბელლ”.
27235840,142051,მეტერლინკ I ტომი,9789941001,,TR,https://i.gr-assets.com/images/S/compressed.photo.goodreads.com/books/1445270607l/27235840._SX98_.jpg,https://i.gr-assets.com/images/S/compressed.photo.goodreads.com/books/1445270607l/27235840._SY75_.jpg,2008,,,kat,სიესტა,false,47282962,5,16,15,3,2,5:3|4:0|3:0|2:0|1:0|total:3,2015,8,22,5.00,2,2,"['142051', '5361383']","['Maurice Maeterlinck', 'დათო აკრიანი']","['3.79', '4.02']",[],[],[],მორის მეტერლინკის პიესების სრული კრებულის პირველ ტომში შესულია შემდეგი პიესები:<br /><br />”პრინცესა მალენ”;<br /><br />”დაუპატიჟებელი”;<br /><br />”ბრმები”;<br /><br />”შვიდი პრინცესა”;<br /><br />”პელლეას და მელისანდ”;<br /><br />”ალლადინ და პალომიდ”;<br /><br />”სახლის კედლებში”;<br /><br />”ტენტაჟილის საკვდილი”;<br /><br />”აგლავენ და სელიზეტ”.
