id,author_id,title,isbn,isbn13,country_code,image_url,small_image_url,publication_year,publication_month,publication_day,language_code,publisher,is_ebook,work_id,total_editions_count,total_added_by,total_rating_sum,total_rating_count,total_text_reviews_count,rating_dist,original_publication_year,original_publication_month,original_publication_day,average_rating,ratings_count,text_reviews_count,authors_ids,authors_names,authors_average_rating,translators_ids,translators_names,translators_average_rating,description
154678,1049,The Righteous Among the Nations: Rescuers of Jews During the Holocaust,0061151122,9780061151125,TR,https://s.gr-assets.com/assets/nophoto/book/111x148-bcc042a9c91a29c1d680899eff700a03.png,https://s.gr-assets.com/assets/nophoto/book/50x75-a91bf249278a81aabab721ef782c4a74.png,,,,en-US,,false,149295,1,204,135,28,6,5:23|4:5|3:0|2:0|1:0|total:28,2007,3,1,4.82,28,6,"['89437', '1049', '1135765', '257375']","['Mordecai Paldiel', 'Elie Wiesel', 'Avner Shalev', 'Israel Gutman']","['4.42', '4.31', '4.76', '4.24']",[],[],[],"In the darkest days of World War II, the Nazi German regime reigned supreme over virtually all of Europe. Within these occupied lands, Jews were being rounded up and sent off to extermination camps for execution. Helping them escape was punishable by death.<br /><br />In this dark and seemingly hopeless situation, hundreds of ordinary people risked all to shelter and smuggle Jews to safety. These were generally not organized efforts, simply moral people who reacted in horror to the fate of innocent neighbors and took action. Thousands of Jews were rescued in this way.<br /><br />In 1953, the state of Israel established Yad Vashem, the Holocaust Martyrs' and Heroes' Remembrance Authority in Jerusalem to commemorate and perpetuate the memory of the heroes and martyrs of the Holocaust. An independent committee reviews and awards the honor of The Righteous Among the Nations to those documented cases of rescue. Over 20,000 people, from all nationalities and religious groups, have received this prestigious awards.<br /><br />This work selects approximately 200 biographies from among the Righteous, and describes the circumstances of the rescue. Each entry includes description of the contact; the aid extended; dangers and risk faced by the rescuer; motivation (eg, friendship, altruism, religious belief); and evidence from the rescued. These little–known stories offer a picture of the best of humanity in the worst of times."
16642949,1049,Indelible Shadows: Film and the Holocaust,6613329347,9786613329349,TR,https://s.gr-assets.com/assets/nophoto/book/111x148-bcc042a9c91a29c1d680899eff700a03.png,https://s.gr-assets.com/assets/nophoto/book/50x75-a91bf249278a81aabab721ef782c4a74.png,2002,11,25,,Milliken,true,328461,12,100,117,27,1,5:14|4:10|3:2|2:0|1:1|total:27,1983,6,1,4.33,0,0,"['45606', '1049']","['Annette Insdorf', 'Elie Wiesel']","['3.90', '4.31']",[],[],[],"Indelible Shadows investigates questions raised by films about the Holocaust. How does one make a movie that is both morally just and marketable? Annette Insdorf provides sensitive readings of individual films and analyzes theoretical issues such as the 'truth claims' of the cinematic medium. The third edition of Indelible Shadows includes five additional chapters that cover recent trends, as well as rediscoveries of motion pictures made during and just after World War II. It addresses the treatment of rescuers, as in 'Schindler's List'; the controversial use of humor, as in 'Life is Beautiful'; the distorted image of survivors, and the growing genre of documentaries that return to the scene of the crime or rescue. The annotated filmography offers capsule summaries and information about another hundred Holocaust films from around the world, making this edition an extremely comprehensive discussion of films about the Holocaust, and an invaluable resource for film programmers and educators."
49660576,1049,"Holocaustul în România: distrugerea evreilor și romilor sub regimul Antonescu, 1940-1944",973630115X,9789736301155,TR,https://i.gr-assets.com/images/S/compressed.photo.goodreads.com/books/1576990928l/49660576._SX98_.jpg,https://i.gr-assets.com/images/S/compressed.photo.goodreads.com/books/1576990928l/49660576._SY75_.jpg,2006,,,rum,Hasefer,false,911214,8,184,109,30,3,5:6|4:16|3:2|2:3|1:3|total:30,1998,,,3.63,0,0,"['472582', '1049']","['Radu Ioanid', 'Elie Wiesel']","['4.04', '4.31']",[],[],[],"„Volumul de față este o demonstrație a faptului că istoria se rescrie, se completează, se nuanțează, dar în liniile sale matriceale rămîne aceeași. Condiția suficientă este accesul la arhive și mărturii și o analiză fără prejudecăți a acestora. După mai bine de zece ani de la <i>Evreii sub regimul Ion Antonescu</i>, Radu Ioanid reia tema Holocaustului din România coroborînd noi documente și mărturii. A rezultat o istorie mai amplă a tragediei distrugerii evreilor din România.” (<b>Alexandru Florian</b>)<br /><br /><b>Sumar: </b>Statutul legal al evreilor în România (1800-1944) • Masacrele de la începutul războiului • Lagărele de tranzit, ghetourile, deportările și alte forme de asasinat în masă • Supraviețuirea evreilor români • Destinul evreilor români aflați în străinătate • Guvernul Antonescu prin prisma propriilor declarații"
30264245,1049,"God, Faith & Identity from the Ashes: Reflections of Children and Grandchildren of Holocaust Survivors",1580238246,9781580238243,TR,https://i.gr-assets.com/images/S/compressed.photo.goodreads.com/books/1576047210l/30264245._SX98_.jpg,https://i.gr-assets.com/images/S/compressed.photo.goodreads.com/books/1576047210l/30264245._SY75_.jpg,2014,11,10,,Jewish Lights Publishing,true,42049416,6,110,99,23,3,5:13|4:5|3:4|2:1|1:0|total:23,2014,10,30,4.30,0,0,"['3453839', '1049']","['Menachem Z. Rosensaft', 'Elie Wiesel']","['4.35', '4.31']",[],[],[],"A Powerful, Life-Affirming New Perspective on the Holocaust<br /><br />Almost ninety children and grandchildren of Holocaust survivors theologians, scholars, spiritual leaders, authors, artists, political and community leaders and media personalities from sixteen countries on six continents reflect on how the memories transmitted to them have affected their lives. Profoundly personal stories explore faith, identity and legacy in the aftermath of the Holocaust as well as our role in ensuring that future genocides and similar atrocities never happen again.<br /><br />There have been many books and studies about children of Holocaust survivors the so-called second and third generations with a psycho-social focus. This book is different. It is intended to reflect what they believe, who they are and how that informs what they have done and are doing with their lives.<br /><br />From major religious or intellectual explorations to shorter commentaries on experiences, quandaries and cultural, political and personal affirmations, almost ninety contributors from sixteen countries respond to this question: how have your parents' and grandparents' experiences and examples helped shape your identity and your attitudes toward God, faith, Judaism, the Jewish people and the world as a whole?<br /><br />For people of all faiths and backgrounds, these powerful and deeply moving statements will have a profound effect on the way our and future generations understand and shape their understanding of the Holocaust.<br /><br />Praise from Pope Francis for Menachem Rosensaft's essay reconciling God's presence with the horrors of the Holocaust:<br /><br />""When you, with humility, are telling us where God was in that moment, I felt within me that you had transcended all possible explanations and that, after a long pilgrimage sometimes sad, tedious or dull you came to discover a certain logic and it is from there that you were speaking to us; the logic of First Kings 19:12, the logic of that 'gentle breeze' (I know that it is a very poor translation of the rich Hebrew expression) that constitutes the only possible hermeneutic interpretation.<br /><br />""Thank you from my heart. And, please, do not forget to pray for me. May the Lord bless you.""<br /><br />His Holiness Pope Francis<br /><br />Contributors:<br /><br />Justice Rosalie Silberman Abella of the Supreme Court of Canada<br /><br />Historian Ilya Altman, cofounder and cochairman, Russian Research and Educational Holocaust Center, Moscow<br /><br />New York Times reporter and author Joseph Berger, New York<br /><br />Historian Eleonora Bergman, former director, Jewish Historical Institute, Warsaw<br /><br />Vivian Glaser Bernstein, former cochief, Group Programmes Unit, United Nations Department of Public Information, New York<br /><br />Michael Brenner, professor of Jewish history and culture, Ludwig-Maximilians University of Munich; chair in Israel studies, American University, Washington, DC<br /><br />Novelist and poet Lily Brett, winner of the Commonwealth Writers Prize Award, New York<br /><br />New York Times deputy national news editor and former Jerusalem bureau chief Ethan Bronner, New York<br /><br />Stephanie Butnick, associate editor, Tablet Magazine, New York<br /><br />Rabbi Chaim Zev Citron, Ahavas Yisroel Synagogue and Yeshiva Ohr Elchonon Chabad, Los Angeles<br /><br />Dr. Stephen L. Comite, assistant clinical professor of dermatology, Mount Sinai Hospital, New York<br /><br />Elaine Culbertson, director of a program taking American high school teachers to study Holocaust sites, New York<br /><br />Former Israeli Minister of Internal Security and Shin Bet director Avi Dichter, Israel<br /><br />Lawrence S. Elbaum, attorney, New York<br /><br />Alexis Fishman, Australian actor and singer<br /><br />Shimon Koffler Fogel, CEO, Centre for Israel and Jewish Affairs, Ottawa<br /><br />Dr. Eva Fogelman, psychologist and author, New York<br /><br />Associate Judge Karen ""Chaya"" Friedman of the Circuit Court of Maryland<br /><br />Natalie Friedman, dean of studies and senior class dean, Barnard College, New York<br /><br />Michael W. Grunberger, director of collections, U.S. Holocaust Memorial Museum, Washington, DC<br /><br />David Harris, executive director, American Jewish Committee, New York<br /><br />Author Eva Hoffman, recipient of the Jean Stein Award from the American Academy of Arts and Letters, London<br /><br />Rabbi Abie Ingber, executive director, Center for Interfaith Community Engagement, Xavier University, Cincinnati, OH<br /><br />Josef Joffe, editor-publisher, Die Zeit, Germany<br /><br />Rabbi Lody B. van de Kamp, author; former member of the Chief Rabbinate of Holland and the Conference of European Rabbis, Holland<br /><br />Rabbi Lilly Kaufman, Torah Fund director, The Jewish Theological Seminary of America, New York<br /><br />Filmmaker Aviva Kempner, Washington, DC<br /><br />Cardiologist Dr. David N. Kenigsberg, Plantation, FL<br /><br />Author and Shalom Hartman Institute fellow Yossi Klein Halevi, Israel<br /><br />Attorney Faina Kukliansky, chairperson, Jewish Community of Lithuania, Vilnius<br /><br />Rabbi Benny Lau, Ramban Synagogue, Jerusalem<br /><br />Amichai Lau-Lavie, founding director, Storahtelling, Israel/New York<br /><br />Philanthropist Jeanette Lerman- Neubauer, Philadelphia<br /><br />Hariete Levy, insurance actuary, Paris<br /><br />Annette Levy-Willard, journalist and author, Paris<br /><br />Rabbi Mordechai Liebling, Reconstructionist Rabbinical College, Philadelphia<br /><br />Knesset member Rabbi Dov Lipman, Israel<br /><br />Rabbi Michael Marmur, provost, Hebrew Union College Jewish Institute of Religion, Jerusalem<br /><br />International banker Julius Meinl, president, Euro-Asian Jewish Congress, Prague<br /><br />Knesset member and former journalist Merav Michaeli, Israel<br /><br />The Right Honourable David Miliband, former foreign secretary, United Kingdom; president, International Rescue Committee, New York<br /><br />Tali Nates, director, Johannesburg Holocaust and Genocide Centre, South Africa<br /><br />Eric Nelson, professor of government, Harvard University<br /><br />Eddy Neumann, esq., Sydney, Australia<br /><br />Mathew S. Nosanchuk, Director for Outreach, National Security Council, the White House, Washington, DC<br /><br />Artist and author Aliza Olmert, Jerusalem<br /><br />Couples therapist Esther Perel, New York<br /><br />Sylvia Posner, administrative executive to the Board of Governors, Hebrew Union College Jewish Institute of Religion, New York<br /><br />Rabbi Joseph Potasnik, executive vice president, New York Board of Rabbis<br /><br />Dr. Richard Prasquier, past president, Conseil Representatif des Institutions Juives de France (Representative Council of French Jewish Institutions), Paris<br /><br />Richard Primus, professor of law, University of Michigan Law School<br /><br />Professor Shulamit Reinharz, director, the Women s Studies Research Center and the Hadassah-Brandeis Institute, Brandeis University, MA<br /><br />Chaim Reiss, CFO, World Jewish Congress<br /><br />Jochi (Jochevet) Ritz-Olewski, former vice dean of academic studies, The Open University of Israel<br /><br />Moshe Ronen, vice president, World Jewish Congress; former president, Canadian Jewish Congress, Toronto<br /><br />Novelist and Fordham University law professor Thane Rosenbaum, New York<br /><br />Rabbi Dr. Bernhard H. Rosenberg, Congregation Beth-El, Edison, NJ<br /><br />Art historian and museum director Jean Bloch Rosensaft, New York<br /><br />Menachem Z. Rosensaft, general counsel, World Jewish Congress and professor of law, New York<br /><br />Hannah Rosenthal, former U.S. State Department special envoy to monitor and combat anti-Semitism, Wisconsin<br /><br />Rabbi Judith Schindler, Temple Beth El, Charlotte, NC<br /><br />Clarence Schwab, equity investor, New York<br /><br />Cantor Azi Schwartz, Park Avenue Synagogue, New York<br /><br />Ghita Schwarz, senior attorney, Center for Constitutional Rights, New York<br /><br />Psychologist Dr. David Senesh, Tel Aviv<br /><br />Florence Shapiro, former mayor, Plano, Texas, and former state senator, Texas<br /><br />Rabbi Kinneret Shiryon, Kehillat YOZMA, Modi in, Israel<br /><br />David Silberklang, senior historian, Yad Vashem, Israel<br /><br />Documentary film maker and author Andre Singer, London<br /><br />Peter Singer, professor of bioethics, Princeton University<br /><br />Robert Singer, CEO and executive vice president, World Jewish Congress<br /><br />Psychologist Dr. Yaffa Singer, Tel Aviv<br /><br />Sam Sokol, reporter, The Jerusalem Post, Israel<br /><br />Philanthropist Alexander Soros, New York<br /><br />Rabbi Elie Kaplan Spitz, Congregation B nai Israel, Tustin, CA<br /><br />Michael Ashley Stein, executive director, Harvard Law School Project on Disability<br /><br />Rabbi Kenneth A. Stern, Congregation Gesher Shalom, Fort Lee, NJ<br /><br />Maram Stern, associate CEO for diplomacy, World Jewish Congress, Brussels<br /><br />Carol Kahn Strauss, international director, Leo Baeck Institute, New York<br /><br />Aviva Tal, lecturer in Yiddish literature, Bar Ilan University, Israel<br /><br />Professor Katrin Tenenbaum, scholar on modern Jewish culture and philosophical thought, University of Rome<br /><br />Dr. Mark L. Tykocinski, dean, Jefferson Medical College, Philadelphia<br /><br />Rabbi Moshe Waldoks, Temple Beth Zion, Brookline, MA<br /><br />Psychologist Diana Wang, president, Generaciones de la Shoa en Argentina, Buenos Aires<br /><br />Author Ilana Weiser-Senesh, Tel Aviv<br /><br />Jeffrey S. Wiesenfeld, former senior aide to New York Governor George Pataki and U.S. Senator Alfonse D Amato<br /><br />U.S. Senator Ron Wyden, Oregon<br /><br />Sociologist Tali Zelkowicz, Hebrew Union College Jewish Institute of Religion, Los Angeles"""
864518,1049,Se taire est impossible,2842050266,9782842050269,TR,https://i.gr-assets.com/images/S/compressed.photo.goodreads.com/books/1508251127l/864518._SX98_.jpg,https://i.gr-assets.com/images/S/compressed.photo.goodreads.com/books/1508251127l/864518._SX50_.jpg,1995,,,fre,Arte,false,849927,2,45,97,23,1,5:11|4:9|3:1|2:1|1:1|total:23,,,,4.22,20,1,"['39317', '1049']","['Jorge Semprún', 'Elie Wiesel']","['4.04', '4.31']",[],[],[],
438482,1049,Never Again?,0060730692,9780060730697,TR,https://s.gr-assets.com/assets/nophoto/book/111x148-bcc042a9c91a29c1d680899eff700a03.png,https://s.gr-assets.com/assets/nophoto/book/50x75-a91bf249278a81aabab721ef782c4a74.png,2004,11,2,,HarperOne,false,1792419,4,77,96,27,4,5:4|4:12|3:7|2:3|1:1|total:27,2003,11,1,3.56,20,4,"['538854', '1049']","['Abraham H. Foxman', 'Elie Wiesel']","['3.34', '4.31']",[],[],[],"Anti-Semitism remains a pernicious form of ethnic and religious intolerance and an assault on the fundamentals of human dignity and human rights. Exploring the history of anti-Semitism and providing the first comprehensive examination of the new rampant anti-Jewish sentiment worldwide, Abraham Foxman, national director of the Anti-Defamation League, offers a crucial discussion of the steps that must be taken to prevent this century from witnessing a replay of the horrors of the last."
7011494,1049,Imperfect Justice,0641695098,9780641695094,TR,https://s.gr-assets.com/assets/nophoto/book/111x148-bcc042a9c91a29c1d680899eff700a03.png,https://s.gr-assets.com/assets/nophoto/book/50x75-a91bf249278a81aabab721ef782c4a74.png,,,,,,false,911213,5,100,85,22,7,5:6|4:9|3:5|2:2|1:0|total:22,2002,12,31,3.86,0,0,"['472580', '1049']","['Stuart E. Eizenstat', 'Elie Wiesel']","['4.04', '4.31']",[],[],[],
16207337,1049,L'ebreo errante,8880574132,9788880574132,TR,https://i.gr-assets.com/images/S/compressed.photo.goodreads.com/books/1387521683l/16207337._SY160_.jpg,https://i.gr-assets.com/images/S/compressed.photo.goodreads.com/books/1387521683l/16207337._SY75_.jpg,1983,,,ita,Giuntina,false,22162760,4,68,81,20,4,5:7|4:9|3:3|2:0|1:1|total:20,1966,6,1,4.05,13,3,['1049'],['Elie Wiesel'],['4.31'],[],[],[],"(...) Ma, nel momento del cheshbon hanefesh, facendo il bilancio della mia vita, devo riconoscere che i miei veri maestri, per guidarmi e per spingermi avanti, mi attendono non in luoghi prestigiosi e lontani ma nelle piccole aule piene d'ombre e di canti dove un ragazzo al quale assomigliavo studia ancora oggi la prima pagina del primo trattato del Talmud, sicuro di trovarvi tutte le risposte a tutte le domande. Meglio: tutte le risposte e tutte le domande. Perciò, spesso per me l'atto di scrivere non è altro che il desiderio inconfessato o cosciente di incidere alcune parole su una pietra tombale: alla memoria di una città scomparsa, di un'infanzia esiliata e di tutti coloro che ho amato e che se ne sono andati prima che abbia potuto dirglielo. Elie Wiesel"
3270563,1049,Voices from the Holocaust,0453003966,9780453003964,TR,https://i.gr-assets.com/images/S/compressed.photo.goodreads.com/books/1302269894l/3270563._SX98_.jpg,https://i.gr-assets.com/images/S/compressed.photo.goodreads.com/books/1302269894l/3270563._SX50_.jpg,1981,4,21,,Dutton Books,false,3306723,4,68,77,18,2,5:11|4:2|3:4|2:1|1:0|total:18,1981,4,21,4.28,18,2,"['644428', '1049']","['Sylvia Rothchild', 'Elie Wiesel']","['4.18', '4.31']",[],[],[],
1295946,1049,"Who Shall Live, Who Shall Die",0892633301,9780892633302,TR,https://s.gr-assets.com/assets/nophoto/book/111x148-bcc042a9c91a29c1d680899eff700a03.png,https://s.gr-assets.com/assets/nophoto/book/50x75-a91bf249278a81aabab721ef782c4a74.png,1994,11,1,,Texas A University Press,false,1285077,9,102,76,20,1,5:5|4:8|3:5|2:2|1:0|total:20,1963,,,3.80,8,1,"['72074', '1049']","['Daniel Stern', 'Elie Wiesel']","['3.57', '4.31']",[],[],[],"Amidst the lights and glamour of the New York theater district during the 1950s, two Holocaust survivors confront each other in order to reckon with a common past—one that hides an awful secret. Jud Kramer, a successful stage director, is in the midst of mounting his most painful and personal play while trying to enjoy the happiness he has found with his beautiful actress wife and baby daughter. Into his life comes Carl Walkowitz, a brooding, charismatic drifter who displays the scars of his concentration camp past in his wounded leg and half-closed eye.<br /><br />It is the relationship of these two men, one who lives in the past and the other trying to grasp hold of the present, that drives the story of <i>Who Shall Live, Who Shall Die</i> to its terrifying conclusion. Step by step, inexorably, Walkowitz strips Jud of everything dear to him, until finally, standing on an empty stage, the two men, with a woman between them, come face to face in a life-and-death struggle only one of them can survive."
2861969,1049,Conversations with Elie Wiesel,0912083581,9780912083582,TR,https://s.gr-assets.com/assets/nophoto/book/111x148-bcc042a9c91a29c1d680899eff700a03.png,https://s.gr-assets.com/assets/nophoto/book/50x75-a91bf249278a81aabab721ef782c4a74.png,1992,5,1,,Taylor Trade Publishing,false,2888109,1,65,74,17,0,5:10|4:4|3:2|2:1|1:0|total:17,1992,5,25,4.35,17,0,"['956294', '1049']","['Harry J. Cargas', 'Elie Wiesel']","['4.00', '4.31']",[],[],[],"This is an intense and moving dialogue rising out of the Holocaust and extending to the crucial issues of the present. Noted author and teacher Harry James Cargas probes the existence and meaning of good and evil, love and hatred, bigotry and openness with Nobel Laureate, writer, and Holocaust survivor, Elie Wiesel. The result is an in-depth and fascinating look into the religious, literary, and private views of one of the major religious figures of our time."
25323887,1049,Nobel Prize Acceptance Speech,,,TR,https://i.gr-assets.com/images/S/compressed.photo.goodreads.com/books/1428533910l/25323887._SX98_.jpg,https://i.gr-assets.com/images/S/compressed.photo.goodreads.com/books/1428533910l/25323887._SX50_.jpg,1986,,,eng,,false,45057443,4,89,71,16,5,5:12|4:1|3:2|2:0|1:1|total:16,1986,1,1,4.44,15,5,['1049'],['Elie Wiesel'],['4.31'],[],[],[],"Nobel Prize Acceptance Speech delivered by 1986 awardee, Elie Wiesel."
41545289,1049,"The Night Trilogy: Night, Dawn, Day (3 Book Series)",,,TR,https://s.gr-assets.com/assets/nophoto/book/111x148-bcc042a9c91a29c1d680899eff700a03.png,https://s.gr-assets.com/assets/nophoto/book/50x75-a91bf249278a81aabab721ef782c4a74.png,,,,,,true,64817690,1,68,70,16,1,5:8|4:6|3:2|2:0|1:0|total:16,,,,4.38,16,1,['1049'],['Elie Wiesel'],['4.31'],"['329396', '658034', '3882881']","['Marion Wiesel', 'Frances Frenaye', 'Anne Borchardt']","['4.33', '3.94', '3.85']",
1036995,1049,Tikvah,0756776953,9780756776954,TR,https://s.gr-assets.com/assets/nophoto/book/111x148-bcc042a9c91a29c1d680899eff700a03.png,https://s.gr-assets.com/assets/nophoto/book/50x75-a91bf249278a81aabab721ef782c4a74.png,1999,3,1,eng,Diane Pub Co,false,2216051,3,65,67,16,1,5:9|4:3|3:3|2:0|1:1|total:16,1999,3,1,4.19,12,1,"['1712598', '48836', '6603', '8725', '70868', '92874', '52633', '15420', '4343', '137553', '68572', '1049', '159563', '1954', '15380', '3362', '2926393']","['Norman D. Stevens', 'Victoria Chess', 'Trina Schart Hyman', 'Tomie dePaola', 'Jerry Pinkney', 'Jane Dyer', 'Tom Feelings', 'Ed Young', 'Marianna Mayer', 'William Joyce', 'Steven Kellogg', 'Elie Wiesel', 'Anita Lobel', 'Natalie Babbitt', 'Leonard Baskin', 'Eric Carle', 'Normand L. Chartier']","['4.15', '3.76', '4.13', '4.14', '4.14', '4.10', '3.94', '4.01', '4.29', '4.25', '4.09', '4.31', '3.97', '3.87', '3.75', '4.22', '4.19']",[],[],[],
1036996,1049,Memoir in Two Voices,1559703792,9781559703796,TR,https://s.gr-assets.com/assets/nophoto/book/111x148-bcc042a9c91a29c1d680899eff700a03.png,https://s.gr-assets.com/assets/nophoto/book/50x75-a91bf249278a81aabab721ef782c4a74.png,1997,6,12,,Arcade Publishing,false,1023342,9,75,66,19,3,5:2|4:8|3:6|2:3|1:0|total:19,1995,5,1,3.47,15,2,"['446469', '1049']","['François Mitterrand', 'Elie Wiesel']","['3.88', '4.31']",[],[],[],"Instead of writing a formal memoir, Francois Mitterrand asked his longtime friend Elie Wiesel to join him in exploring a wide variety of subjects. The result is a probing and thought-provoking dialogue on topics ranging from literature and memory, childhood and faith to power and politics, including Mitterrand's late disclosure that he had worked for the collaborationist Vichy regime during World War II and, afterward, remained friends for many years with a former Vichy official who had deported Jews to the Nazi death camps. Moving, honest, and sincere, Memoir in Two Voices is a testament to two of our day's great minds."
80597,1049,Hope Against Hope: Johann Baptist Metz and Elie Wiesel Speak Out on the Holocaust,0809138468,9780809138463,TR,https://s.gr-assets.com/assets/nophoto/book/111x148-bcc042a9c91a29c1d680899eff700a03.png,https://s.gr-assets.com/assets/nophoto/book/50x75-a91bf249278a81aabab721ef782c4a74.png,1999,5,1,,Paulist Press,false,77824,1,41,57,13,1,5:8|4:2|3:3|2:0|1:0|total:13,1999,5,,4.38,13,1,"['45890', '1049', '189827', '3882885', '3882886']","['Ekkehard Schuster', 'Elie Wiesel', 'Johann Baptist Metz', 'Reinhold Bochert-Kimmig', 'J. Matth Ashley']","['4.43', '4.31', '4.22', '4.38', '4.38']",[],[],[],"Interviews with these two important figures who speak about how to conceive of who God is in of the light of the Holocaust. Emphasize in copy that these are two independent interviews. Also, mention Metz's A Passion for God. An academic catalog selection."
6034485,1049,Elie Wiesel Reading From His Works; The Gates Of Forest; Night; The Song Of The Dead; The Jews Of Silence,0804510059,9780804510059,TR,https://s.gr-assets.com/assets/nophoto/book/111x148-bcc042a9c91a29c1d680899eff700a03.png,https://s.gr-assets.com/assets/nophoto/book/50x75-a91bf249278a81aabab721ef782c4a74.png,,,,,,false,6209985,1,68,51,12,0,5:7|4:3|3:1|2:0|1:1|total:12,,,,4.25,12,0,['1049'],['Elie Wiesel'],['4.31'],[],[],[],
