id,author_id,title,isbn,isbn13,country_code,image_url,small_image_url,publication_year,publication_month,publication_day,language_code,publisher,is_ebook,work_id,total_editions_count,total_added_by,total_rating_sum,total_rating_count,total_text_reviews_count,rating_dist,original_publication_year,original_publication_month,original_publication_day,average_rating,ratings_count,text_reviews_count,authors_ids,authors_names,authors_average_rating,translators_ids,translators_names,translators_average_rating,description
33516456,1049,"The Iaşi Pogrom, June-July 1941: A Photo Documentary from the Holocaust in Romania",0253025834,9780253025838,TR,https://s.gr-assets.com/assets/nophoto/book/111x148-bcc042a9c91a29c1d680899eff700a03.png,https://s.gr-assets.com/assets/nophoto/book/50x75-a91bf249278a81aabab721ef782c4a74.png,2017,9,25,,Indiana University Press,false,54276828,1,9,5,1,1,5:1|4:0|3:0|2:0|1:0|total:1,,,,5.00,1,1,"['472582', '1049', '6390914']","['Radu Ioanid', 'Elie Wiesel', 'Alexandru Florian']","['4.04', '4.31', '4.17']",[],[],[],"More than 13,000 Jews were murdered during nine days in the early summer of 1941 in Romania: in Iaşi (Jassy) and in two death trains. This pogrom is one of the most thoroughly visually documented events of the Holocaust in that members of the Romanian intelligence services photographed the continuing massacre that they themselves were coordinating. German troops, present in the city and involved in the massacre, were allowed to photograph the atrocities and to send those ""souvenirs"" of the Eastern Front to their family members. Yet these images are, for the most part, unknown to the general public. Long inaccessible even to scholars, the Romanian archives opened recently under pressure from civil society.<br /><br /><br /><br />The 127 photographs shown and described in this album, accompanied by survivors' and even perpetrators' testimonies, were collected after the war but most of this evidence remained hidden away for decades. Together they are invaluable and provide unique insight into this monstrous crime committed by the Romanian fascist and brutally antisemitic regime of General Ion Antonescu, a faithful ally of Nazi Germany."
52000808,1049,Otage,,,TR,https://s.gr-assets.com/assets/nophoto/book/111x148-bcc042a9c91a29c1d680899eff700a03.png,https://s.gr-assets.com/assets/nophoto/book/50x75-a91bf249278a81aabab721ef782c4a74.png,,,,,,false,73489057,1,7,5,1,0,5:1|4:0|3:0|2:0|1:0|total:1,2010,8,10,5.00,1,0,['1049'],['Elie Wiesel'],['4.31'],[],[],[],"New York, 1975 : Shaltiel Feigenberg, juif américain, est enlevé en plein jour à Brooklyn. L’événement fait la une des médias internationaux : c’est la première fois qu’une prise d’otage de ce type se produit sur le sol américain.<br />Reclus dans une cave, les yeux bandés, livré à lui-même, le prisonnier se souvient : la déportation, en 1942, des habitants du ghetto de Davarowsk, sa ville natale en Transylvanie ; sa propre survie, enfant, dans la cave d’un comte allemand, officier de renseignements nazi ; la libération de la ville par les soldats de l’Armée rouge ; le récit du père et de l’oncle de Shaltiel, rescapés d’Auschwitz ; la fuite clandestine, en URSS, dès 1941, du frère aîné, membre d’une cellule du Parti communiste juif ; l’émigration aux États-Unis…"
24851927,1049,Sei riflessioni sul Talmud,,,TR,https://s.gr-assets.com/assets/nophoto/book/111x148-bcc042a9c91a29c1d680899eff700a03.png,https://s.gr-assets.com/assets/nophoto/book/50x75-a91bf249278a81aabab721ef782c4a74.png,,,,ita,,true,44498349,1,7,5,1,0,5:1|4:0|3:0|2:0|1:0|total:1,,,,5.00,1,0,['1049'],['Elie Wiesel'],['4.31'],"['1657752', '4145115', '13471684']","['Valentina Pisanty', 'Cristina Demaria', 'Ifat Nesher']","['3.88', '4.67', '5.00']","Immenso codice di legge e dottrina, il Talmud – parola che significa “insegnamento” – è da secoli e millenni l’autentico territorio della vita e del pensiero d’Israele. In ebraico esso è chiamato familiarmente yam “mare”, a segno non soltanto della sua vastità ma soprattutto dell’infinità di direzioni che esso apre a chi vi si rivolge, in un continuo viavai di domande e risposte. Dialogo ininterrotto tra maestri e discepoli, fra generazioni diverse, il Talmud è testo aperto per eccellenza, dalle risonanze infinite. In queste lezioni magistrali pronunciate fra gennaio e febbraio 2000 presso la Scuola Superiore di Studi Umanistici dell’Università di Bologna, Elie Wiesel accompagna lettori e ascoltatori fra le pagine del libro, in cerca di quei temi che toccano le corde d’ogni umana esistenza. Wiesel, forte di una antica consuetudine con l’ebraico e l’aramaico nonché memore di quando egli stesso stava sui banchi di scuola, affronta il testo con la disinvoltura e la modestia di chi nutre verso di esso tanta confidenza quanta inesausta curiosità, poiché il Talmud ha sempre qualche significato ancora da svelare. Il racconto affascina per l’assenza di sistematicità, di pre-ordine, che è la cifra caratteristica di tutta la tradizione ebraica e per questo la fa così consona al pensare moderno, conscio d’essere provvisorio ed imperfetto, mai definitivo. “Non c’è avventura più grande della scoperta di un testo antico”, ci rivela Wiesel ad un certo punto di questo suo appassionato e appassionante viaggio nel Talmud: ed è con l’entusiasmo della scoperta che lo scrittore ci invita ad ascoltare queste antiche parole, già scandite infinite volte dentro le case di studio eppure sempre, sorprendentemente, nuove."
1031127,1049,Night: Curriculum Unit,1560772255,9781560772255,TR,https://s.gr-assets.com/assets/nophoto/book/111x148-bcc042a9c91a29c1d680899eff700a03.png,https://s.gr-assets.com/assets/nophoto/book/50x75-a91bf249278a81aabab721ef782c4a74.png,1992,10,1,,Center for Learning,false,26158987,1,6,5,1,0,5:1|4:0|3:0|2:0|1:0|total:1,,,,5.00,1,0,"['13847258', '1049']","['David R. Hogue', 'Elie Wiesel']","['5.00', '4.31']",[],[],[],"A New Translation From The French By Marion Wiesel<br /><br /><p><i>Night</i> is Elie Wiesel's masterpiece, a candid, horrific, and deeply poignant autobiographical account of his survival as a teenager in the Nazi death camps. This new translation by Marion Wiesel, Elie's wife and frequent translator, presents this seminal memoir in the language and spirit truest to the author's original intent. And in a substantive new preface, Elie reflects on the enduring importance of Night and his lifelong, passionate dedication to ensuring that the world never forgets man's capacity for inhumanity to man.<br /><br /></p><p><i>Night</i> offers much more than a litany of the daily terrors, everyday perversions, and rampant sadism at Auschwitz and Buchenwald; it also eloquently addresses many of the philosophical as well as personal questions implicit in any serious consideration of what the Holocaust was, what it meant, and what its legacy is and will be.<br /></p><p><br />Author Bio: Elie Wiesel is the internationally celebrated author, Nobel<br />laureate, and spokesperson for humanity whose decision to dedicate his life<br />to bearing witness for the Holocaust's martyrs and survivors found its<br />earliest and most enduring voice in Night, his penetrating and profound<br />account of the Nazi death camps. Born in the town of Sighet, Transylvania,<br />he was a teenager when he and his family were taken from their home in 1944<br />to the Auschwitz concentration camp, and then to Buchenwald. Night is the<br />terrifying record of Elie Wiesel's memories of the death of his family, the<br />death of his own innocence, and his despair as a deeply observant Jew<br />confronting the absolute evil of man. <br /></p><p><br />Elie Wiesel is the author of more than forty internationally acclaimed works<br />of fiction and nonfiction. He has been awarded the Presidential Medal of<br />Freedom, the United States of America Congressional Gold Medal, the French<br />Legion of Honor, and, in 1986, the Nobel Peace Prize. He is the Andrew W.<br />Mellon Professor in the Humanities and University Professor at Boston<br />University.</p>"
38819927,1049,Από το Λευκό Πύργο στις πύλες του Άουσβιτς,9602608250,9789602608258,TR,https://i.gr-assets.com/images/S/compressed.photo.goodreads.com/books/1562960648l/38819927._SX98_.jpg,https://i.gr-assets.com/images/S/compressed.photo.goodreads.com/books/1562960648l/38819927._SX50_.jpg,1996,,,gre,Παρατηρητής,false,60394287,1,2,5,1,0,5:1|4:0|3:0|2:0|1:0|total:1,1996,,,5.00,1,0,"['17752084', '19346759', '1049']","['Ιάκωβος Χαντάλι', 'Ηλίας Σαμπετάι', 'Elie Wiesel']","['5.00', '5.00', '4.31']",[],[],[],
713519,1049,Ethics and Memory / Ethik Und Erinnerung,3110156490,9783110156492,TR,https://s.gr-assets.com/assets/nophoto/book/111x148-bcc042a9c91a29c1d680899eff700a03.png,https://s.gr-assets.com/assets/nophoto/book/50x75-a91bf249278a81aabab721ef782c4a74.png,1997,4,24,,de Gruyter,false,699776,2,20,5,1,0,5:1|4:0|3:0|2:0|1:0|total:1,1997,,,5.00,1,0,['1049'],['Elie Wiesel'],['4.31'],[],[],[],
29876552,1049,Evil and Exile: Revised Edition,0268077878,9780268077877,TR,https://i.gr-assets.com/images/S/compressed.photo.goodreads.com/books/1461532122l/29876552._SX98_.jpg,https://i.gr-assets.com/images/S/compressed.photo.goodreads.com/books/1461532122l/29876552._SY75_.jpg,2000,3,15,,University of Notre Dame Press,true,50249354,3,4,5,1,0,5:1|4:0|3:0|2:0|1:0|total:1,,,,5.00,0,0,"['14982442', '1049']","['Michael de Saint Cheron', 'Elie Wiesel']","['4.33', '4.31']",[],[],[],"A six-day series of interviews between Nobel Peace Prize Laureate Elie Wiesel and French journalist Philippe de Saint-Cheron, Evil and Exile probes some of the most crucial and pressing issues facing humankind today. Having survived the unspeakable evil of the Holocaust, Wiesel remained silent for ten years before dedicating his life to the memory of this tragedy, witnessing tirelessly to remind an often indifferent world of its potential for self-destruction. Wiesel offers wise counsel in this volume concerning evil and suffering, life and death, chance and circumstance. Moreover, the dialogue evokes candid and often surprising responses by Wiesel on the Palestinian problem, Judeo-Christian relations, recent changes in the Soviet Union as well as insights into writers such as Kafka, Malraux, Mauriac, and Unamuno."
50912055,1049,Las puertas del bosque,,,TR,https://i.gr-assets.com/images/S/compressed.photo.goodreads.com/books/1580679275l/50912055._SX98_.jpg,https://i.gr-assets.com/images/S/compressed.photo.goodreads.com/books/1580679275l/50912055._SX50_.jpg,1971,,,spa,Aguilar,false,75792007,1,1,4,1,0,5:0|4:1|3:0|2:0|1:0|total:1,,,,4.00,1,0,['1049'],['Elie Wiesel'],['4.31'],[],[],[],
25353895,1049,Le Chant des morts,2020010623,,TR,https://s.gr-assets.com/assets/nophoto/book/111x148-bcc042a9c91a29c1d680899eff700a03.png,https://s.gr-assets.com/assets/nophoto/book/50x75-a91bf249278a81aabab721ef782c4a74.png,,,,eng,,false,45095363,2,5,4,1,0,5:0|4:1|3:0|2:0|1:0|total:1,1966,6,1,4.00,1,0,['1049'],['Elie Wiesel'],['4.31'],[],[],[],
26354694,1049,"Le Crepuscule, Au Loin",2246793637,9782246793632,TR,https://s.gr-assets.com/assets/nophoto/book/111x148-bcc042a9c91a29c1d680899eff700a03.png,https://s.gr-assets.com/assets/nophoto/book/50x75-a91bf249278a81aabab721ef782c4a74.png,1987,3,25,,Grasset,true,46357970,2,6,4,1,0,5:0|4:1|3:0|2:0|1:0|total:1,1987,3,25,4.00,0,0,['1049'],['Elie Wiesel'],['4.31'],[],[],[],"""Au commencement etait non pas le Verbe, mais la Folie."" Folie du monde. Folie de l'Histoire. Folie de ce vieux Juif croise, voici quarante ans, dans le ghetto de Rovidok. Folie de ces prophetes, entre demence et enfance, qui peuplent a nouveau l'univers de Wiesel. Et puis folie, surtout, de cette etrange maison de fous, a New York, ou le narrateur est venu chercher les traces de Pedro, cet ami d'autrefois, disparu au lendemain de la guerre, et sur qui pesent de terribles soupcons. Le narrateur echappera-t-il lui-meme a la folie ? Resistera-t-il a la capiteuse proximite de ses singuliers personnages entre lesquels se trouve, il le sait, la cle de l'enigme qu'il est venu dechiffrer ? Jusqu'au dernier moment, jusqu'au dernier souffle d'une intrigue qui conduit le lecteur de mystere en mystere, ces questions resteront en suspens. A mi-chemin du roman metaphysique et du roman policier, du livre prophetique et du recit d'aventures le plus debride, voici le premier livre d'Elie Wiesel depuis son prix Nobel de la Paix."
49365563,1049,El crepúsculo a lo lejos,9580412553,9789580412557,TR,https://s.gr-assets.com/assets/nophoto/book/111x148-bcc042a9c91a29c1d680899eff700a03.png,https://s.gr-assets.com/assets/nophoto/book/50x75-a91bf249278a81aabab721ef782c4a74.png,,,,,,false,72412792,1,5,4,1,1,5:0|4:1|3:0|2:0|1:0|total:1,,,,4.00,1,1,['1049'],['Elie Wiesel'],['4.31'],[],[],[],"El crepúsculo, a lo lejos, de Elie Wiesel. Esta novela narra la historia de un sobreviviente del holocausto que busca a su mejor amigo, desaparecido tras la Cortina de Hierro durante la Guerra Fría. Un informante anónimo le deja pistas sobre el paradero de su amigo y lo conduce a un manicomio donde podrían darle más información al respecto. Si embargo, lo que encuentra es tiempo para meditar sobre los misterios y las contradicciones del alma humana, mientras, poco a poco, comienza a dudar de su propia cordura. El crepúsculo, a lo lejos, habla del odio, el amor, la tristeza, el crimen, la solidaridad, la crueldad y también sobre la frontera sutil que separa el misticismo de la locura. Un libro inquietante y hermoso. Para leerlo y releerlo mil veces. (Raquel Castro, tomado de <a target=""_blank"" href=""https://ladobe.com.mx/2013/08/el-crepusculo-a-lo-lejos/"" rel=""nofollow"">https://ladobe.com.mx/2013/08/el-crep...</a>)."
36409681,1049,Tacere è impossibile. Dialogo sull'olocausto,8877469072,9788877469076,TR,https://i.gr-assets.com/images/S/compressed.photo.goodreads.com/books/1507963242l/36409681._SX98_.jpg,https://i.gr-assets.com/images/S/compressed.photo.goodreads.com/books/1507963242l/36409681._SX50_.jpg,1996,,,ita,Guanda,false,58104875,1,4,4,1,1,5:0|4:1|3:0|2:0|1:0|total:1,,,,4.00,1,1,"['1049', '39317']","['Elie Wiesel', 'Jorge Semprún']","['4.31', '4.04']",[],[],[],"Un incontro al vertice tra due grandi scrittori, tra due assoluti protagonisti della cultura contemporanea, che nasce da una terribile esperienza comune (il campo di concentramento), ma segnato anche da alcune rilevanti differenze (Wiesel, ebreo, fu deportato, prima ad Auschwitz e poi a Buchenwald per le sue idee politiche). Intorno a questa ""identità-diversità"" si sviluppa una serrata conversazione che non trascura anche i temi di attualità (il rapporto tra il nazismo e le giovani generazioni, il destino della Germania dopo la riunificazione, come tenere in vita la memoria)."
49189403,1049,Wo war Gott? Die Rede in Auschwitz,,9783451293689,TR,https://i.gr-assets.com/images/S/compressed.photo.goodreads.com/books/1575929053l/49189403._SX98_.jpg,https://i.gr-assets.com/images/S/compressed.photo.goodreads.com/books/1575929053l/49189403._SY75_.jpg,2006,,,,Herder Verlag,false,74637197,1,1,4,1,0,5:0|4:1|3:0|2:0|1:0|total:1,,,,4.00,1,0,"['14237759', '1049', '2948576', '189827']","['Benedikt XVI.', 'Elie Wiesel', 'Władysław Bartoszewski', 'Johann Baptist Metz']","['4.58', '4.31', '4.09', '4.22']",[],[],[],
37690308,1049,Judy Glickman Lauder: Beyond the Shadows,1597114499,9781597114493,TR,https://i.gr-assets.com/images/S/compressed.photo.goodreads.com/books/1535602548l/37690308._SX98_.jpg,https://i.gr-assets.com/images/S/compressed.photo.goodreads.com/books/1535602548l/37690308._SX50_.jpg,2018,9,15,,Aperture,false,59322070,1,10,4,1,0,5:0|4:1|3:0|2:0|1:0|total:1,,,,4.00,1,0,"['17535680', '1049']","['Judy Glickman Lauder', 'Elie Wiesel']","['4.00', '4.31']",[],[],[],
39217033,1049,Μακρυνό ηλιοβασίλεμα,9607002512,9789607002512,TR,https://i.gr-assets.com/images/S/compressed.photo.goodreads.com/books/1520966932l/39217033._SY160_.jpg,https://i.gr-assets.com/images/S/compressed.photo.goodreads.com/books/1520966932l/39217033._SY75_.jpg,1989,,,gre,Aquarius,false,60798018,1,2,4,1,0,5:0|4:1|3:0|2:0|1:0|total:1,,,,4.00,1,0,['1049'],['Elie Wiesel'],['4.31'],['5399704'],['Λίνα Σταματιάδη'],['3.62'],
20442126,1049,Unlikely Allies,,,TR,https://s.gr-assets.com/assets/nophoto/book/111x148-bcc042a9c91a29c1d680899eff700a03.png,https://s.gr-assets.com/assets/nophoto/book/50x75-a91bf249278a81aabab721ef782c4a74.png,,,,,,true,31038509,1,37,4,1,0,5:0|4:1|3:0|2:0|1:0|total:1,2012,9,5,4.00,1,0,"['1049', '7737910']","['Elie Wiesel', 'Claire Sue Townsend']","['4.31', '4.00']",[],[],[],
957882,1049,"Lessons and Legacies III: Memory, Memorialization, and Denial",0810116669,9780810116665,TR,https://i.gr-assets.com/images/S/compressed.photo.goodreads.com/books/1356476322l/957882._SX98_.jpg,https://i.gr-assets.com/images/S/compressed.photo.goodreads.com/books/1356476322l/957882._SY75_.jpg,1999,1,20,,Northwestern University Press,false,942792,2,10,4,1,0,5:0|4:1|3:0|2:0|1:0|total:1,1999,1,20,4.00,1,0,"['287492', '1049', '752869']","['Peter Hayes', 'Elie Wiesel', 'Theodore Zev Weiss']","['4.16', '4.31', '4.00']",[],[],[],"The process of looking back on the Holocaust is one of a double nature: it can bring both enlightenment and a paralyzing pain, particularly for its survivors. This volume addresses the process of looking back, the challenges to understanding of unimaginable horrors that took place, and how academia, media, popular attitudes, and even judicial mind-sets handle that process.<br /><br />A collection of nineteen essays, this book is organized into four sections: the first focuses on how various fields of study can open new perspectives on the Holocaust and sharpen old ones; the second examines culture and politics in Germany before and after 1933; the third addresses the problems associated with the memorialization of those years; and the final section examines the shocking denials of the Holocaust.<br />"
14883848,1049,Linneas Windowsill Garden,0676570496,9780676570496,TR,https://s.gr-assets.com/assets/nophoto/book/111x148-bcc042a9c91a29c1d680899eff700a03.png,https://s.gr-assets.com/assets/nophoto/book/50x75-a91bf249278a81aabab721ef782c4a74.png,1997,11,1,,Storey Books,false,20537593,1,7,4,1,0,5:0|4:1|3:0|2:0|1:0|total:1,1997,11,1,4.00,1,0,"['127782', '1049']","['Storey Publishing', 'Elie Wiesel']","['3.79', '4.31']",[],[],[],
10552081,1049,Prisoner of Hope,1584652527,9781584652526,TR,https://s.gr-assets.com/assets/nophoto/book/111x148-bcc042a9c91a29c1d680899eff700a03.png,https://s.gr-assets.com/assets/nophoto/book/50x75-a91bf249278a81aabab721ef782c4a74.png,2002,6,1,,Brandeis University Press,false,4890453,2,10,4,1,0,5:0|4:1|3:0|2:0|1:0|total:1,1996,3,1,4.00,0,0,"['2008799', '1049']","['Moshe Prywes', 'Elie Wiesel']","['4.00', '4.31']",[],[],[],Israel's leading medical educator recounts his odyssey from tragedy to triumph.
2889885,1049,Marc Klionsky,155595216X,9781555952167,TR,https://s.gr-assets.com/assets/nophoto/book/111x148-bcc042a9c91a29c1d680899eff700a03.png,https://s.gr-assets.com/assets/nophoto/book/50x75-a91bf249278a81aabab721ef782c4a74.png,2004,6,25,,Hudson Hills Press,false,2916139,1,9,4,1,0,5:0|4:1|3:0|2:0|1:0|total:1,2004,7,25,4.00,1,0,"['16157515', '1049']","['John    Russell', 'Elie Wiesel']","['3.79', '4.31']",[],[],[],"This richly illustrated volume comprehensively explores Russian-born Marc Klionsky's life and work, from his years in the Soviet Union through his life in New York today. His exceptional talent and thorough technical training led to a distinguished art career in the Soviet Union, but his success did not allay his desire to experience the self-determination only a democracy could provide. Together with his family, Klionsky emigrated to the United States in 1974, and cultivated elements of lyricism, surrealism, and representation never seen in his previous paintings. Anticipated to become the benchmark reference on Klionsky and his renowned achievements in portraiture, this monograph features stunning colour plates and captivating documentary materials"
39402432,1049,8th Grade Books : Night - The Devil's Arithmetic - I Have Lived A Thousand Years: Growing Up In The Holocaust (Book Sets for Teens : Grade 8 - 12),1482741857,9781482741858,TR,https://s.gr-assets.com/assets/nophoto/book/111x148-bcc042a9c91a29c1d680899eff700a03.png,https://s.gr-assets.com/assets/nophoto/book/50x75-a91bf249278a81aabab721ef782c4a74.png,,,,,,false,61060014,1,21,3,1,0,5:0|4:0|3:1|2:0|1:0|total:1,,,,3.00,1,0,"['1049', '5989', '17860054']","['Elie Wiesel', 'Jane Yolen', 'Livia Bitton-Jackson']","['4.31', '3.96', '4.15']",[],[],[],
19447483,1049,Rabbi Pinhas di Korets ovvero la saggezza hassidica (Italian Edition),,,TR,https://s.gr-assets.com/assets/nophoto/book/111x148-bcc042a9c91a29c1d680899eff700a03.png,https://s.gr-assets.com/assets/nophoto/book/50x75-a91bf249278a81aabab721ef782c4a74.png,,,,,,true,27534851,1,3,3,1,0,5:0|4:0|3:1|2:0|1:0|total:1,2013,1,13,3.00,1,0,['1049'],['Elie Wiesel'],['4.31'],[],[],[],
32758880,1049,A Consuming Fire,153260632X,9781532606328,TR,https://i.gr-assets.com/images/S/compressed.photo.goodreads.com/books/1513329725l/32758880._SX98_.jpg,https://i.gr-assets.com/images/S/compressed.photo.goodreads.com/books/1513329725l/32758880._SY75_.jpg,2016,8,26,,Wipf & Stock Publishers,false,391026,3,6,3,1,0,5:0|4:0|3:1|2:0|1:0|total:1,1979,,,3.00,0,0,"['125559', '1049']","['John K. Roth', 'Elie Wiesel']","['4.23', '4.31']",[],[],[],"No catastrophe challenges treasured beliefs and cherished hopes more than the Holocaust, Nazi Germany's genocide against the European Jews during World War II. Fueled by virulent, racist anti-Semitism, that disaster, which targeted Judaism as well as every Jewish life within the Third Reich's lethal grasp, still underlines the fragile status of human rights and ethics, still undercuts optimism about human """"progress,"""" and still undermines confidence about God's moral authority, providential engagement with human history, and even God's existence itself. Elie Wiesel, who died in 2016, was one of the relatively few Jews who survived Auschwitz. Before and after receiving the Nobel Peace Prize in 1986, he wrote profoundly in varied genres about the reverberations of the Holocaust. In A Consuming Fire, John K. Roth, a Christian philosopher transformed by Wiesel's writings and friendship, explores how to cope constructively with the daunting realization that Christianity and Western philosophy were deeply implicated in the Nazi genocide--so much so that, in the case of Christianity, one can credibly argue: No Christianity = No Holocaust. A Consuming Fire is not a biography, a literary analysis, a philosophical critique, or a history. Instead it offers a story all its own--one that seeks to enliven a post-Holocaust Christian humanism, an outlook that Roth shares by underscoring his own journey, his quest to be responsible and accountable, as he responds to Holocaust challenges intensified poignantly and insistently by Wiesel's testimony. """"Elie Wiesel's legacy lives on through the writings that inspired John K. Roth to write A Consuming Fire, a book about the challenges posed by the Holocaust to all of us and, in particular, to the contemporary Christian. Through a reading of Wiesel's texts, Roth bears witness both to the horrors of the Holocaust and to the hope that in its aftermath we may better learn to care for the Other."""" --Leonard Grob, Professor Emeritus of Philosophy, Fairleigh Dickinson University """"With probing openness, John K. Roth describes how Elie Wiesel's burning questions have provoked and guided his own search for a credible post-Holocaust Christian faith. A Consuming Fire remains a summons--especially for Christians--to examine 'from the roots up' who we are and ought to be."""" --Henry F. Knight, Professor of Holocaust and Genocide Studies and Director of the Cohen Center for Holocaust and Genocide Studies, Keene State College """"The reissue of John K. Roth's A Consuming Fire: Encounters with Elie Wiesel and the Holocaust is at once timely and urgent. With each passing year, more and more voices of witnesses such as Elie Wiesel--voices that spoke from the depths of a whirlwind of fire--fall silent. Now, as much of the world seethes with the flames of destruction, the need for Roth's testimony and insight is greater than ever."""" --David Patterson, Hillel A. Feinberg Chair in Holocaust Studies, University of Texas at Dallas """"John K. Roth's eloquent and sensitively written book is both personal and provocative, for it reveals the impact that Elie Wiesel and the Holocaust have had on him as a Christian--and as a scholar and teacher. Like Wiesel, his Jewish friend, Roth has become a messenger of hope amidst despair. Reading A Consuming Fire will make you think about the past for the sake of the future; it may even inspire you to become a messenger too."""" --Carol Rittner, RSM, Distinguished Professor of Holocaust and Genocide Studies Emerita and Dr. Marsha Raticoff Grossman Professor of Holocaust Studies Emerita, Stockton University John K. Roth is the Edward J. Sexton Professor Emeritus of Philosophy and the founding director of the Center for the Study of the Holocaust, Genocide, and Human Rights (now the Mgrublian Center for Human Rights) at Claremont McKenna College, where he taught for more than forty years. He is the author or editor of more than fifty books, including Holocaust Politics, reissued b"
