id,author_id,title,isbn,isbn13,country_code,image_url,small_image_url,publication_year,publication_month,publication_day,language_code,publisher,is_ebook,work_id,total_editions_count,total_added_by,total_rating_sum,total_rating_count,total_text_reviews_count,rating_dist,original_publication_year,original_publication_month,original_publication_day,average_rating,ratings_count,text_reviews_count,authors_ids,authors_names,authors_average_rating,translators_ids,translators_names,translators_average_rating,description
20626830,1728,Cmono. Rozmowy z pisarzami,,9788371779701,TR,https://i.gr-assets.com/images/S/compressed.photo.goodreads.com/books/1390572743l/20626830._SX98_.jpg,https://i.gr-assets.com/images/S/compressed.photo.goodreads.com/books/1390572743l/20626830._SX50_.jpg,2013,10,21,pol,Wydawnictwo Poznańskie,false,39913133,1,10,12,4,0,5:0|4:0|3:4|2:0|1:0|total:4,2013,10,21,3.00,4,0,"['3158346', '132761', '86801', '2358251', '34065', '3602', '134980', '15496', '1728', '6238', '25415', '35099', '190431', '2736291']","['Grzegorz Jankowicz', 'Rabih Alameddine', 'John Ashbery', 'Lukas Bärfuss', 'Etgar Keret', 'Alberto Manguel', 'Herta Müller', 'Amos Oz', 'Orhan Pamuk', 'Marjane Satrapi', 'Charles Simic', 'Josef Škvorecký', 'György Spiró', 'Dubravka Ugrešić']","['3.51', '3.83', '4.06', '3.53', '3.98', '3.88', '3.61', '3.86', '3.76', '4.26', '4.05', '3.92', '4.01', '3.82']",[],[],[],"Tygodnik Powszechny i Wydawnictwo Poznańskie przedstawia trzeci tom Biblioteki Tygodnika Powszechnego – książka Cmono to rozmowy z trzynastoma wybitnymi pisarzami przeprowadzone przez krytyka i eseistę, redaktora działu kultury Tygodnika Powszechnego, Grzegorza Jankowicza. Rozmówcami autora są: Rabih Alameddine, John Ashbery, Lukas Bärfuss, Etgar Keret, Alberto Manguel, Herta Müller, Amos Oz, Orhan Pamuk, Marjane Satrapi, Charles Simic oraz Josef Škvorecký, György Spiró i Dubravka Ugrešić. <br /><br />Tytułowe „cmono” to słowo, które pojawia się w pierwszym tomie Słownika języka polskiego Lindego. Według jednej z legendarnych wersji słynny leksykograf ułożył swą księgę tylko po to, by zrozumieć jego sens. Nie szczędził pieniędzy i czasu, by odkryć sens „cmono”. Bez skutku. Umarł niespełniony, targany poczuciem klęski, rozgoryczony. Zagadka została rozwiązana dopiero po jego śmierci. Odpowiedź znajdziecie w książce Jankowicza. <br /><br />Książka, trzeci tom Biblioteki Tygodnika Powszechnego, wydana we współpracy Tygodnika Powszechnego z Wydawnictwem Poznańskim, ukaże się na rynku 21 października 2013 roku. Premiera książki towarzyszyć będzie krakowskiemu Festiwalowi Conrada."
29245427,1728,في مديح الأدب,,9789939434933,TR,https://i.gr-assets.com/images/S/compressed.photo.goodreads.com/books/1456166755l/29245427._SX98_.jpg,https://i.gr-assets.com/images/S/compressed.photo.goodreads.com/books/1456166755l/29245427._SY75_.jpg,2014,,,ara,دار كنعان,false,27357671,2,65,11,3,2,5:1|4:0|3:2|2:0|1:0|total:3,,,,3.67,1,0,"['6544934', '1285555', '1728', '65633', '1197', '134980', '22515']","['أحمد الويزي', 'José Saramago', 'Orhan Pamuk', 'J.M.G. Le Clézio', 'Harold Pinter', 'Herta Müller', 'Mario Vargas Llosa']","['3.68', '4.02', '3.76', '3.65', '3.79', '3.61', '3.97']",[],[],[],على هامش الاحتفالات الرسمية بالجوائز الأدبية التي تعقد في استوكهولم لتسلم جائزة نوبل العتيدة جرت العادة كتقليد في الأكاديمية الملكية، أن يلقي كل من ظفر بالجائزة الأكبر والأشهر، كلمة أدبية بالمناسبة، تعرف بصاحبها وبمشروعه الأدبي<br /><br />جوزيه ساراماغو، أورهان باموك، جان ماري غيستاف لوكليزيو، هارولد بينتر، هونتر مولر، ماريو فرغاس يوسا<br /><br />إن تلك الكلمات على روعتها، لا تحيل فقط على التقليد المتبع هناك، وليست مجرد استجابة له، بل تحيل بعمق على الفضاء الإبداعي الواسع، والإلتزام الأخلاقي الصارم، لأولئك المبدعين، بقضايا البشر، ومناهضة الظلم والاستبداد أينما كان
25341773,1728,Defile,,9789750826535,TR,https://i.gr-assets.com/images/S/compressed.photo.goodreads.com/books/1437826325l/25341773._SX98_.jpg,https://i.gr-assets.com/images/S/compressed.photo.goodreads.com/books/1437826325l/25341773._SX50_.jpg,2013,,,tur,Yapı Kredi Yayınları,false,45079426,1,10,10,2,0,5:2|4:0|3:0|2:0|1:0|total:2,2013,1,1,5.00,2,0,"['3227036', '1728']","['Selçuk Demirel', 'Orhan Pamuk']","['3.91', '3.76']",[],[],[],"“Selçuk Demirel’in çizgilerini sevmemek mümkün mü? <br />Onun resimlerine bakarken kendimizi olduğumuzdan daha akıllı bulduğumuz için severiz Selçuk’un çizgilerini. Yüzümüzde beliren gülümseme hicvetmenin, başkalarının zayıflık ve kusurlarını ortaya dökmenin sevinci değildir. Dünyayı akılla görmenin, Selçuk Demirel’in çizgilerine bakarken zeki olabilmenin memnuniyetini verir bize.”<br />Orhan Pamuk"
11699,1728,Without Boundary: Seventeen Ways of Looking,0870700855,9780870700859,TR,https://s.gr-assets.com/assets/nophoto/book/111x148-bcc042a9c91a29c1d680899eff700a03.png,https://s.gr-assets.com/assets/nophoto/book/50x75-a91bf249278a81aabab721ef782c4a74.png,2006,2,1,,Museum of Modern Art,false,14109,1,30,10,3,0,5:0|4:1|3:2|2:0|1:0|total:3,2006,2,1,3.33,3,0,"['7467', '1728']","['Fereshteh Daftari', 'Orhan Pamuk']","['3.83', '3.76']",[],[],[],"The attention currently directed from the West to the Islamic world has profound ramifications for the art made by those who come from the region but live elsewhere: that origin is increasingly becoming a defining term in the consideration of works by artists such as Mona Hatoum and Shirin Neshat. Resisting any homogenizing impulse, Without Boundary recognizes a need to ask if this art is marked by an Islamic difference. Author and curator Fereshteh Daftari considers issues ranging from the aesthetic legacy of Islamic art to contemporary ideas of identity and faith. Essays by MoMA Director Glenn D. Lowry, whose own academic and curatorial background involves traditional Islamic arts; Homi Bhabha, the preeminent theorist and scholar of the postcolonial condition; and the Turkish writer and novelist Orhan Pamuk, winner of the German Book Peace Prize and author of My Name Is Read and Snow. Artists include Jananne-Al-Ani, Ghada Amer, Kutlug Ataman, The Atlas Group/Walid Raad, Mona Hatoum, Shirazeh Houshiary, Emily Jacir, Y.Z. Kami, Mike Kelley, Rachid Koraichi, Shirin Neshat, Marjane Satrapi, Shirana Shahbazi, Raqib Shaw, Shahzia Sikander and Bill Viola."
23120802,1728,Extraits gratuits - Lectures d'été Gallimard 2014,,,TR,https://s.gr-assets.com/assets/nophoto/book/111x148-bcc042a9c91a29c1d680899eff700a03.png,https://s.gr-assets.com/assets/nophoto/book/50x75-a91bf249278a81aabab721ef782c4a74.png,,,,,,true,42669905,1,10,10,2,0,5:2|4:0|3:0|2:0|1:0|total:2,2014,6,13,5.00,2,0,"['3983305', '168047', '19916', '7486990', '4237', '1966053', '394739', '65633', '2829019', '2408', '904719', '1728', '44677', '3048443', '810151']","['Frank Bill', 'Sophie Chauveau', 'Jonathan Coe', 'Alix Deniger', 'Marc Dugain', 'Maylis de Kerangal', 'Camille Laurens', 'J.M.G. Le Clézio', 'Attica Locke', 'Ian McEwan', 'Jo Nesbø', 'Orhan Pamuk', 'Jean-Christophe Rufin', 'Ferdinand von Schirach', 'Sylvain Tesson']","['3.77', '3.66', '3.79', '3.62', '3.66', '3.77', '3.44', '3.65', '3.69', '3.73', '3.93', '3.76', '3.70', '4.01', '3.84']",[],[],[],
10419844,1728,Die Paris Review 01.,3942377012,9783942377010,TR,https://i.gr-assets.com/images/S/compressed.photo.goodreads.com/books/1468831966l/10419844._SX98_.jpg,https://i.gr-assets.com/images/S/compressed.photo.goodreads.com/books/1468831966l/10419844._SY75_.jpg,,,,ger,,false,15324124,1,24,9,2,0,5:1|4:1|3:0|2:0|1:0|total:2,2011,1,1,4.50,2,0,"['24956', '1357577', '238', '34031', '4155510', '8283398', '1688850', '431149', '1455', '5152', '2778055', '39326', '463', '3534', '1728']","['Dorothy Parker', 'Françoise Sagan', 'Joan Didion', 'David Grossman', 'Alexandra Steffes', 'Judith Steffes', 'Henning Hoff', 'Truman Capote', 'Ernest Hemingway', 'Vladimir Nabokov', 'Kurt Vonnegut Jr.', 'Heinrich Böll', 'Philip Roth', 'Toni Morrison', 'Orhan Pamuk']","['4.08', '3.67', '3.93', '3.81', '4.50', '4.50', '4.50', '4.01', '3.83', '3.89', '4.06', '3.87', '3.81', '3.91', '3.76']",[],[],[],
32069444,1728,داستان افتادن من از داستانم,,9789648765854,TR,https://i.gr-assets.com/images/S/compressed.photo.goodreads.com/books/1474198776l/32069444._SX98_.jpg,https://i.gr-assets.com/images/S/compressed.photo.goodreads.com/books/1474198776l/32069444._SX50_.jpg,2016,,,per,نشر مشکی,false,52715553,1,9,9,4,1,5:0|4:1|3:0|2:2|1:1|total:4,2013,,,2.25,4,1,['1728'],['Orhan Pamuk'],['3.76'],['15796644'],['مژگان دولت\u200cآبادی'],['3.60'],در دل این کتاب کوچک دو موضوع نهفته است که همواره از خیال‌پردازی در مورد آن‌ها لذت برده‌ام<br />یکی چهره‌ی اسرارآمیز تاریخ و دیگری خاطرات دوران کودکی و تحصیلم که در رمان‌ها و متون دیگری که نوشته‌ام،‌ همیشه به این دو موضوع ارجاع داده‌ام و هر بار نیز درهم آمیختگی این موضوعات را در ذهنم حس کرده‌ام. یعنی وجه کودکانه‌ی تاریخ در کنار وجه تاریخی کودکی
25616647,1728,검은 책 1,8937490668,9788937490668,TR,https://i.gr-assets.com/images/S/compressed.photo.goodreads.com/books/1519571909l/25616647._SX98_.jpg,https://i.gr-assets.com/images/S/compressed.photo.goodreads.com/books/1519571909l/25616647._SY75_.jpg,2014,2,3,kor,민음사,false,60332883,1,2,8,2,0,5:1|4:0|3:1|2:0|1:0|total:2,1990,,,4.00,2,0,['1728'],['Orhan Pamuk'],['3.76'],['14988248'],['이난아'],['3.75'],"우리가 사는 삶은 다른 누군가가 꾸는 꿈이다!<br />사라진 아내와 그녀의 의붓오빠를 찾아 이스탄불 전역을 헤매는 남자, <br />그리고 자기 자신을 잃어버린 사람들의 이야기<br /><br />“인생만큼 경이로운 것은 없다, 유일한 위안인 글쓰기를 제외하고는.<br />이스탄불의 풍경, 소리, 냄새로 가득한 미로 같은 소설<br />“진정한 내 목소리를 찾은 작품.” ―오르한 파묵"
52759333,1728,Стамбул. Горад і ўспаміны,,9789857165926,TR,https://s.gr-assets.com/assets/nophoto/book/111x148-bcc042a9c91a29c1d680899eff700a03.png,https://s.gr-assets.com/assets/nophoto/book/50x75-a91bf249278a81aabab721ef782c4a74.png,,,,,,false,73126813,1,7,8,3,0,5:1|4:0|3:0|2:1|1:1|total:3,2003,,,2.67,3,0,"['19509765', '1728']","['Архан Памук', 'Orhan Pamuk']","['2.67', '3.76']",['19510170'],['Таццяна Урублеўская-Токер'],['2.67'],"«Стамбул. Горад і ўспаміны» — адна з самых вядомых кніг славутага турэцкага пісьменніка Архана Памука. Менавіта за ўслаўленне свайго роднага горада Памук атрымаў Нобелеўскую прэмію ў 2006 годзе. Пісьменнік стварыў нязвыклую кнігу: раман-аўтабіяграфія, сямейная сага, энцыклапедыя горада, альбом з цудоўнымі здымкамі і гравюрамі. Аўтар вядзе чытача за руку па сваіх любімых вулках, напоўненых гукамі і пахамі роднага горада, не бачнага турыстам, схаванага ад мімалётных разявак… Як Дублін — Джойсам, Буэнас-Айрэс — Борхесам, так Стамбул услаўлены Памукам.<br /><br /><br />Гэта ўжо чацвёртая кніга нобелеўскіх лаўрэатаў па літаратуры, выдадзеная намі ў серыі ""Noblesse Oblige""."
25616658,1728,검은 책 2,8937490676,9788937490675,TR,https://i.gr-assets.com/images/S/compressed.photo.goodreads.com/books/1519572082l/25616658._SX98_.jpg,https://i.gr-assets.com/images/S/compressed.photo.goodreads.com/books/1519572082l/25616658._SY75_.jpg,2014,2,3,kor,민음사,false,60332895,1,2,7,2,0,5:1|4:0|3:0|2:1|1:0|total:2,1990,,,3.50,2,0,['1728'],['Orhan Pamuk'],['3.76'],['14988248'],['이난아'],['3.75'],"우리가 사는 삶은 다른 누군가가 꾸는 꿈이다!<br />사라진 아내와 그녀의 의붓오빠를 찾아 이스탄불 전역을 헤매는 남자, <br />그리고 자기 자신을 잃어버린 사람들의 이야기<br /><br />“인생만큼 경이로운 것은 없다, 유일한 위안인 글쓰기를 제외하고는.<br />이스탄불의 풍경, 소리, 냄새로 가득한 미로 같은 소설<br />“진정한 내 목소리를 찾은 작품.” ―오르한 파묵"
51629520,1728,Orhan Pamuk: Orange,395829653X,9783958296534,TR,https://s.gr-assets.com/assets/nophoto/book/111x148-bcc042a9c91a29c1d680899eff700a03.png,https://s.gr-assets.com/assets/nophoto/book/50x75-a91bf249278a81aabab721ef782c4a74.png,,,,,,false,73401771,1,7,5,1,0,5:1|4:0|3:0|2:0|1:0|total:1,,,,5.00,1,0,['1728'],['Orhan Pamuk'],['3.76'],[],[],[],"<strong>The streetscapes of Istanbul as photographed by Nobel prize-winning novelist Orhan Pamuk in an exquisitely printed clothbound edition</strong><br /><br />The dominant color in Orhan Pamuk's new book of photographs is orange. When the Nobel-Prize-winning novelist is finished with the day's writing, he takes his camera and wanders through Istanbul's various neighborhoods, visiting the backstreets of his town, areas without tourists, spaces that seem neglected and forgotten, spaces with a particular light. This is the orange light of Istanbul's windows and streetlamps that Pamuk knows so well from his childhood--from the Istanbul of 50 years ago, as he mentions in his introduction.<br />But Pamuk also observes that the homely, cosy orange light is slowly being replaced by a new, bright and icy white light from new lightbulbs. His photographs from the backstreets of Istanbul record and preserve the cosy effect of this old, disappearing orange light, as well as the recognition of this new white vision.<br />Whether reflected in well-trodden snow, concentrated as a glaring ball atop a lamppost or subtly present as a diffuse haze, orange literally and aesthetically gives shape to Pamuk's pictures, which reveal to us the unseen corners of his home city."
29104770,1728,눈 1,8937480662,9788937480669,TR,https://i.gr-assets.com/images/S/compressed.photo.goodreads.com/books/1519571457l/29104770._SX98_.jpg,https://i.gr-assets.com/images/S/compressed.photo.goodreads.com/books/1519571457l/29104770._SX50_.jpg,2005,5,23,kor,민음사,false,60332837,1,2,5,1,0,5:1|4:0|3:0|2:0|1:0|total:1,2002,,,5.00,1,0,['1728'],['Orhan Pamuk'],['3.76'],['14988248'],['이난아'],['3.75'],"&lt;내 이름은 빨강&gt;의 작가 오르한 파묵의 &lt;눈&gt;이 출간됐다. 정치적인 이유로 독일로 망명했던 시인 ‘카’는 어머니의 부음을 받고 12년만에 고향 터키로 돌아온다. 카는 터키 동북부 국경 지역의 카르스에서 벌어지고 있는 소녀들의 연쇄 자살 사건과 시장 선거를 취재하라는 임무를 받고 그곳으로 향한다. 그곳에서 그는 마을 사람들과 경찰청장, 신문사 소장, 시장 후보, 쿠르드인 교주, 이슬람 신학생, 지명 수배된 테러리스트 등 다양한 사람들을 만나게 되는데…. 　 작가의 오랫동안의 관심사였던 이슬람 문명과 기독교 문명의 충돌과 갈등이라는 주제는 &lt;눈&gt;에서 보다 진화한 형태로 나타난다. &lt;눈&gt;의 섬세한 내러티브를 이끄는 주체는 카이지만, 그가 남긴 비망록, 서신과 대화를 통해 카의 행적을 추적하고 전체 이야기를 짜 맞추는 작중 화자는 소설가이자 카의 친구로 등장하는 오르한 파묵이다. 게다가 갈등 구조가 일관성없이 변화무쌍하다. 현재의 당면한 역사를 고민하면서 써 내려간 흔적을 곳곳에서 엿볼 수 있다. 　 서로 다른 문명 간의 갈들과 현재의 터키가 안고 있는 종교적·정치적·사회적 딜레마들을 문학적으로 완벽하게 재구성해 놓았다. 동시에 예술과 인생의 본질을 탐색한다. 2004년 뉴욕 타임스 선정 &lt;올해의 책&gt;."
29104777,1728,눈 2,8937480670,9788937480676,TR,https://i.gr-assets.com/images/S/compressed.photo.goodreads.com/books/1519571640l/29104777._SX98_.jpg,https://i.gr-assets.com/images/S/compressed.photo.goodreads.com/books/1519571640l/29104777._SX50_.jpg,2005,5,28,kor,민음사,false,60332859,1,2,5,1,0,5:1|4:0|3:0|2:0|1:0|total:1,2002,,,5.00,1,0,['1728'],['Orhan Pamuk'],['3.76'],['14988248'],['이난아'],['3.75'],"&lt;내 이름은 빨강&gt;의 작가 오르한 파묵의 &lt;눈&gt;이 출간됐다. 정치적인 이유로 독일로 망명했던 시인 ‘카’는 어머니의 부음을 받고 12년 만에 고향 터키로 돌아온다. 카는 터키 동북부 국경 지역의 카르스에서 벌어지고 있는 소녀들의 연쇄 자살 사건과 시장 선거를 취재하라는 임무를 받고 그곳으로 향한다. 그곳에서 그는 마을 사람들과 경찰청장, 신문사 소장, 시장 후보, 쿠르드인 교주, 이슬람 신학생, 지명 수배된 테러리스트 등 다양한 사람들을 만나게 되는데…. 　 작가의 오랫동안의 관심사였던 이슬람 문명과 기독교 문명의 충돌과 갈등이라는 주제는 &lt;눈&gt;에서 보다 진화한 형태로 나타난다. &lt;눈&gt;의 섬세한 내러티브를 이끄는 주체는 카이지만, 그가 남긴 비망록, 서신과 대화를 통해 카의 행적을 추적하고 전체 이야기를 짜 맞추는 작중 화자는 소설가이자 카의 친구로 등장하는 오르한 파묵이다. 게다가 갈등 구조가 일관성없이 변화무쌍하다. 현재의 당면한 역사를 고민하면서 써내려간 흔적을 곳곳에서 엿볼 수 있다. 　 서로 다른 문명 간의 갈들과 현재의 터키가 안고 있는 종교적·정치적·사회적 딜레마들을 문학적으로 완벽하게 재구성해 놓았다. 동시에 예술과 인생의 본질을 탐색한다. 2004년 뉴욕 타임스 선정 &lt;올해의 책&gt;. &lt;제2권&gt;"
50035508,1728,Distant Relations,,,TR,https://s.gr-assets.com/assets/nophoto/book/111x148-bcc042a9c91a29c1d680899eff700a03.png,https://s.gr-assets.com/assets/nophoto/book/50x75-a91bf249278a81aabab721ef782c4a74.png,,,,,,false,72595371,1,13,5,1,0,5:1|4:0|3:0|2:0|1:0|total:1,,,,5.00,1,0,['1728'],['Orhan Pamuk'],['3.76'],[],[],[],short story
44017660,1728,Le voci di Istambul. Scritti e interviste,8879813161,9788879813167,TR,https://i.gr-assets.com/images/S/compressed.photo.goodreads.com/books/1550252735l/44017660._SY160_.jpg,https://i.gr-assets.com/images/S/compressed.photo.goodreads.com/books/1550252735l/44017660._SY75_.jpg,2007,2,,ita,Datanews editrice,false,68438659,1,2,4,1,1,5:0|4:1|3:0|2:0|1:0|total:1,,,,4.00,1,1,['1728'],['Orhan Pamuk'],['3.76'],"['18883145', '5233867']","['Marina Bernabei', ""Barbara D'Andò""]","['4.00', '3.69']",
41842984,1728,من درەختێکم,,,TR,https://i.gr-assets.com/images/S/compressed.photo.goodreads.com/books/1537107702l/41842984._SX98_.jpg,https://i.gr-assets.com/images/S/compressed.photo.goodreads.com/books/1537107702l/41842984._SX50_.jpg,2018,,,,ئەندێشە,false,65325272,1,3,3,1,0,5:0|4:0|3:1|2:0|1:0|total:1,,,,3.00,1,0,['1728'],['Orhan Pamuk'],['3.76'],[],[],[],
7344892,1728,Frankfurt Book Fair 2008 Opening Speech,0955574560,9780955574566,TR,https://i.gr-assets.com/images/S/compressed.photo.goodreads.com/books/1558701170l/7344892._SX98_.jpg,https://i.gr-assets.com/images/S/compressed.photo.goodreads.com/books/1558701170l/7344892._SX50_.jpg,2009,1,14,eng,Edinburgh Review,false,9075678,1,21,3,1,0,5:0|4:0|3:1|2:0|1:0|total:1,,,,3.00,1,0,['1728'],['Orhan Pamuk'],['3.76'],['157141'],['Maureen Freely'],['3.66'],
15920739,1728,고요한 집 1,8937484226,9788937484223,TR,https://i.gr-assets.com/images/S/compressed.photo.goodreads.com/books/1519572333l/15920739._SX98_.jpg,https://i.gr-assets.com/images/S/compressed.photo.goodreads.com/books/1519572333l/15920739._SY75_.jpg,2011,12,22,,민음사,false,60332927,1,2,2,1,0,5:0|4:0|3:0|2:1|1:0|total:1,1983,,,2.00,1,0,['1728'],['Orhan Pamuk'],['3.76'],[],[],[],"노벨 문학상 수상 작가 오르한 파묵의 숨겨진 걸작“내 젊은 날의 영혼이 반영된 소설”“그들은 삶을 부둥켜안을 줄 몰랐다, 죽을 때까지 다른 사람들의 고통을 보고 눈물만 흘릴 줄 줄 알았다, 가련한 사람들.”1984년 마다라르 소설 상, 1991년 유럽 발견상 수상 ▶ 내 작품들 가운데 젊은이들이 『고요한 집』을 가장 좋아한다고 알고 있다. 이 책에 어쩌면 나의 젊은 날과 관련된, 진정 나의 영혼과 관련된 무엇인가가 있기 때문에. —오르한 파묵▶ 세 명의 불행한 남매가 이스탄불 근교 작은 도시의 아흔 살의 된 할머니 집에서 보낸 일주일을 그린 아름답고 슬픈 소설. 놀랄 만한 성공. —《타임스 리터러리》▶ 중요한 질문을 던지는 색다른 소설. 클래식하면서도 모던하다. 체호프의 「벚꽃 동산」을 연상시킨다. —《르몽드》"
25753709,1728,순수 박물관 1,8937490277,9788937490279,TR,https://i.gr-assets.com/images/S/compressed.photo.goodreads.com/books/1519571338l/25753709._SX98_.jpg,https://i.gr-assets.com/images/S/compressed.photo.goodreads.com/books/1519571338l/25753709._SX50_.jpg,2010,5,31,kor,민음사,false,60332752,1,2,2,1,0,5:0|4:0|3:0|2:1|1:0|total:1,2008,,,2.00,1,0,['1728'],['Orhan Pamuk'],['3.76'],['14988248'],['이난아'],['3.75'],"거울 앞에 있는 작은 선반에서 퓌순의 립스틱을 보았다. 그것을 집어 냄새를 맡고는 주머니에 넣었다. <br />한 여자와 만나 44일 동안 사랑하고, 339일 동안 그녀를 찾아 헤맸으며, 2864일 동안 그녀를 바라본 한 남자의 30년에 걸친 처절하고 지독한 사랑과 집착<br />노벨 문학상 수상 이후 첫 장편소설“나는 이 소설로 기억될 것이다.” －오르한 파묵"
38882031,1728,দ্য নিউ লাইফ,,9789849089872,TR,https://s.gr-assets.com/assets/nophoto/book/111x148-bcc042a9c91a29c1d680899eff700a03.png,https://s.gr-assets.com/assets/nophoto/book/50x75-a91bf249278a81aabab721ef782c4a74.png,,,,,,false,60424155,1,3,0,0,0,5:0|4:0|3:0|2:0|1:0|total:0,,,,0.00,0,0,['1728'],['Orhan Pamuk'],['3.76'],['14119798'],['Anish Das Apu'],['3.50'],
53331754,1728,Veba Geceleri,,,TR,https://s.gr-assets.com/assets/nophoto/book/111x148-bcc042a9c91a29c1d680899eff700a03.png,https://s.gr-assets.com/assets/nophoto/book/50x75-a91bf249278a81aabab721ef782c4a74.png,,,,tur,Yapı Kredi Yayınları,false,81808840,1,0,0,0,0,5:0|4:0|3:0|2:0|1:0|total:0,,,,0.00,0,0,['1728'],['Orhan Pamuk'],['3.76'],[],[],[],
15920740,1728,고요한 집 2,8937484234,9788937484230,TR,https://i.gr-assets.com/images/S/compressed.photo.goodreads.com/books/1519572503l/15920740._SX98_.jpg,https://i.gr-assets.com/images/S/compressed.photo.goodreads.com/books/1519572503l/15920740._SY75_.jpg,2011,12,22,,민음사,false,60332945,1,0,0,0,0,5:0|4:0|3:0|2:0|1:0|total:0,1983,,,0.00,0,0,['1728'],['Orhan Pamuk'],['3.76'],[],[],[],"노벨 문학상 수상 작가 오르한 파묵의 숨겨진 걸작“내 젊은 날의 영혼이 반영된 소설”“그들은 삶을 부둥켜안을 줄 몰랐다, 죽을 때까지 다른 사람들의 고통을 보고 눈물만 흘릴 줄 줄 알았다, 가련한 사람들.”1984년 마다라르 소설 상, 1991년 유럽 발견상 수상 ▶ 내 작품들 가운데 젊은이들이 『고요한 집』을 가장 좋아한다고 알고 있다. 이 책에 어쩌면 나의 젊은 날과 관련된, 진정 나의 영혼과 관련된 무엇인가가 있기 때문에. —오르한 파묵▶ 세 명의 불행한 남매가 이스탄불 근교 작은 도시의 아흔 살의 된 할머니 집에서 보낸 일주일을 그린 아름답고 슬픈 소설. 놀랄 만한 성공. —《타임스 리터러리》▶ 중요한 질문을 던지는 색다른 소설. 클래식하면서도 모던하다. 체호프의 「벚꽃 동산」을 연상시킨다. —《르몽드》"
