id,author_id,title,isbn,isbn13,country_code,image_url,small_image_url,publication_year,publication_month,publication_day,language_code,publisher,is_ebook,work_id,total_editions_count,total_added_by,total_rating_sum,total_rating_count,total_text_reviews_count,rating_dist,original_publication_year,original_publication_month,original_publication_day,average_rating,ratings_count,text_reviews_count,authors_ids,authors_names,authors_average_rating,translators_ids,translators_names,translators_average_rating,description
53047794,134980,Fria ord på flykt,,,TR,https://s.gr-assets.com/assets/nophoto/book/111x148-bcc042a9c91a29c1d680899eff700a03.png,https://s.gr-assets.com/assets/nophoto/book/50x75-a91bf249278a81aabab721ef782c4a74.png,,,,,,false,73370273,1,2,4,1,0,5:0|4:1|3:0|2:0|1:0|total:1,,,,4.00,1,0,"['19560365', '8107961', '3492116', '5023535', '5459897', '5316458', '8138240', '1960539', '8138241', '5358036', '8138242', '5351203', '2978614', '6543200', '134980', '192891', '719407', '8138243', '1944677']","['Svetlana Aleksijevitj', 'Parvin Ardalan', 'Faraj Bayrakdar', 'Jesper Bengtsson', 'Per Bergström', 'Ida Börjel', 'Oskar Ekström', 'Ingrid Elam', 'Henrik C. Enbohm', 'Pär Hansson', 'Li Jianhong', 'Ulrika Knutson', 'Ola Larsmo', 'Cato Lein', 'Herta Müller', 'Taslima Nasrin', 'Anisur Rahman', 'Zurab Rtveliashvili', 'Jenny Tunedal']","['4.00', '3.33', '4.00', '3.49', '3.33', '3.63', '3.33', '3.87', '3.33', '3.38', '3.33', '3.69', '3.64', '3.59', '3.61', '3.42', '3.71', '3.33', '3.58']",[],[],[],"Sju författare som alla levt i exil i Sverige som fristadsförfattare. I <i> Fria ord på flykt </i> bidrar de med texter - utdrag ur romaner, dikter, artiklar - samt genom samtal med svenska kollegor. Samtal om erfarenheterna, texten, poetik, politik och språk.<br /><br />Det är texter som rör sig mellan poesi och personliga berättelser, arabisk dikttradition och belarusisk dokumentärromankonst. Samtal som behandlar så vitt skilda ämnen som poesi och frihet, livet i exil, georgisk performancedikt, Ibsen, feministisk aktivism, sovjetmänniskan och internetaktivism.<br /><br />Författarna, poeterna och journalisterna har alla stått emot repression och förföljelse och fortsatt att skriva och uttrycka sina åsikter. Därför har de inte bara utsattheten gemensamt, utan även ett oerhört mod - och framförallt texten.<br /><br />Möt och läs Svetlana Aleksijevitj, Parvin Ardalan, Faraj Bayrakdar, Li Jianhong, Taslima Nasrin, Anisur Rahman och Zurab Rtveliashvili, och deras samtal med Jesper Bengtsson, Ingrid Elam, Henrik C. Enbohm, Pär Hansson, Ulrika Knutson, Ola Larsmo och Jenny Tunedal, foto av Cato Lein samt nyskrivna förord av Ida Börjel och Herta Müller."
26027363,134980,Mačke na parkingu,,,TR,https://i.gr-assets.com/images/S/compressed.photo.goodreads.com/books/1438539322l/26027363._SY160_.jpg,https://i.gr-assets.com/images/S/compressed.photo.goodreads.com/books/1438539322l/26027363._SY75_.jpg,2010,,,srp,Književna opština Vršac KOV Biblioteka Atlas vetrova,false,43530293,1,2,4,1,0,5:0|4:1|3:0|2:0|1:0|total:1,2010,1,1,4.00,1,0,"['134980', '9801702']","['Herta Müller', 'Petru Krdu']","['3.61', '4.50']",['10908796'],['Tamara Bačković'],['4.00'],
43318627,134980,Kaanch Ke Aansoo,,978935072662,TR,https://s.gr-assets.com/assets/nophoto/book/111x148-bcc042a9c91a29c1d680899eff700a03.png,https://s.gr-assets.com/assets/nophoto/book/50x75-a91bf249278a81aabab721ef782c4a74.png,2014,,,hin,Vaani Prakasham,false,67229335,1,2,4,1,1,5:0|4:1|3:0|2:0|1:0|total:1,2014,,,4.00,1,1,['134980'],['Herta Müller'],['3.61'],[],[],[],"The book is translated by Namita Khare and Rajendra Dengle in Hindi from German. It's written by Noble prized winner Romanian story-teller Herta Muller. The book is unique for it's images and symbolism. In English, it's perhaps translated by the name of , ""Passport"""
21256986,134980,PEN America Issue 16: Teachers (PEN America: A Journal for Writers and Readers),,,TR,https://s.gr-assets.com/assets/nophoto/book/111x148-bcc042a9c91a29c1d680899eff700a03.png,https://s.gr-assets.com/assets/nophoto/book/50x75-a91bf249278a81aabab721ef782c4a74.png,,,,eng,,true,40581762,1,14,3,1,0,5:0|4:0|3:1|2:0|1:0|total:1,2012,10,1,3.00,1,0,"['198928', '7480645', '3472', '47403', '134980', '29605', '135676', '34065', '7995584', '7995585', '6884287']","['M. Mark', 'PEN America', 'Margaret Atwood', 'John Cage', 'Herta Müller', 'Eileen Myles', 'Lynne Tillman', 'Etgar Keret', 'Leily Kleinbard', 'Joanna Scutts', 'David B.']","['4.14', '4.11', '4.03', '4.19', '3.61', '3.84', '3.97', '3.98', '3.00', '3.81', '3.84']",['3234624'],['Edward Gauvin'],['3.81'],"Teachers goes back to school with a global roster of writers and artists as they explore their literary and sentimental educations. Featuring Eileen Myles, Martha Cooley, Kimiko Hahn, Ron Padgett, Theresa Rebeck, Elissa Schappell, Paul La Farge, Dorothy Allison, and a look at PEN's diverse programming. At the end of the issue we transport you back to 1922, PEN American Center's founding year and the height of modernism. Borrowing from the pages of The Dial, The Crisis, and The Little Review, we offer you a taste of the literary scene, alongside a trove of photographs, drawings, advertisements, headlines, and commentary. The featured writers—including Joyce, Du Bois, Woolf, McKay, Crane, Cather, Fitzgerald, Mansfield, and Moore—remain some of our greatest teachers and literary loves."
49829299,134980,De vos was de jager,,,TR,https://s.gr-assets.com/assets/nophoto/book/111x148-bcc042a9c91a29c1d680899eff700a03.png,https://s.gr-assets.com/assets/nophoto/book/50x75-a91bf249278a81aabab721ef782c4a74.png,,,,,,true,72211347,1,2,1,1,0,5:0|4:0|3:0|2:0|1:1|total:1,,,,1.00,1,0,['134980'],['Herta Müller'],['3.61'],['3353525'],['Ria van Hengel'],['3.84'],
50034988,134980,The Funeral Sermon,,,TR,https://s.gr-assets.com/assets/nophoto/book/111x148-bcc042a9c91a29c1d680899eff700a03.png,https://s.gr-assets.com/assets/nophoto/book/50x75-a91bf249278a81aabab721ef782c4a74.png,,,,,,false,72595278,1,2,1,1,0,5:0|4:0|3:0|2:0|1:1|total:1,,,,1.00,1,0,['134980'],['Herta Müller'],['3.61'],[],[],[],short story
52405783,134980,Lögnen är ett klätterdjur. Herta Müllers collage,,9789187838187,TR,https://i.gr-assets.com/images/S/compressed.photo.goodreads.com/books/1584309316l/52405783._SX98_.jpg,https://i.gr-assets.com/images/S/compressed.photo.goodreads.com/books/1584309316l/52405783._SX50_.jpg,2019,12,28,swe,10TAL Bok,false,77756347,1,2,0,0,0,5:0|4:0|3:0|2:0|1:0|total:0,,,,0.00,0,0,['134980'],['Herta Müller'],['3.61'],[],[],[],"Herta Müllers passion för att skapa collagedikter har vuxit fram ur minnen av censur och lögner. I Lögnen är ett klätterdjur - den första volymen med Nobelpristagaren Herta Müllers collagedikter på svenska - kommer vi författaren in på livet. Här möter vi hennes lekfulla sidor. Det är makalöst vilka betydelser hon kan ge sina bokstäver och ord. Hemma samlar hon dem i olika små ordskåp.<br /><br />»Att jag idag äger hundratusentals ord hemma, tycker<br />jag är en lycka«, skriver Herta Müller i bokens förord.<br /><br />I boken publiceras svenska översättningar tillsammans med Müller färgsprakande originalcollage.<br /><br />I översättning av Aimée Delblanc"
43662578,134980,Un incontro italiano,8883092945,9788883092947,TR,https://i.gr-assets.com/images/S/compressed.photo.goodreads.com/books/1548086022l/43662578._SX98_.jpg,https://i.gr-assets.com/images/S/compressed.photo.goodreads.com/books/1548086022l/43662578._SY75_.jpg,2009,12,,ita,Avagliano editore,false,67932916,1,1,0,0,0,5:0|4:0|3:0|2:0|1:0|total:0,,,,0.00,0,0,"['134980', '18810776']","['Herta Müller', 'Gabriella Lepre']","['3.61', '0.0']",[],[],[],
51491873,134980,Minha pátria era um caroço de maçã,,,TR,https://s.gr-assets.com/assets/nophoto/book/111x148-bcc042a9c91a29c1d680899eff700a03.png,https://s.gr-assets.com/assets/nophoto/book/50x75-a91bf249278a81aabab721ef782c4a74.png,,,,,,true,76157251,1,0,0,0,0,5:0|4:0|3:0|2:0|1:0|total:0,,,,0.00,0,0,"['134980', '17739006']","['Herta Müller', 'Felipe Stefani']","['3.61', '0.0']",['7145547'],['Silvia Bittencourt'],['4.21'],
51107562,134980,European Angst,3944195949,9783944195940,TR,https://s.gr-assets.com/assets/nophoto/book/111x148-bcc042a9c91a29c1d680899eff700a03.png,https://s.gr-assets.com/assets/nophoto/book/50x75-a91bf249278a81aabab721ef782c4a74.png,,,,,,false,75902883,1,1,0,0,0,5:0|4:0|3:0|2:0|1:0|total:0,,,,0.00,0,0,"['134980', '2340358', '1697303']","['Herta Müller', 'Slavoj Žižek', 'Klaus-Dieter Lehmann']","['3.61', '3.84', '5.00']",[],[],[],
37833518,134980,Bhookh Ka Vyakaran,9350728281,9789350728284,TR,https://s.gr-assets.com/assets/nophoto/book/111x148-bcc042a9c91a29c1d680899eff700a03.png,https://s.gr-assets.com/assets/nophoto/book/50x75-a91bf249278a81aabab721ef782c4a74.png,,,,,,false,59517109,1,1,0,0,0,5:0|4:0|3:0|2:0|1:0|total:0,,,,0.00,0,0,['134980'],['Herta Müller'],['3.61'],"['17572688', '17572689']","['Namita Khare', 'Rajendra Dengle']","['0.0', '0.0']",
43662872,134980,Il fiore rosso e il bastone,8889767359,9788889767351,TR,https://i.gr-assets.com/images/S/compressed.photo.goodreads.com/books/1548086538l/43662872._SX98_.jpg,https://i.gr-assets.com/images/S/compressed.photo.goodreads.com/books/1548086538l/43662872._SX50_.jpg,2012,11,,ita,Keller editore,false,67933369,1,2,0,0,0,5:0|4:0|3:0|2:0|1:0|total:0,2003,,,0.00,0,0,['134980'],['Herta Müller'],['3.61'],['5820682'],['Fabrizio Cambi'],['3.82'],
3474749,134980,Zukunft! Zukunft?,3887691539,9783887691530,TR,https://i.gr-assets.com/images/S/compressed.photo.goodreads.com/books/1340087653l/3474749._SX98_.jpg,https://i.gr-assets.com/images/S/compressed.photo.goodreads.com/books/1340087653l/3474749._SY75_.jpg,2000,6,,ger,Konkursbuchverlag,false,3516055,1,3,0,0,0,5:0|4:0|3:0|2:0|1:0|total:0,2000,,,0.00,0,0,"['4244211', '134980', '2736291']","['Anna Maria Carpi', 'Herta Müller', 'Dubravka Ugrešić']","['3.46', '3.61', '3.82']",[],[],[],
4892387,134980,"Beiträge zum Kolloquium ""Hans von Bülow - Leben, Wirken und Vermächtnis""",3910114008,9783910114005,TR,https://s.gr-assets.com/assets/nophoto/book/111x148-bcc042a9c91a29c1d680899eff700a03.png,https://s.gr-assets.com/assets/nophoto/book/50x75-a91bf249278a81aabab721ef782c4a74.png,1995,1,9,ger,Meininger Museen,false,4957825,1,0,0,0,0,5:0|4:0|3:0|2:0|1:0|total:0,1995,1,9,0.00,0,0,"['6425907', '134980']","['Meininger Museen', 'Herta Müller']","['0.0', '3.61']",[],[],[],Veranstaltet non der Abteilung Musikgeschichte der Staatlichen Museen Meiningen am 6. Und 7. Mai 1994 im Rahmen der Meininger Landesmusiktage zum 100. Todestag Hans von Bülows.
7176971,134980,"Der Brahms-Klarinettist Richard Mühlfeld: Einleitung, Übertragung und Kommentar der Dokumentation von Christian Mühlfeld",3930643464,9783930643462,TR,https://i.gr-assets.com/images/S/compressed.photo.goodreads.com/books/1374572583l/7176971._SX98_.jpg,https://i.gr-assets.com/images/S/compressed.photo.goodreads.com/books/1374572583l/7176971._SX50_.jpg,2007,5,26,ger,ARTIVO Music Publishing,false,7630643,1,2,0,0,0,5:0|4:0|3:0|2:0|1:0|total:0,2007,,,0.00,0,0,"['6902622', '134980', '3330269', '7182877']","['Maren Goltz', 'Herta Müller', 'Christian Mühlfeld', 'Jochen Seggelke']","['0.0', '3.61', '0.0', '0.0']",[],[],[],"Der Meininger Klarinettist Richard Mühlfeld (1856–1907) war bereits zu Lebzeiten ein Mythos. Der berühmte Interpret inspirierte Johannes Brahms zu dessen meisterhaften Kammermusikwerken für Klarinette und löste damit einen wahren „Klarinettenboom“ aus. Erstmals erfolgt mit dem vorliegenden Band die vollständige Edition der in Privatbesitz befindlichen Dokumentation seines Bruders Christian Mühlfeld, die aus Sicht des nächsten Verwandten die Lebensgeschichte des Klarinettisten schildert und durch statistische Kapitel sowie eine Sammlung von Presseauszügen ergänzt wird. Ausführliche Einleitungen und Kommentare erschließen diese wertvolle Quelle zu Leben und Wirken des Ausnahmemusikers. Ein Beitrag von Holzblasinstrumentenmacher Jochen Seggelke zu den Instrumenten Richard Mühlfelds sowie zahlreiche bislang unveröffentlichte Fotografien bereichern den für Klarinettisten wie für Musikwissenschaftler und Musikliebhaber gleichermaßen faszinierenden Band. - - - Copyright 2007 by ARTIVO music, Balve - - - The clarinettist Richard Mühlfeld (1856–1907) of Meiningen was a legend in his own lifetime. He inspired Johannes Brahms’ brilliant chamber works for clarinet, resulting in a veritable ‘clarinet boom’. Published for the first time in an unabridged version, this documentation written by his brother Christian Mühlfeld gives the first-hand testimony of a close relative. It is an account of the musician’s life, accompanied by several tables of factual information and a collection of concert reviews. With its detailed introductions and commentaries it constitutes a valuable key to the life and work of this exceptional musician. This publication, which includes an article on Mühlfeld’s instruments by the woodwind maker Jochen Seggelke as well as previously unpublished photographs, will fascinate clarinettists, musicologists, and music lovers alike. - - - Copyright 2007 by ARTIVO music, Balve Grußwort – Mühlfelds Klarinetten wachgeküßt Vorwort Richard Mühlfeld – ein Ausnahmemusiker Christian Mühlfeld – Der Verfasser der Dokumentation Zur Edition Christian Mühlfelds Dokumentation 1. „Richard Mühlfeld. Eine Biographische Skizze. Für die Angehörigen niedergeschrieben und diesen zugeeignet. Meiningen 1908.“ 2. „Konzertreisen Richard Mühlfelds. 1876 – 1907. Nach den Programmen zusammengestellt“ 3. „Mitwirkung Richard Mühlfelds bei Orchester-Konzerten anderer Kapellen“ 4. „Meininger Kammermusikaufführungen, in denen Richard Mühlfeld mitwirkte“ 5. „Konzerte der Meininger Hofkapelle, in denen Richard Mühlfeld als Solist auftrat“ 6. „Konzerte mit Kompositionen zumeist für Blasinstrumente, wobei Richard Mühlfeld beteiligt war“ 7. „Kompositionen, die von Richard Mühlfeld vorgetragen wurden“ 8. „Kammermusik-Vereinigungen, mit denen Richard Mühlfeld musicierte“ 9. „Einzelpersonen, mit welchen Rich. Mühlfeld musicierte“ 10. „Ihm zugeschickte Compositionen“ 11. „Recensionen“ Anhang: I. Jochen Seggelke: Mühlfelds Ottensteiner Klarinetten II. Richard Mühlfelds Kompositionen (Verzeichnis) Abkürzungen Abbildungen Bibliographie Register Copyright 2007 by ARTIVO music, Balve"
17672592,134980,"Die sieben Todsünden. Kursbuch, Heft 110",387134110X,,TR,https://i.gr-assets.com/images/S/compressed.photo.goodreads.com/books/1364145851l/17672592._SX98_.jpg,https://i.gr-assets.com/images/S/compressed.photo.goodreads.com/books/1364145851l/17672592._SX50_.jpg,1992,,,,Rowohlt,false,24671890,1,2,0,0,0,5:0|4:0|3:0|2:0|1:0|total:0,1992,1,1,0.00,0,0,"['68620', '16281', '134980', '401578', '270618', '2953508', '7014034', '287630', '59787', '7014035', '1862786', '375243', '492362', '999269']","['Irene Dische', 'Axel Hacke', 'Herta Müller', 'Rolf Schneider', 'Tilman Spengler', 'István Eörsi', 'Ljudmila Petruschewskaja', 'Paul Parin', 'Reinhard Kaiser', 'Zsuzsa Szemes', 'Karin Reschke', 'Keto von Waberer', 'Victor Erofeyev', 'Ingomar von Kieseritzky']","['3.60', '3.90', '3.61', '3.76', '2.62', '4.00', '3.21', '3.33', '3.95', '0.0', '3.33', '3.51', '3.51', '3.86']",[],[],[],
22248686,134980,Königin und Täubchen. The Queen and the Chick,3869065079,9783869065076,TR,https://i.gr-assets.com/images/S/compressed.photo.goodreads.com/books/1400880966l/22248686._SX98_.jpg,https://i.gr-assets.com/images/S/compressed.photo.goodreads.com/books/1400880966l/22248686._SX50_.jpg,2014,4,30,,Allitera Verlag,false,41624592,1,0,0,0,0,5:0|4:0|3:0|2:0|1:0|total:0,2014,4,30,0.00,0,0,"['6902622', '134980']","['Maren Goltz', 'Herta Müller']","['0.0', '3.61']",[],[],[],"Mit der erstmaligen Herausgabe und Kommentierung der 77 Briefe Cosima von Bulows (seit 1870 verh. Wagner) an ihre Berliner Jugendfreundin Ellen Franz (verh. Helene von Heldburg) erschliessen Maren Goltz und Herta Muller einen bisher unbekannten, Quellenbestand, der vollig neue Einblicke in die Welt der beiden fur die Kulturgeschichte so bedeutenden Frauen erlaubt. Obwohl die Gegenkorrespondenz von Ellen Franz - der Schauspielerin und spateren Frau des Meininger Theaterherzogs Georg II. - nicht uberliefert ist, belegen die Briefe aus dem Zeitraum von 1859 bis 1912 nicht nur eine der Forschung bisher verborgen gebliebene Lebensfreundschaft zwischen der Konigin (Cosima) und dem Taubchen (Ellen). Sie ermoglichen auch einen differenzierteren Blick auf Cosimas Gefuhlswelt, ihr Verhaltnis zum Vater Franz Liszt und auf ihre Ehe mit Hans von Bulow. Vor allem jedoch lassen sie wichtige Facetten ihrer Personlichkeit sichtbar werden: ihre hohe Bildung, ihr intellektuelles Niveau und ihre grosse Theaterleidenschaft. Inspiriert durch das Meininger Hoftheater, pragte Cosima Wagner den Bayreuther Buhnenstil in entscheidendem Masse mit - vor und nach dem Tod Richard Wagners. In this first-ever publication of seventy-seven letters written by Cosima von Bulow (who changed her name to Cosima Wagner after marrying again in 1870) to her long-standing Berlin friend Ellen Franz (who after her marriage became Helene von Heldburg), Maren Goltz and Herta Muller tap an extremely informative yet previously unknown source of fresh insights into the worlds of these two women so important in cultural history. Although the replies from Ellen Franz - an actress who married theatre aficionado Duke Georg II of Saxe-Meiningen - have not survived, the letters spanning 1859-1912 do far more than demonstrate the existence of a lifelong friendship between the 'Queen' (Cosima von Bulow/Wagner) and the 'Chick' (Ellen Franz) previously unknown to scholars. They also enable a more nuanced view of Cosima's"""
36421673,134980,Reden an die Abiturienten (1999-2015),,,TR,https://s.gr-assets.com/assets/nophoto/book/111x148-bcc042a9c91a29c1d680899eff700a03.png,https://s.gr-assets.com/assets/nophoto/book/50x75-a91bf249278a81aabab721ef782c4a74.png,,,,,,true,58119850,1,4,0,0,0,5:0|4:0|3:0|2:0|1:0|total:0,,,,0.00,0,0,"['113057', '17239799', '134980', '1462241', '588367', '507313', '1610096', '635213', '861292', '157560', '293199', '731030', '228501', '452158', '11572', '42791', '856191']","['Wilhelm Genazino', 'Birbit Vanderbeke', 'Herta Müller', 'Guntram Vesper', 'Dieter Wellershoff', 'Raoul Schrott', 'Ulrike Kolb', 'Feridun Zaimoglu', 'Ulrich Peltzer', 'Christoph Hein', 'Juli Zeh', 'Thomas Hürlimann', 'Sibylle Lewitscharoff', 'Martin Mosebach', 'Jenny Erpenbeck', 'Marcel Beyer', 'Ralph Schock']","['3.71', '0.0', '3.61', '3.56', '3.53', '3.66', '2.88', '3.17', '3.10', '3.57', '3.76', '3.39', '3.27', '3.64', '3.88', '3.67', '3.75']",[],[],[],
40709831,134980,Herzog Georg II. Von Sachsen-Meiningen (1826-1914): Kultur ALS Behauptungsstrategie?,3412501514,9783412501518,TR,https://s.gr-assets.com/assets/nophoto/book/111x148-bcc042a9c91a29c1d680899eff700a03.png,https://s.gr-assets.com/assets/nophoto/book/50x75-a91bf249278a81aabab721ef782c4a74.png,2015,12,9,,Bohlau Verlag,false,63314344,1,0,0,0,0,5:0|4:0|3:0|2:0|1:0|total:0,,,,0.00,0,0,"['1691961', '6384219', '14412580', '1602321', '14331407', '2665043', '1421285', '18172715', '1914079', '6119822', '3443055', '16582479', '134980', '1715498', '14357410', '16410755', '836248', '18172716', '11047226', '18172717', '18172718', '6902622', '1674543']","['Alfred Erck', 'Bernd Ernsting', 'Christine Freitag', 'Christoph Gann', 'Stefan Gerber', 'Hans-Werner Hahn', 'Hans-Joachim Hinrichsen', 'Martina Ludtke', 'Florian Mildenberger', 'Dorothea Minkels', 'Johannes Motsch', 'Gerhard L. Müller', 'Herta Müller', 'Uwe Schirmer', 'Hannelore Schneider', 'Christian Storch', 'Petra Stuber', 'Claudia Taszus', 'Wolfgang Turk', 'Paul S Ulrich', 'Katharina Witter', 'Maren Goltz', 'Werner Greiling']","['2.00', '0.0', '0.0', '3.00', '0.0', '0.0', '3.71', '0.0', '4.50', '0.0', '0.0', '4.08', '3.61', '5.00', '3.50', '0.0', '0.0', '0.0', '0.0', '0.0', '0.0', '0.0', '0.0']",[],[],[],"Herzog Georg II. von Sachsen-Meiningen gehort zu den herausragenden Herrscherpersonlichkeiten Thuringens im langen 19. Jahrhundert. Als Regent bestimmte er nicht nur die politischen Geschicke seines Herzogtums, sondern widmete sich ebenso intensiv der Kunst und Kultur. Durch sein Engagement fur das Theater und die Musik erlangte Georg II. europaweites Renommee, erreichte aber auch in anderen Spharen seines Wirkens Mustergultiges. So genoss er sowohl in der Furstenwelt als auch beim eigenen Volk eine beachtliche Reputation. Der Band ergrundet die mannigfaltigen Facetten dieses ambitionierten Fursten und geht dabei auch der Frage nach, inwieweit Georg II. als Landesherr eines mindermachtigen Staates die von ihm betriebene Kulturpolitik als politische Behauptungsstrategie einsetzte. Dabei wird er aber nicht auf seine zweifellos wichtige Rolle als Theaterherzog reduziert. Die mehr als 20 Beitrage thematisieren vielmehr die Bereiche Furst und Dynastie, Herrschaft und Verwaltung, Wirtschaft und Gesellschaft, Bildung und Wissenschaft sowie das weite Feld von Kunst und Kultur."
43882520,134980,Mi patria era una semilla de manzana,841685422X,9788416854226,TR,https://s.gr-assets.com/assets/nophoto/book/111x148-bcc042a9c91a29c1d680899eff700a03.png,https://s.gr-assets.com/assets/nophoto/book/50x75-a91bf249278a81aabab721ef782c4a74.png,,,,,,false,68274547,1,8,0,0,0,5:0|4:0|3:0|2:0|1:0|total:0,,,,0.00,0,0,"['2060604', '134980']","['Angelika Klammer', 'Herta Müller']","['4.29', '3.61']",[],[],[],
45280367,134980,Atlas litterära tillägg. Nr 2,,9789173893466,TR,https://i.gr-assets.com/images/S/compressed.photo.goodreads.com/books/1556049547l/45280367._SX98_.jpg,https://i.gr-assets.com/images/S/compressed.photo.goodreads.com/books/1556049547l/45280367._SY75_.jpg,2008,12,4,swe,Atlas,false,69992151,1,1,0,0,0,5:0|4:0|3:0|2:0|1:0|total:0,,,,0.00,0,0,"['8167144', '134980', '26093', '19092430', '1730']","['Cecilia Hansson', 'Herta Müller', 'Mircea Cărtărescu', 'Eli Levén', 'Umberto Eco']","['3.31', '3.61', '3.79', '0.0', '3.95']",[],[],[],I det senaste numret av Atlas Litterära Tillägg förs den rumänsk-tyska nobelpristagaren Herta Müller samman med landsmannen Mircea Cãrtãrescu. De hade aldrig tidigare träffats! Cecilia Hansson ställde frågor och höll i bandspelaren under ett fascinerande samtal om skrivande och politiskt ansvar. I samma nummer av ALT har vi ställt några frågor till Hertas och Mirceas svenska översättare - Karin Löfdahl och Inger Johansson - om deras relation till respektive författare och om att byta ord mot ord.
