id,author_id,title,isbn,isbn13,country_code,image_url,small_image_url,publication_year,publication_month,publication_day,language_code,publisher,is_ebook,work_id,total_editions_count,total_added_by,total_rating_sum,total_rating_count,total_text_reviews_count,rating_dist,original_publication_year,original_publication_month,original_publication_day,average_rating,ratings_count,text_reviews_count,authors_ids,authors_names,authors_average_rating,translators_ids,translators_names,translators_average_rating,description
46031285,134980,Im Heimweh ist ein blauer Saal,3446261753,9783446261754,TR,https://i.gr-assets.com/images/S/compressed.photo.goodreads.com/books/1559045360l/46031285._SX98_.jpg,https://i.gr-assets.com/images/S/compressed.photo.goodreads.com/books/1559045360l/46031285._SX50_.jpg,2019,3,11,ger,Carl Hanser Verlag GmbH & Co. KG,false,70925385,1,15,21,5,0,5:2|4:2|3:1|2:0|1:0|total:5,,,,4.20,5,0,['134980'],['Herta Müller'],['3.61'],[],[],[],"""Kurz nachdem ich aus Rumänien kam, war ich viel unterwegs. Ich wollte mich bei Freunden melden"", schreibt Herta Müller. ""Aber die Ansichtskarten hatten so gräßlich mißratene Farben. Eines Tages kaufte ich weiße Karteikarten, einen Klebestift und fing an, im Zug mit der Nagelschere aus der Zeitung ein Schwarzweiß-Bild und Wörter auszuschneiden."" Fortan dichtet sie mit Schere und Papier. Herta Müllers berühmte Collagen sind beides zugleich: Kunstwerk und Gedicht, Spiel und poetischer Ernst. Und unversehens taucht im geklebten Gedicht das auf, worum es eigentlich geht: die Wirklichkeit – denn ""vielleicht haben auch Wörter ein schimmerndes Gemüt und betreiben Amtsmissbrauch…"""
22442166,134980,Svenska Granta 3: Jakt,,9789100135638,TR,https://i.gr-assets.com/images/S/compressed.photo.goodreads.com/books/1402215789l/22442166._SX98_.jpg,https://i.gr-assets.com/images/S/compressed.photo.goodreads.com/books/1402215789l/22442166._SX50_.jpg,2014,4,25,swe,Albert Bonniers Förlag,false,41868582,1,24,20,6,0,5:1|4:1|3:3|2:1|1:0|total:6,2014,4,25,3.33,6,0,"['7076911', '189157', '5263703', '1050', '268678', '45434', '2935132', '2166836', '4340628', '8297468', '1411771', '6875985', '11746', '134980', '7268145']","['Johanna Haegerström', 'Tim Adams', 'NoViolet Bulawayo', 'Mark Haddon', 'Anna-Karin Palm', 'Martin Johnson', 'Katrine Kielos', 'Michel Laub', 'Ida Linde', 'Lina Josefina Lindqvist', 'Kristian Lundberg', 'Lawen Mohtadi', 'Lorrie Moore', 'Herta Müller', 'Maria Venegas']","['3.76', '3.84', '3.73', '3.85', '3.52', '3.80', '3.65', '3.71', '3.42', '3.50', '3.57', '3.69', '3.77', '3.61', '4.03']",[],[],[],"Vem är jägare? Och vem är byte?<br /><br />Granta #3 innehåller fjorton texter laddade av spänningen mellan jaktens båda poler. Bland dem finns Lina Josefina Lindqvists novell om en ung tronarvinge som sätts på prov under en safariresa, liksom Tim Adams reportage om konflikten mellan brittiska rävjaktsanhängare och sabotörer. Katrine Kielos spinner vidare på Susan Sontags idé om kameran som vapen och frågar sig vad som händer när vi riktar den mot oss själva. Herta Müller tar strid för att synliggöra exilerfarenheten, Lawen Mohtadi söker de historiska spåren efter svenska romer i myndigheternas register och Ida Linde skildrar en våldsam bilfärd genom Norrlands skogar. <br /><br />Svenska Granta är del av ett internationellt nätverk med engelskspråkiga Granta som nav. Tidskriften grundades av studenter i Cambridge i slutet av 1800-talet. År 1979 fick den sin nuvarande form som en arena för nyskriven skönlitteratur och litterära reportage. Idag finns Grantaredaktioner i ett tiotal länder världen över, från Kina till Brasilien."
35614498,134980,شوابی‌ها,,,TR,https://i.gr-assets.com/images/S/compressed.photo.goodreads.com/books/1499389635l/35614498._SX98_.jpg,https://i.gr-assets.com/images/S/compressed.photo.goodreads.com/books/1499389635l/35614498._SX50_.jpg,,,,pes,کانون فرهنگی چوک,true,57055895,1,10,19,6,1,5:2|4:0|3:2|2:1|1:1|total:6,,,,3.17,6,1,['134980'],['Herta Müller'],['3.61'],['5786154'],['اسدالله امرایی'],['3.42'],
49992011,134980,Niederungen 저지대,,9788954610735,TR,https://s.gr-assets.com/assets/nophoto/book/111x148-bcc042a9c91a29c1d680899eff700a03.png,https://s.gr-assets.com/assets/nophoto/book/50x75-a91bf249278a81aabab721ef782c4a74.png,,,,,,false,72586609,1,12,19,5,0,5:3|4:0|3:1|2:0|1:1|total:5,,,,3.80,5,0,['134980'],['Herta Müller'],['3.61'],[],[],[],
52097663,134980,Dépressions,,9782070445509,TR,https://s.gr-assets.com/assets/nophoto/book/111x148-bcc042a9c91a29c1d680899eff700a03.png,https://s.gr-assets.com/assets/nophoto/book/50x75-a91bf249278a81aabab721ef782c4a74.png,,,,,,false,72964233,1,5,17,4,0,5:2|4:1|3:1|2:0|1:0|total:4,1982,,,4.25,4,0,['134980'],['Herta Müller'],['3.61'],[],[],[],"Initialement paru en 1982 dans une version censurée, ce texte évoque les habitants des plaines du Banat, autour de Timisoara. Il décrit les moeurs des germanophones de Roumanie après la Seconde Guerre mondiale. Au-delà de la description du quotidien des villageois, l'écrivaine dénonce, à travers le regard d'une fillette, l'hypocrisie, l'oppression, l'intolérance et le mensonge."
22087493,134980,El guarda saca su peine/En el moño mora una señora,72196732,,TR,https://i.gr-assets.com/images/S/compressed.photo.goodreads.com/books/1400088562l/22087493._SX98_.jpg,https://i.gr-assets.com/images/S/compressed.photo.goodreads.com/books/1400088562l/22087493._SY75_.jpg,2010,,,spa,Editorial Linteo Poesía,false,41427691,2,9,14,4,2,5:0|4:2|3:2|2:0|1:0|total:4,2010,1,1,3.50,2,2,['134980'],['Herta Müller'],['3.61'],[],[],[],
11273700,134980,Ich glaube nicht an die Sprache: Herta Müller im Gespräch mit Renata Schmidtkunz,3851298608,9783851298604,TR,https://i.gr-assets.com/images/S/compressed.photo.goodreads.com/books/1327595691l/11273700._SX98_.jpg,https://i.gr-assets.com/images/S/compressed.photo.goodreads.com/books/1327595691l/11273700._SY75_.jpg,2009,11,9,,Wieser Verlag,false,16200725,1,18,13,4,1,5:1|4:1|3:1|2:0|1:1|total:4,2009,11,9,3.25,4,1,['134980'],['Herta Müller'],['3.61'],[],[],[],
43203276,134980,Nobelnoveller 2,,9789175892870,TR,https://i.gr-assets.com/images/S/compressed.photo.goodreads.com/books/1544604452l/43203276._SY160_.jpg,https://i.gr-assets.com/images/S/compressed.photo.goodreads.com/books/1544604452l/43203276._SY75_.jpg,2018,11,,swe,Novellix,false,67040121,1,11,13,3,0,5:1|4:2|3:0|2:0|1:0|total:3,,,,4.33,3,0,"['17790547', '4280', '3534', '585', '134980']","['Novellix', 'Kazuo Ishiguro', 'Toni Morrison', 'John Steinbeck', 'Herta Müller']","['3.73', '3.84', '3.91', '3.93', '3.61']",[],[],[],
20626830,134980,Cmono. Rozmowy z pisarzami,,9788371779701,TR,https://i.gr-assets.com/images/S/compressed.photo.goodreads.com/books/1390572743l/20626830._SX98_.jpg,https://i.gr-assets.com/images/S/compressed.photo.goodreads.com/books/1390572743l/20626830._SX50_.jpg,2013,10,21,pol,Wydawnictwo Poznańskie,false,39913133,1,10,12,4,0,5:0|4:0|3:4|2:0|1:0|total:4,2013,10,21,3.00,4,0,"['3158346', '132761', '86801', '2358251', '34065', '3602', '134980', '15496', '1728', '6238', '25415', '35099', '190431', '2736291']","['Grzegorz Jankowicz', 'Rabih Alameddine', 'John Ashbery', 'Lukas Bärfuss', 'Etgar Keret', 'Alberto Manguel', 'Herta Müller', 'Amos Oz', 'Orhan Pamuk', 'Marjane Satrapi', 'Charles Simic', 'Josef Škvorecký', 'György Spiró', 'Dubravka Ugrešić']","['3.51', '3.83', '4.06', '3.53', '3.98', '3.88', '3.61', '3.86', '3.76', '4.26', '4.05', '3.92', '4.01', '3.82']",[],[],[],"Tygodnik Powszechny i Wydawnictwo Poznańskie przedstawia trzeci tom Biblioteki Tygodnika Powszechnego – książka Cmono to rozmowy z trzynastoma wybitnymi pisarzami przeprowadzone przez krytyka i eseistę, redaktora działu kultury Tygodnika Powszechnego, Grzegorza Jankowicza. Rozmówcami autora są: Rabih Alameddine, John Ashbery, Lukas Bärfuss, Etgar Keret, Alberto Manguel, Herta Müller, Amos Oz, Orhan Pamuk, Marjane Satrapi, Charles Simic oraz Josef Škvorecký, György Spiró i Dubravka Ugrešić. <br /><br />Tytułowe „cmono” to słowo, które pojawia się w pierwszym tomie Słownika języka polskiego Lindego. Według jednej z legendarnych wersji słynny leksykograf ułożył swą księgę tylko po to, by zrozumieć jego sens. Nie szczędził pieniędzy i czasu, by odkryć sens „cmono”. Bez skutku. Umarł niespełniony, targany poczuciem klęski, rozgoryczony. Zagadka została rozwiązana dopiero po jego śmierci. Odpowiedź znajdziecie w książce Jankowicza. <br /><br />Książka, trzeci tom Biblioteki Tygodnika Powszechnego, wydana we współpracy Tygodnika Powszechnego z Wydawnictwem Poznańskim, ukaże się na rynku 21 października 2013 roku. Premiera książki towarzyszyć będzie krakowskiemu Festiwalowi Conrada."
31831024,134980,Every word knows something of a vicious circle,,,TR,https://s.gr-assets.com/assets/nophoto/book/111x148-bcc042a9c91a29c1d680899eff700a03.png,https://s.gr-assets.com/assets/nophoto/book/50x75-a91bf249278a81aabab721ef782c4a74.png,2009,12,7,,,false,52491510,1,10,12,3,1,5:2|4:0|3:0|2:1|1:0|total:3,,,,4.00,3,1,['134980'],['Herta Müller'],['3.61'],[],[],[],"Herta Müller's nobel prize accepting speech<br /><br /><a target=""_blank"" href=""https://www.nobelprize.org/nobel_prizes/literature/laureates/2009/muller-lecture_en.html"" rel=""nofollow"">https://www.nobelprize.org/nobel_priz...</a>"
6956710,134980,Eine Warme Kartoffel Ist Ein Warmes Bett,3434500146,9783434500148,TR,https://i.gr-assets.com/images/S/compressed.photo.goodreads.com/books/1340088661l/6956710._SX98_.jpg,https://i.gr-assets.com/images/S/compressed.photo.goodreads.com/books/1340088661l/6956710._SX50_.jpg,1992,2,10,ger,Europäische Verlagsanstalt,false,7192352,1,15,11,3,0,5:1|4:1|3:0|2:1|1:0|total:3,1992,1,1,3.67,3,0,['134980'],['Herta Müller'],['3.61'],[],[],[],
29245427,134980,في مديح الأدب,,9789939434933,TR,https://i.gr-assets.com/images/S/compressed.photo.goodreads.com/books/1456166755l/29245427._SX98_.jpg,https://i.gr-assets.com/images/S/compressed.photo.goodreads.com/books/1456166755l/29245427._SY75_.jpg,2014,,,ara,دار كنعان,false,27357671,2,65,11,3,2,5:1|4:0|3:2|2:0|1:0|total:3,,,,3.67,1,0,"['6544934', '1285555', '1728', '65633', '1197', '134980', '22515']","['أحمد الويزي', 'José Saramago', 'Orhan Pamuk', 'J.M.G. Le Clézio', 'Harold Pinter', 'Herta Müller', 'Mario Vargas Llosa']","['3.68', '4.02', '3.76', '3.65', '3.79', '3.61', '3.97']",[],[],[],على هامش الاحتفالات الرسمية بالجوائز الأدبية التي تعقد في استوكهولم لتسلم جائزة نوبل العتيدة جرت العادة كتقليد في الأكاديمية الملكية، أن يلقي كل من ظفر بالجائزة الأكبر والأشهر، كلمة أدبية بالمناسبة، تعرف بصاحبها وبمشروعه الأدبي<br /><br />جوزيه ساراماغو، أورهان باموك، جان ماري غيستاف لوكليزيو، هارولد بينتر، هونتر مولر، ماريو فرغاس يوسا<br /><br />إن تلك الكلمات على روعتها، لا تحيل فقط على التقليد المتبع هناك، وليست مجرد استجابة له، بل تحيل بعمق على الفضاء الإبداعي الواسع، والإلتزام الأخلاقي الصارم، لأولئك المبدعين، بقضايا البشر، ومناهضة الظلم والاستبداد أينما كان
13122500,134980,Noveller för världens barn 2011,,9789177366218,TR,https://i.gr-assets.com/images/S/compressed.photo.goodreads.com/books/1322511026l/13122500._SX98_.jpg,https://i.gr-assets.com/images/S/compressed.photo.goodreads.com/books/1322511026l/13122500._SY75_.jpg,2011,,,swe,Informationsförlaget,false,18298095,1,16,11,3,0,5:0|4:2|3:1|2:0|1:0|total:3,2011,1,1,3.67,3,0,"['777233', '38266', '302660', '1147765', '410653', '470876', '780618', '36784', '18791', '446692', '479779', '4738', '1244', '134980', '6765', '6410', '778911', '65633', '161054', '1438459', '3524', '144306', '6815', '690646', '23817', '5031025']","['Sun Axelsson', 'Selma Lagerlöf', 'Hjalmar Söderberg', 'Nam Le', 'Astrid Lindgren', 'Ivar Lo-Johansson', 'Kerstin Thorvall', 'Torgny Lindgren', 'Guy de Maupassant', 'Tomas Tranströmer', 'John Ajvide Lindqvist', 'Alexander McCall Smith', 'Mark Twain', 'Herta Müller', 'Virginia Woolf', 'Alice Munro', 'Klas Östergren', 'J.M.G. Le Clézio', 'Håkan Nesser', 'Ylva Eggehorn', 'Joyce Carol Oates', 'Per Olov Enquist', 'August Strindberg', 'Jonas Karlsson', 'Margareta Strömstedt', 'Anton Chekhov']","['3.71', '3.85', '3.80', '3.62', '4.18', '3.38', '3.70', '3.75', '3.86', '4.08', '3.92', '3.87', '3.86', '3.61', '3.88', '3.92', '3.59', '3.65', '3.67', '3.78', '3.69', '3.68', '3.53', '3.55', '3.87', '3.96']",[],[],[],26 mästarprov ur världslitteraturen
51838607,134980,Lögnen är ett klätterdjur,9789187838,,TR,https://i.gr-assets.com/images/S/compressed.photo.goodreads.com/books/1582832614l/51838607._SX98_.jpg,https://i.gr-assets.com/images/S/compressed.photo.goodreads.com/books/1582832614l/51838607._SX50_.jpg,2019,12,28,swe,10TAL Bok,false,76328775,1,5,9,2,1,5:1|4:1|3:0|2:0|1:0|total:2,,,,4.50,2,1,['134980'],['Herta Müller'],['3.61'],['5272000'],['Aimée Delblanc'],['3.63'],"Herta Müllers passion för att skapa collagedikter har vuxit fram ur minnen av censur och lögner. I Lögnen är ett klätterdjur - den första volymen med Nobelpristagaren Herta Müllers collagedikter på svenska - kommer vi författaren in på livet. Här möter vi hennes lekfulla sidor. Det är makalöst vilka betydelser hon kan ge sina bokstäver och ord. Hemma samlar hon dem i olika små ordskåp.<br /><br />»Att jag idag äger hundratusentals ord hemma, tycker jag är en lycka«, skriver Herta Müller i bokens förord.<br /><br />I boken publiceras svenska översättningar tillsammans med Müller färgsprakande originalcollage."
53107693,134980,NIEDERUNGEN - AUDIOBOOK,3899036220,9783899036220,TR,https://s.gr-assets.com/assets/nophoto/book/111x148-bcc042a9c91a29c1d680899eff700a03.png,https://s.gr-assets.com/assets/nophoto/book/50x75-a91bf249278a81aabab721ef782c4a74.png,,,,,,false,71696173,1,4,9,2,0,5:1|4:1|3:0|2:0|1:0|total:2,,,,4.50,2,0,['134980'],['Herta Müller'],['3.61'],[],[],[],
33114520,134980,Dorfchronik,,,TR,https://s.gr-assets.com/assets/nophoto/book/111x148-bcc042a9c91a29c1d680899eff700a03.png,https://s.gr-assets.com/assets/nophoto/book/50x75-a91bf249278a81aabab721ef782c4a74.png,,,,ger,,false,53778430,1,3,8,2,0,5:0|4:2|3:0|2:0|1:0|total:2,,,,4.00,2,0,['134980'],['Herta Müller'],['3.61'],[],[],[],
6956426,134980,Drückender Tango: Erzählungen,3499220806,9783499220807,TR,https://i.gr-assets.com/images/S/compressed.photo.goodreads.com/books/1340088482l/6956426._SX98_.jpg,https://i.gr-assets.com/images/S/compressed.photo.goodreads.com/books/1340088482l/6956426._SY75_.jpg,,,,ger,,false,7191978,1,17,8,2,1,5:0|4:2|3:0|2:0|1:0|total:2,,,,4.00,2,1,['134980'],['Herta Müller'],['3.61'],[],[],[],
28816947,134980,"Festivalul Internaţional de Poezie ""Oskar Pastior"" Sibiu 2007",,9789731243221,TR,https://i.gr-assets.com/images/S/compressed.photo.goodreads.com/books/1454284871l/28816947._SX98_.jpg,https://i.gr-assets.com/images/S/compressed.photo.goodreads.com/books/1454284871l/28816947._SX50_.jpg,2009,10,,rum,Art,false,49033485,1,5,8,2,0,5:1|4:0|3:1|2:0|1:0|total:2,2009,10,,4.00,2,0,"['14931249', '5315388', '1947888', '134980']","['H.R. Patapievici', 'Corina Bernic', 'Ernest Wichner', 'Herta Müller']","['4.00', '3.38', '3.94', '3.61']",[],[],[],"Festivalul Internaţional de Poezie „Oskar Pastior” de la Sibiu a reunit la prima ediţie, din anul 2007, poeţi din numeroase ţări europene, care se revendică, în bună măsură, din tradiţia modernismului experimental sau a avangardismului; pentru cei invitaţi, limba nu reprezintă doar un mijloc de exprimare poetică, ci este substanţa poetică în sine.<br /><br />- Ediţie bilingvă (româno-germană)"
15748468,134980,Donauschwäbische Literatur Nobelpreisträgerin,,,TR,https://s.gr-assets.com/assets/nophoto/book/111x148-bcc042a9c91a29c1d680899eff700a03.png,https://s.gr-assets.com/assets/nophoto/book/50x75-a91bf249278a81aabab721ef782c4a74.png,,,,ger,Jahrgang 43,false,21440868,1,5,7,2,0,5:0|4:1|3:1|2:0|1:0|total:2,,,,3.50,2,0,['134980'],['Herta Müller'],['3.61'],[],[],[],
21898255,134980,Fria ord på flykt,,9789186703189,TR,https://i.gr-assets.com/images/S/compressed.photo.goodreads.com/books/1444311407l/21898255._SX98_.jpg,https://i.gr-assets.com/images/S/compressed.photo.goodreads.com/books/1444311407l/21898255._SX50_.jpg,2012,,,swe,Rámus förlag,false,41191019,1,17,6,2,0,5:0|4:0|3:2|2:0|1:0|total:2,2012,1,1,3.00,2,0,"['5459897', '8138240', '7728207', '8107961', '8138238', '5023535', '5459897', '5316458', '1960539', '8138241', '5358036', '8138242', '5351203', '2978614', '6543200', '134980', '192891', '719407', '8138243', '1944677']","['Per Bergström', 'Oskar Ekström', 'Svetlana Alexievich', 'Parvin Ardalan', 'Paraj Bayrakdar', 'Jesper Bengtsson', 'Per Bergström', 'Ida Börjel', 'Ingrid Elam', 'Henrik C. Enbohm', 'Pär Hansson', 'Li Jianhong', 'Ulrika Knutson', 'Ola Larsmo', 'Cato Lein', 'Herta Müller', 'Taslima Nasrin', 'Anisur Rahman', 'Zurab Rtveliashvili', 'Jenny Tunedal']","['3.33', '3.33', '4.45', '3.33', '3.00', '3.49', '3.33', '3.63', '3.87', '3.33', '3.38', '3.33', '3.69', '3.64', '3.59', '3.61', '3.42', '3.71', '3.33', '3.58']",[],[],[],"Fria ord på flykt har producerats på initiativ av Shaharazad - Stories for Life, ett europeiskt projekt med inriktning mot litteratur, yttrandefrihet och mänskliga rättigheter. Boken är en samproduktion mellan projektet och Rámus, med stöd av fristäderna Göteborg, Malmö, Uppsala, Stockholm och Region Skåne, samt av Statens kulturråd och Svenska Akademien. Shahrazad drivs i Sverige av Stockholms stad/Kulturhuset och har stöd av EACEA, EU:s genomförandeorgan för utbildning, audiovisuella medier och kultur."
31310489,134980,Dans l'empire des ténèbres : Un écrivain dans les geôles chinoises,2849413623,9782849413623,TR,https://s.gr-assets.com/assets/nophoto/book/111x148-bcc042a9c91a29c1d680899eff700a03.png,https://s.gr-assets.com/assets/nophoto/book/50x75-a91bf249278a81aabab721ef782c4a74.png,,,,,,false,51982547,1,3,5,1,0,5:1|4:0|3:0|2:0|1:0|total:1,,,,5.00,1,0,"['8275327', '134980', '1177411', '14804706']","['Yiwu Liao', 'Herta Müller', 'Marie Holzman', 'Jean-François Bouthors']","['4.17', '3.61', '3.67', '5.00']",[],[],[],
27212311,134980,Le vie sottili,,,TR,https://i.gr-assets.com/images/S/compressed.photo.goodreads.com/books/1444941181l/27212311._SX98_.jpg,https://i.gr-assets.com/images/S/compressed.photo.goodreads.com/books/1444941181l/27212311._SX50_.jpg,2011,,,ita,Gruppo Editoriale L'Espresso,false,47254186,1,4,5,1,0,5:1|4:0|3:0|2:0|1:0|total:1,2011,,,5.00,1,0,['134980'],['Herta Müller'],['3.61'],[],[],[],"Che cosa sono ""le vie sottili"" di cui ci parla in questo libro Herta Müller, la grande scrittrice rumena di lingua tedesca premio Nobel nel 2009? Sono le vie della nostalgia e della perdita, le vie del sogno e del senso inatteso che la realta' piu' crudele talvolta ci svela. Certo, la parola ""amore"", nel severo vocabolario dell'autrice, non ha cittadinanza: se non ritrovata come per caso nei discorsi frammentati della madre, sopravvissuta ai campi di concentramento sovietici, o nei lamenti del vecchio nonno, o ancora nei gesti di un tenero poeta amico, ormai scomparso.Nella scrittura altera e ruvida di Herta Müller, nei suoi racconti che sono anche spietate riflessioni sul nostro presente, i sentimenti non sono che brandelli, tracce di un'umanita' calpestata non una ma cento volte dal passo della Storia. Calpestata e tuttavia mai arresa - e forse e' proprio in questa resistenza che la parola ""amore"" potrebbe sbocciare."
9096547,134980,"Witness: Memory, Representation, and the Media in Question",8763504251,9788763504256,TR,https://i.gr-assets.com/images/S/compressed.photo.goodreads.com/books/1356496402l/9096547._SX98_.jpg,https://i.gr-assets.com/images/S/compressed.photo.goodreads.com/books/1356496402l/9096547._SX50_.jpg,2008,9,5,,Museum Tusculanum Press,false,13974887,1,7,5,2,0,5:0|4:1|3:0|2:0|1:1|total:2,2008,9,5,2.50,2,0,"['6132839', '4210140', '18795610', '6126937', '134980', '18795611', '18795612', '18795613', '4327601', '5559144', '3029025', '5592582', '6363832', '279398', '4962337', '18795614', '2995413', '18795615', '6989189', '18795616', '4571179', '18795617', '18795618', '18795619', '4505751', '14335398', '14808980', '6805377', '138138', '7528188', '7010382', '18173074', '4537383', '6216859', '4735182', '18795620', '18795621', '1302573', '18795622', '9360', '7766928']","['Ulrik Ekman', 'Frederik Tygstrup', 'Victoria Carlemalm', 'Dorothee Birke', 'Herta Müller', 'Sofie Nielsen', 'Michael Basseler', 'Rubén de la Nuez', 'Nikola Herweg', 'Ansgar Nünning', 'Sarah de Mul', 'Vera Nünning', 'Kerstin Bergman', 'Cathy Caruth', 'Désirée Schyns', 'Annette Storeide', 'Seth Kim-Cohen', 'Charlotte Greve', 'Ricarda Vidal', 'Eva Laass', 'Eivind Røssaak', 'Susanne Ø. Sæther', 'Louise Höjer', 'Nick Lambrianou', 'Aaslaug Vaa', 'Henrik Holm', 'Rasmus Øhlenschlæger Madsen', 'Jacob Lund Pedersen', 'Steven Connor', 'Stefanie Hoth', 'Morten Søndergaard', 'Mikkel Bruun Zangenberg', 'Alena Alexandrova', 'Janine Hauthal', 'Camilla Jalving', 'Bodil Børset', 'Mia Göran', 'Ansgar Warner', 'Nina Burkhardt', 'Thomas Elsaesser', 'Guido Isekenmeier']","['3.56', '3.00', '2.50', '3.60', '3.61', '2.50', '2.50', '2.50', '4.37', '3.70', '3.27', '3.36', '3.86', '3.87', '3.46', '2.50', '3.64', '2.50', '3.83', '2.50', '2.83', '2.50', '2.50', '2.50', '3.86', '3.00', '2.50', '3.00', '3.68', '2.50', '3.90', '2.50', '3.33', '3.00', '3.00', '2.50', '2.50', '3.17', '2.50', '3.80', '2.67']",[],[],[],"Witness presents a new body of work in the field by an international cast of scholars who engage with a complex set of questions concerning notions of witnessing and attestation in twentieth- and twenty-first century Western culture. Providing insight into this vital yet relatively unexplored concept –and the wide range of media and subject areas to which it lends itself – the volume not only establishes links with existing, currently canonical contributions to witness literature – from Primo Levi through Victor Klemperer to Imre Kertész – but also goes on to provide a set of analyses of exemplary and very recent literary works in that area. Furthermore, Witness extends and changes the previous scholarly tendency to focus strongly on historical evidence and the witness’s vocalization of true remembrance so as to include difficult theoretical and interpretative questions posed by studies today of traumatic experience, amnesia, visual culture, new media, and technology. The book includes contributions from the acclaimed Romanian-German author Herta Müller, Nobel laureate of literature 2009, and Cathy Caruth, the internationally recognized scholar in trauma studies."
52032792,134980,"Herta Müller. Tam gdzie nie można mówić. Słowo jako obraz, obraz jako słowo",,9788365851246,TR,https://s.gr-assets.com/assets/nophoto/book/111x148-bcc042a9c91a29c1d680899eff700a03.png,https://s.gr-assets.com/assets/nophoto/book/50x75-a91bf249278a81aabab721ef782c4a74.png,,,,,,false,73494845,1,3,5,1,0,5:1|4:0|3:0|2:0|1:0|total:1,,,,5.00,1,0,"['134980', '46052', '17801202', '17801203', '1753877', '1380382', '19585234', '3364511']","['Herta Müller', 'Michael Gross', 'Delfina Jałowik', 'Jürgen Kaumkötter', 'Norbert Lammert', 'Maria Anna Potocka', 'Christina Rossi', 'Michał Rusinek']","['3.61', '3.69', '4.50', '4.50', '4.17', '4.58', '5.00', '4.07']",[],[],[],"Publikacja zawiera wypowiedzi Michaela Großa, Norberta Lammerta, Marii Anny Potockiej, Christiny Rossi i Michała Rusinka, a także obszerną rozmowę z artystką, przeprowadzoną przez Delfinę Jałowik i Jürgena Kaumköttera. W części albumowej prezentujemy ponad 80 kolaży Herty Müller wraz z ich tłumaczeniami na język polski i angielski."
