id,author_id,title,isbn,isbn13,country_code,image_url,small_image_url,publication_year,publication_month,publication_day,language_code,publisher,is_ebook,work_id,total_editions_count,total_added_by,total_rating_sum,total_rating_count,total_text_reviews_count,rating_dist,original_publication_year,original_publication_month,original_publication_day,average_rating,ratings_count,text_reviews_count,authors_ids,authors_names,authors_average_rating,translators_ids,translators_names,translators_average_rating,description
9274358,134980,Cristina e il suo doppio,8838924708,9788838924705,TR,https://i.gr-assets.com/images/S/compressed.photo.goodreads.com/books/1319398689l/9274358._SX98_.jpg,https://i.gr-assets.com/images/S/compressed.photo.goodreads.com/books/1319398689l/9274358._SX50_.jpg,2010,,,ita,Sellerio,false,14156152,4,99,121,30,5,5:10|4:11|3:9|2:0|1:0|total:30,2009,,,4.03,13,2,['134980'],['Herta Müller'],['3.61'],['4672204'],['Mario Rubino'],['3.82'],"«Dovunque arrivassi, mi sono trovata a dover convivere con questo mio doppio. Non si limitavano a mandarmelo al seguito, succedeva anche che mi precorresse. Benché sin dall’inizio io abbia scritto sempre e soltanto contro la dittatura, il mio doppio continua fino ad oggi a battere la sua strada per i fatti propri. Si è reso autonomo».<br />Solo dopo insistenti richieste e ripetuti tentativi nel 2004 Herta Müller ha potuto visionare il suo doppio, ovvero il fascicolo che la Securitate di Bucarest aveva costruito ai suoi danni. Nome in codice «Cristina», novecento pagine di un dossier incompleto, sottoposto ad accurata «pulizia» da parte dei nuovi servizi rumeni, quelli non più comunisti. E seguendo il fascicolo l’autrice ha scritto questo, da lei stessa definito «racconto autobiografico». Lucida testimonianza letteraria sull’arma più micidiale in mano al potere opaco, che domina mediante il possesso esclusivo dell’informazione: l’arma della disinformazione. Più sottile della semplice calunnia, che agisce soprattutto tra i nemici, la disinformazione invece punta a distruggere le vittime nel campo degli amici, seminando quei dubbi e sospetti che proprio gli amici debbono temere. Herta Müller ne fu vittima, perché tedesca in terra rumena e perché scrittrice «ai margini». Sul lavoro, fu contattata dalla Securitate, che le chiese di diventare informatrice. Al suo rifiuto, scattarono i caratteristici tre momenti della trappola della «disinformazia». Primo: diffusione da parte del centro della falsa notizia che la vittima fosse un’informatrice del servizio stesso. Secondo: notizia «registrata» dal servizio, in apparente oggettività, che nell’ambiente della vittima si diffondeva una certa diffidenza a causa di sospetti sulla sua lealtà. Infine, terzo tempo: fonti di stampa diffondevano come «notizia» che i servizi avevano registrato informazioni sulle diffidenze.<br />Un libretto istruttivo, dunque, non solo per capire la vita governata dalle spie nel mondo comunista al suo epilogo; ma anche per orientarsi in luoghi e tempi lontani dal comunismo: dovunque, e accade sempre più spesso, ci sfiori l’esperienza della disinformazione."
20877180,134980,Barrevoetse februari,9044517414,9789044517415,TR,https://i.gr-assets.com/images/S/compressed.photo.goodreads.com/books/1471965249l/20877180._SX98_.jpg,https://i.gr-assets.com/images/S/compressed.photo.goodreads.com/books/1471965249l/20877180._SY75_.jpg,2014,1,31,nl,De Geus,false,2055151,7,63,118,34,6,5:9|4:8|3:11|2:2|1:4|total:34,1987,,,3.47,21,5,['134980'],['Herta Müller'],['3.61'],[],[],[],"Een groep zigeuners die onrust in het dorp brengt; een straat die alleen geasfalteerd is aan de kant van de burgemeesterswoning; de zondagen waarop een vader in een zwarte jas het huis verlaat en ’s avonds dronken thuiskomt. In <i>Barrevoetse februari</i> verwerkte Herta Müller ervaringen uit haar jeugd in een primitief Roemeens dorp met een Duitstalige bevolking, en uit haar leven in de stad onder de dictatuur van Ceaucescu. Angst en wantrouwen, en pijn om het verlies van vrienden, vormen de rode draad in deze schetsen."
3329413,134980,Die blassen Herren mit den Mokkatassen,3446206779,9783446206779,TR,https://i.gr-assets.com/images/S/compressed.photo.goodreads.com/books/1340089308l/3329413._SX98_.jpg,https://i.gr-assets.com/images/S/compressed.photo.goodreads.com/books/1340089308l/3329413._SX50_.jpg,2005,8,8,ger,Carl Hanser Verlag GmbH & Co. KG,false,3367406,1,62,113,28,2,5:11|4:10|3:5|2:1|1:1|total:28,2005,8,8,4.04,28,2,['134980'],['Herta Müller'],['3.61'],[],[],[],"Ein literarisches und ein optisches Vergnügen, Gedicht und Collage zugleich: Aus Zeitungsausschnitten und Bildern setzt Herta Müller ihre Texte zusammen, so dass jedes einzelne Gedicht zu einer ebenso verspielten wie künstlerisch konsequenten Collage wird. Ein wunderbares, unvergleichliches Buch, das zeigt, zu welchen spielerischen Formen die poetische Phantasie finden kann."
9456682,134980,مختارات من كتاب نوبل : همنجواي، ليسنج، مولر,,,TR,https://s.gr-assets.com/assets/nophoto/book/111x148-bcc042a9c91a29c1d680899eff700a03.png,https://s.gr-assets.com/assets/nophoto/book/50x75-a91bf249278a81aabab721ef782c4a74.png,2010,,,ara,الهيئة العامة لقصور الثقافة - القاهرة,false,14341505,1,113,101,34,12,5:3|4:7|3:10|2:14|1:0|total:34,2010,,,2.97,34,12,"['1455', '7728', '134980', '3405834', '2737639']","['Ernest Hemingway', 'Doris Lessing', 'Herta Müller', 'حسين عيد', 'إرنست همنغواي']","['3.83', '3.65', '3.61', '3.16', '3.38']",[],[],[],يحتوى هذا الكتاب على تراجم خمس عشرة قصة قصيرة لثلاثة كتاب حصلوا على جائزة نوبل فى الأدب<br /><br /> الأمريكى إرنست همنجواى : نوبل 1954<br />- قطة فى المطر<br />- عجوز على الجسر<br />- مكان نظيف جيد الإضاءة<br />- مخيم هندى<br />- حكاية قصيرة جدا<br /><br />الإنجليزية دوريس لسنج : نوبل 2007<br />- رحلة طيران<br />- هجوم معتدل للجراد<br />- فى المعرض الوطنى<br />- التحديق <br />- أنا بصفتى رياضية<br /><br />الألمانية هرتا مولر : نوبل 2009<br />- حمام سويبيان<br />- أوتوبيس الأرياف<br />- أسرتى<br />- موعظة الجنازة<br />- عن قصات شوارب وشعر ألمانية
6967828,134980,Die Nacht ist aus Tinte gemacht: Herta Müller erzählt ihre Kindheit im Banat,3932513886,9783932513886,TR,https://i.gr-assets.com/images/S/compressed.photo.goodreads.com/books/1340088769l/6967828._SX98_.jpg,https://i.gr-assets.com/images/S/compressed.photo.goodreads.com/books/1340088769l/6967828._SX50_.jpg,2009,8,31,ger,Supposé,false,7206719,1,53,98,22,0,5:13|4:7|3:1|2:1|1:0|total:22,2009,,,4.45,22,0,"['134980', '5596250', '1015806']","['Herta Müller', 'Thomas Böhm', 'Klaus Sander']","['3.61', '3.92', '4.46']",[],[],[],
12575701,134980,In trappola,8838925127,9788838925122,TR,https://i.gr-assets.com/images/S/compressed.photo.goodreads.com/books/1319399092l/12575701._SX98_.jpg,https://i.gr-assets.com/images/S/compressed.photo.goodreads.com/books/1319399092l/12575701._SX50_.jpg,2010,10,1,ita,Sellerio,false,4642863,5,50,81,21,6,5:5|4:8|3:8|2:0|1:0|total:21,1996,,,3.86,1,0,"['134980', '1652782']","['Herta Müller', 'Federica Venier']","['3.61', '2.75']",[],[],[],"Più che saggi letterari questi tre scritti di Herta Müller possono essere definiti incontri con una poesia intesa come vita, come pane quotidiano, come unico mezzo per sopravvivere. L’autrice riflette infatti su tre poeti e racconta del loro esprimersi in poesia, cercando nella loro esperienza l’«immagine dell’essere umano». Esperienza che non fu solo quella del totalitarismo, ma fu soprattutto, per loro e per una fetta importante di umanità, quella della continuità inconcepibile del totalitarismo: attraverso il nazismo, la guerra, i campi di concentramento, fino ai regimi comunisti dell’est europeo. Generazioni diverse e successive, perdute entro questa continuità senza vie di fuga dalla trappola. Cioè da quell’impasto di «paura di morire»; di angoscia di sapere (come Primo Levi) di essere legati a un capo della corda all’altro capo della quale sono i sommersi, i morti, e «che alla fine sono loro i più forti»; e di senso di colpa per appartenere a un’identica storia. La stessa trappola, del resto, prigione dell’autrice, che invisa al regime per le sue idee e per la sua provenienza etnica di tedesca sotto Ceauşescu, aveva contemporaneamente presente il ricordo colpevole del padre militare nelle SS. A questo assurdo indicibile solo la poesia come modo d’essere può ridare la parola. Così, molto più che scrivere di letteratura su sofferti poeti del mondo tedesco, Herta Müller legge, attraverso la poesia, nel vissuto, scava stati dell’animo come emergono dalle parole clandestine di tre menti vietate, deportate, dimenticate o suicide. Riflette sulla condizione di chi è costretto a dover scegliere sempre tra tre categorie di appartenenza: chi collabora volontariamente, chi può essere chiamato a collaborare e chi rifiuterà di collaborare lasciandosi come unica possibilità la poesia, detta o taciuta, emersa o sepolta per sempre."
29813045,134980,"Αντίδωρο για τον Ανταίο Χρυσοστομίδη: ""Να κοιτάζεις κάτι ωραίο...""",,9789605052324,TR,https://i.gr-assets.com/images/S/compressed.photo.goodreads.com/books/1459943652l/29813045._SX98_.jpg,https://i.gr-assets.com/images/S/compressed.photo.goodreads.com/books/1459943652l/29813045._SX50_.jpg,2016,,,gre,Άγρα - Ίκαρος - Εκδόσεις Καστανιώτη,false,50181910,1,41,70,16,5,5:8|4:6|3:2|2:0|1:0|total:16,2016,1,,4.38,16,5,"['4413883', '243571', '593480', '17175471', '125772', '163635', '16290', '164545', '14080', '134980', '3503583', '15496', '4142981', '15156208', '52069', '174045', '3449', '6434062', '15156209', '25334', '6555918', '15156210']","['Ανταίος Χρυσοστομίδης', 'Niccolò Ammaniti', 'Maurice Attia', 'Alan Holinghurst', 'Aris Fioretos', 'Daniel Kehlmann', 'Donna Leon', 'Norman Manea', 'Colum McCann', 'Herta Müller', 'Paolo Di Paolo', 'Amos Oz', 'Leonardo Padura', 'Annie E. Proulx', 'Santiago Roncagliolo', 'Ingo Schulze', 'Graham Swift', 'A.B. Yehoshua', 'Enrque Vila - Matas', 'Sarah Waters', 'Κώστας Κοσμάς', 'Μικέλα Χαρτουλάρη']","['3.87', '3.70', '3.99', '4.38', '3.51', '3.70', '3.88', '3.76', '3.92', '3.61', '3.51', '3.86', '4.07', '4.38', '3.61', '3.29', '3.66', '3.74', '4.38', '3.76', '3.44', '4.38']",[],[],[],"Κυκλοφόρησε με σύμπραξη των Εκδόσεων Άγρα, Ίκαρος και Καστανιώτης τιμητικός τόμος για τον ΑΝΤΑΙΟ ΧΡΥΣΟΣΤΟΜΙΔΗ, φτιαγμένος από φίλους του και συνεργάτες στις εκδόσεις, τις μεταφράσεις και τις ταινίες «Οι κεραίες της εποχής μας». Με τη φροντίδα της Μικέλας Χαρτουλάρη, 19 διάσημοι ξένοι συγγραφείς γράφουν για τον Ανταίο: Χέρτα Μύλλερ (βραβείο Νόμπελ), Άμος Οζ, Νικολό Αμμανίτι, Λεονάρντο Παδούρα, Ίνγκο Σούλτσε, Ενρίκε Βίλα-Μάτας, Σάρα Ουώτερς, Αβραάμ Γεοσούα, Πάολο ντι Πάολο, Άνι Πρου, Κόλουμ ΜακΚαν, Νόρμαν Μάνεα, Ντάνιελ Κέλμαν, Ντόνα Λεόν, Άρης Φιορέτος, Άλαν Χόλινγκχερστ, Μωρίς Αττιά, Σαντιάγκο Ρονκαλιόλο, Γκράχαμ Σουίφτ.<br /><br />Ο τόμος περιέχει και τα 3 πεζογραφήματα που έγραψε ο Ανταίος Χρυσοστομίδης στο τέλος της ζωής του: το ανέκδοτο «Νεκρή φύση με κουραμπιέδες σε νοσοκομείο», με πρωταγωνιστή τον Αντόνιο Ταμπούκι, στο οποίο συντελείται ένα θαύμα, τα «Κίτρινα παπούτσια», που έκανε μεγάλη αίσθηση όταν πρωτοκυκλοφόρησε το 2014 σε επετειακό τόμο των εκδόσεων Ίκαρος, και το ανέκδοτο «Ιβίσκος», απ’ όπου και η φράση «Να κοιτάζεις κάτι ωραίο...». Τα δύο τελευταία πραγματεύονται λογοτεχνικά την υπό εξέλιξη ασθένεια και τη στάση απέναντί της.<br /><br />Την έκδοση συνοδεύουν 26 φωτογραφίες και αναλυτικό εργοβιογραφικό σημείωμα.<br /><br />Ο Ανταίος Χρυσοστομίδης γεννήθηκε στο Κάιρο της Αιγύπτου το 1952 και έφυγε από τη ζωή στις 14 Αυγούστου 2015, χτυπημένος από μια εκφυλιστική, βασανιστική, παραλυτική ασθένεια."
2050212,134980,Children of Ceausescu,1884167101,9781884167102,TR,https://i.gr-assets.com/images/S/compressed.photo.goodreads.com/books/1354902329l/2050212._SX98_.jpg,https://i.gr-assets.com/images/S/compressed.photo.goodreads.com/books/1354902329l/2050212._SX50_.jpg,2005,8,1,,Umbrage Editions,false,2055148,2,63,60,14,1,5:9|4:1|3:3|2:1|1:0|total:14,2001,1,1,4.29,13,1,"['516251', '134980']","['Kent Klich', 'Herta Müller']","['3.97', '3.61']",[],[],[],"Decades after the fall of the iron curtain and the overthrow and execution of brutal Romanian dictator Nicholas Ceausescu, the worst AIDS epidemic among children in the world bears out its infamous legacy in Romania, still one of the poorest and most fractured societies in Eastern Europe.<br /><br />Beginning in 1994 and for the next five years, Magnum photographer Kent Klich traveled to Romania to document the appalling aftermath of Ceausescu’s horror. Nobel winner Herta Müller contributed a poignant essay to this project.<br /><br /> <br /><br />"
2926898,134980,Este sau nu este Ion,9736819949,,TR,https://s.gr-assets.com/assets/nophoto/book/111x148-bcc042a9c91a29c1d680899eff700a03.png,https://s.gr-assets.com/assets/nophoto/book/50x75-a91bf249278a81aabab721ef782c4a74.png,2005,,,rum,Polirom,false,2954240,2,52,54,16,2,5:4|4:4|3:3|2:4|1:1|total:16,2005,,,3.38,15,2,['134980'],['Herta Müller'],['3.61'],[],[],[],"Cartea este insotita de un CD audio continind poeziile in lectura autoarei, realizat in colaborare cu sectia romana a Deutsche Welle (redactor Rodica Binder).<br /><br />Volumul reuneste poezii scrise de Herta Muller folosind cuvinte decupate din reviste, cu precadere din Plai cu boi: texte vaporoase, suprarealiste, jucause. Un deliciu literar si vizual, poeme si colaje simultan, un volum care se cere nu numai citit, ci si privit. Este prima carte scrisa in romana a autoarei de la plecarea in 1987 in Germania.<br /><br />„Herta Muller isi scoate de sub pat, de sub cap, plaiul cu boi, ia forfecuta de unghii si harst taie cuvintele, le pune’n mojar si face colaje, cofraje, montaje, blocuri cu multe etaje in absurdistan unde urmuz e capitan si limba romana se unduieste sub rasfaturi germane ca o cadina.” (Nora Iuga)"
16033414,134980,Lebensangst und Worthunger,3518126202,,TR,https://i.gr-assets.com/images/S/compressed.photo.goodreads.com/books/1416860924l/16033414._SX98_.jpg,https://i.gr-assets.com/images/S/compressed.photo.goodreads.com/books/1416860924l/16033414._SY75_.jpg,2010,10,1,ger,Suhrkamp Verlag Gmbh,false,21804514,3,40,50,14,0,5:3|4:5|3:4|2:1|1:1|total:14,2010,10,1,3.57,9,0,['134980'],['Herta Müller'],['3.61'],[],[],[],
11395116,134980,Der Wächter nimmt seinen Kamm,,9783498043544,TR,https://i.gr-assets.com/images/S/compressed.photo.goodreads.com/books/1305727633l/11395116._SX98_.jpg,https://i.gr-assets.com/images/S/compressed.photo.goodreads.com/books/1305727633l/11395116._SX50_.jpg,2010,11,,ger,Rowohlt,false,16327451,2,17,38,9,0,5:5|4:1|3:3|2:0|1:0|total:9,2010,11,,4.22,7,0,['134980'],['Herta Müller'],['3.61'],[],[],[],
4089392,134980,Heimat ist das was gesprochen wird,3935731086,9783935731089,TR,https://i.gr-assets.com/images/S/compressed.photo.goodreads.com/books/1340087881l/4089392._SY160_.jpg,https://i.gr-assets.com/images/S/compressed.photo.goodreads.com/books/1340087881l/4089392._SY75_.jpg,2001,1,31,ger,Gollenstein,false,4136540,2,36,38,10,2,5:1|4:8|3:0|2:0|1:1|total:10,2001,1,31,3.80,8,2,['134980'],['Herta Müller'],['3.61'],[],[],[],
2343638,134980,Der Teufel sitzt im Spiegel: Wie Wahrnehmung sich erfindet,3880227675,9783880227675,TR,https://i.gr-assets.com/images/S/compressed.photo.goodreads.com/books/1340087940l/2343638._SY160_.jpg,https://i.gr-assets.com/images/S/compressed.photo.goodreads.com/books/1340087940l/2343638._SY75_.jpg,1991,7,,ger,,false,2350348,2,25,35,10,0,5:2|4:3|3:3|2:2|1:0|total:10,1991,,,3.50,6,0,['134980'],['Herta Müller'],['3.61'],[],[],[],
36385294,134980,Nemačka priča,,9788680274065,TR,https://i.gr-assets.com/images/S/compressed.photo.goodreads.com/books/1535275484l/36385294._SX98_.jpg,https://i.gr-assets.com/images/S/compressed.photo.goodreads.com/books/1535275484l/36385294._SY75_.jpg,2017,,,srp,Ultimatum,false,58076038,1,12,32,9,0,5:3|4:1|3:3|2:2|1:0|total:9,,,,3.56,9,0,"['18474998', '8030528', '39848', '907927', '179391', '26853', '500054', '128607', '114738', '90174', '666279', '952101', '749461', '704105', '43219', '235662', '139629', '164786', '39326', '908640', '1541949', '942226', '134980', '187672', '757384', '151630', '596951', '377587', '18346740', '188893', '6530', '40055', '794999', '1026895', '16747', '16073', '854011', '1241900', '599971', '209634', '7745', '305463', '18346741', '523898', '50370', '783022', '161913', '147584']","['Rolf Schroers', 'Nikola B. Cvetković', 'Alexander Kluge', 'Antonio Fian', 'Arno Schmidt', 'Bertolt Brecht', 'Christa Reinig', 'Elfriede Jelinek', 'Erich Fried', 'Ernst Jandl', 'Franz Hohler', 'Günter Eich', 'Günter Grass', 'Günter Kunert', 'Gustav Meyrink', 'Hans Christoph Buch', 'Hansjörg Schneider', 'Heiner Müller', 'Heinrich Böll', 'Helga M. Novak', 'Helga Schubert', 'Herbert Heckmann', 'Herta Müller', 'Hubert Fichte', 'Jakov Lind', 'Johannes Bobrowski', 'Jürgen Becker', 'Kurt Marti', 'Manfred Wrembel', 'Marie Luise Kaschnitz', 'Max Frisch', 'Peter Bichsel', 'Peter Hertling', 'Reinhard Lettau', 'Robert Musil', 'Robert Walser', 'Robert Wolfgang Schnell', 'Ror Wolf', 'Rudolf Herfurtner', 'Stephan Hermlin', 'Thomas Bernhard', 'Ulla Berkéwicz', 'Vagelis Tsakiridis', 'Volker Braun', 'Walter Bauer', 'Wolfgang Deichsel', 'Wolfgang Ebert', 'Wolfgang Hildesheimer']","['3.54', '3.55', '3.91', '3.66', '4.10', '3.78', '3.88', '3.53', '4.26', '3.95', '3.70', '3.94', '3.83', '3.70', '3.88', '3.59', '3.60', '3.87', '3.87', '3.91', '3.63', '3.77', '3.61', '3.87', '3.88', '3.91', '3.79', '3.87', '3.56', '3.72', '3.76', '3.79', '3.56', '3.81', '4.01', '3.99', '4.18', '3.54', '3.62', '3.61', '4.06', '3.33', '3.56', '3.30', '4.48', '3.56', '3.42', '3.96']",[],[],[],
23635745,134980,Fler nobeller - Noveller av Nobelpristagare,,9789172216433,TR,https://i.gr-assets.com/images/S/compressed.photo.goodreads.com/books/1417348448l/23635745._SX98_.jpg,https://i.gr-assets.com/images/S/compressed.photo.goodreads.com/books/1417348448l/23635745._SX50_.jpg,2012,,,swe,En bok för alla,false,43240672,1,23,23,8,2,5:0|4:0|3:7|2:1|1:0|total:8,2012,1,1,2.88,8,2,"['9939238', '9939239', '446692', '134980', '1197', '3989', '9939240', '36635', '1113469', '8550', '3534', '7728', '4391', '1709', '1545124', '22515', '978', '65633', '957894', '18317', '3439713', '6669']","['Gun Ekroth', 'Lars Rydquist', 'Tomas Tranströmer', 'Herta Müller', 'Harold Pinter', 'V.S. Naipaul', 'Imre Kertésy', 'Juan Ramón Jiménez', 'Hermann Hesse', 'Yasunari Kawabata', 'Toni Morrison', 'Doris Lessing', 'Saul Bellow', 'Grazia Deledda', 'Johannes V. Jensen', 'Mario Vargas Llosa', 'Wole Soyinka', 'J.M.G. Le Clézio', 'Albert Camus', 'Knut Hamsun', 'Kenzaburō Ōe', 'Wisława Szymborska']","['3.15', '2.88', '4.08', '3.61', '3.79', '3.70', '2.88', '3.82', '4.05', '3.75', '3.91', '3.65', '3.76', '3.64', '3.74', '3.97', '3.81', '3.65', '4.00', '4.00', '3.78', '4.32']",[],[],[],"Nobelpristagare i kortform!<br />Nästan alla nobelpristagare i litteratur har skrivit noveller. En novell är som alla vet en kort skönlitterär text, men vad är en nobell? I en här samlingen finns även andra former av korta texter: utdrag ur romaner eller essäistiska och anekdotiska berättelser. En nobell är helt enkelt att utmärkt sätt att bekanta sig med nobelpristagarna när man inte hunnit läsa deras längre romaner!<br />Den första volymen med Nobeller kom på En bok för alla 2007. Den nya boken omfattar även den hela nobelprisets historia från 1901 till 2011 då Tomas Tranströmer fick priset.<br />Här finns utöver honom Hertha Müller, Harold Pinter, Imre Kertez, Toni Morrison, Doris Lessing, Vargas Llosa, J M G Le Clezio och många andra."
25160005,134980,Het is altijd nu,9044535323,9789044535327,TR,https://i.gr-assets.com/images/S/compressed.photo.goodreads.com/books/1426581504l/25160005._SX98_.jpg,https://i.gr-assets.com/images/S/compressed.photo.goodreads.com/books/1426581504l/25160005._SX50_.jpg,2015,3,12,nl,De Geus,false,44863447,2,18,22,6,0,5:1|4:2|3:3|2:0|1:0|total:6,2015,3,12,3.67,6,0,"['4641093', '296961', '1462', '1169504', '26093', '178905', '13424', '19916', '69454', '27427', '3369', '649610', '34031', '15543', '40851', '171414', '10838', '40485', '36378', '70642', '36438', '3602', '71956', '6538289', '134980', '39280', '31425', '1728', '560072', '76812', '19023120', '1074764', '39317', '104544', '17450707', '8306700', '80637', '256362', '2736291', '73034', '11562', '547406']","['Annelies Beck', 'Paul Auster', 'Julian Barnes', 'A.S. Byatt', 'Mircea Cărtărescu', 'Bernardo Carvalho', 'Javier Cercas', 'Jonathan Coe', 'Marie Darrieussecq', 'Lydia Davis', 'Amitav Ghosh', 'Jens Christian Grøndahl', 'David Grossman', 'Alan Hollinghurst', 'Siri Hustvedt', 'Howard Jacobson', 'Ismail Kadare', 'António Lobo Antunes', 'Amin Maalouf', 'Alain Mabanckou', 'Claudio Magris', 'Alberto Manguel', 'Javier Marías', 'David Mitchell', 'Herta Müller', 'Antonio Muñoz Molina', 'Ben Okri', 'Orhan Pamuk', 'José Luís Peixoto', 'Olivier Rolin', 'Nawai El Sadaaw', 'Boualem Sansal', 'Jorge Semprún', 'Meir Shalev', 'Michaïl Sjisjkin', 'Goce Smilevski', 'Su Tong', 'Ilija Trojanow', 'Dubravka Ugrešić', 'Juan Gabriel Vásquez', 'Derek Walcott', 'Kjell Westö']","['3.15', '3.81', '3.71', '3.81', '3.79', '3.76', '3.76', '3.79', '3.45', '4.03', '3.91', '3.59', '3.81', '3.63', '3.74', '3.20', '3.83', '3.92', '4.06', '3.60', '3.80', '3.88', '3.86', '3.94', '3.61', '3.60', '3.69', '3.76', '3.93', '3.41', '3.67', '3.28', '4.04', '4.07', '3.58', '3.56', '3.54', '3.53', '3.82', '3.76', '4.02', '3.78']",[],[],[],"Een bundel met de interessantste essays en interviewfragmenten uit de eerste tien bestaansjaren van Passa Porta, het internationale literatuurhuis in Brussel, sinds 2004 organisator van lezingen, literatuurfestivals, schrijversverblijven. Een keur aan internationale beroemdheden buigt zich over kracht van de literaire verbeelding, de relevantie van literatuur in tijden van globalisering. Voorafgaand aan de selectie uit de literaire interviews, mijmert VRT-journaliste Annelies Beck over het belang van literaire interviews, de verwachtingspatronen van auteurs, interviewers en lezers. Met boeiende reflecties van o. a. Jens Christian Grøndahl, Alberto Manguel, Antonio Muñoz Molina, Nawal El Saadawi, Paul Auster, Julian Barnes, A.S. Byatt, Bernardo Carvalho, Jonathan Coe, Lydia Davis, Amitav Ghosh, David Grossman, Alan Hollinghurst, Siri Hustvedt, Ismail Kadare, Amin Maalouf, Javier Marías, David Mitchell, Herta Müller, Ben Okri, Orhan Pamuk, Jorge Semprún, Meir Shalev en Derek Walcott. Een belangrijke bundel.<br /><br />Literatuur brengt ons schoonheid, troost en verstrooiing. Maar schrijvers die ertoe doen brengen ons nog meer dan dat. Goede literatuur is altijd actueel, al komt ze van vroeger tijden of van ver. Goede literatuur vertelt altijd hoe het is om hier en nu te leven.<br />Het is altijd nu bundelt de opmerkelijkste teksten, essays en gespreksfragmenten uit de eerste tien bestaansjaren van Passa Porta, het internationale literatuurhuis in Brussel. Ze tonen een literatuur die blijft denken, blijft geven, en openingen blijft maken."
4089393,134980,Im Haarknoten wohnt eine Dame,3498044745,9783498044749,TR,https://i.gr-assets.com/images/S/compressed.photo.goodreads.com/books/1340088093l/4089393._SX98_.jpg,https://i.gr-assets.com/images/S/compressed.photo.goodreads.com/books/1340088093l/4089393._SX50_.jpg,2000,7,,ger,Rowohlt,false,4136541,2,20,21,5,1,5:2|4:2|3:1|2:0|1:0|total:5,2000,7,,4.20,3,1,['134980'],['Herta Müller'],['3.61'],[],[],[],
