id,author_id,title,isbn,isbn13,country_code,image_url,small_image_url,publication_year,publication_month,publication_day,language_code,publisher,is_ebook,work_id,total_editions_count,total_added_by,total_rating_sum,total_rating_count,total_text_reviews_count,rating_dist,original_publication_year,original_publication_month,original_publication_day,average_rating,ratings_count,text_reviews_count,authors_ids,authors_names,authors_average_rating,translators_ids,translators_names,translators_average_rating,description
23044238,29963,ادیپ شهریار,,,TR,https://i.gr-assets.com/images/S/compressed.photo.goodreads.com/books/1409038408l/23044238._SX98_.jpg,https://i.gr-assets.com/images/S/compressed.photo.goodreads.com/books/1409038408l/23044238._SX50_.jpg,1961,,,per,اندیشه,false,3098166,693,237345,611116,165056,3133,5:40673|4:56292|3:50031|2:14430|1:3630|total:165056,-429,,,3.70,52,5,['1002'],['Sophocles'],['3.77'],['1012343'],['Shahrokh Meskoob'],['3.87'],عنوان: ادیپ شهریار؛ اثر: سوفوکل، مقدمه و ترجمه: بهیار(شاهرخ مسکوب)، مشخصات نشر: تهران، اندیشه، 1340، در 96 ص
30750510,29963,نمایشنامه اودیپوس,,,TR,https://i.gr-assets.com/images/S/compressed.photo.goodreads.com/books/1466888102l/30750510._SX98_.jpg,https://i.gr-assets.com/images/S/compressed.photo.goodreads.com/books/1466888102l/30750510._SY75_.jpg,1999,8,,per,فام آوند,false,3098166,693,237345,611116,165056,3133,5:40673|4:56292|3:50031|2:14430|1:3630|total:165056,-429,,,3.70,4,1,['1002'],['Sophocles'],['3.77'],['15400985'],['پیمان دفتری'],['3.50'],"Sophocles' Oedipus Rex has never been surpassed for the raw and terrible power with which its hero struggles to answer the eternal question, ""Who am I?"" The play, a story of a king who acting entirely in ignorance kills his father and marries his mother, unfolds with shattering power; we are helplessly carried along with Oedipus towards the final, horrific truth."
36369302,29963,گیتانجالی,,,TR,https://i.gr-assets.com/images/S/compressed.photo.goodreads.com/books/1507388978l/36369302._SX98_.jpg,https://i.gr-assets.com/images/S/compressed.photo.goodreads.com/books/1507388978l/36369302._SX50_.jpg,2014,,,per,الهام اندیشه,false,2066877,432,25692,36530,8451,552,5:4643|4:2420|3:1005|2:237|1:146|total:8451,1910,,,4.32,5,2,"['36913', '17210091']","['Rabindranath Tagore', 'رویا خاکسار']","['4.13', '2.60']",[],[],[],"Nobel laureate Rabindranath Tagore was one of the most important writers in 20th-century Indian literature. Among his expansive and impressive body of work, ""Gitanjali"" is regarded as one of his greatest achievements, and has been a perennial bestseller since it was first published in 1910."
28510403,29963,باغبان,,,TR,https://i.gr-assets.com/images/S/compressed.photo.goodreads.com/books/1452506399l/28510403._SX98_.jpg,https://i.gr-assets.com/images/S/compressed.photo.goodreads.com/books/1452506399l/28510403._SX50_.jpg,1957,,,per,کابل، 1336,false,784925,84,3777,6783,1582,103,5:824|4:474|3:214|2:55|1:15|total:1582,1913,,,4.29,3,1,"['36913', '14847830']","['Rabindranath Tagore', 'پژمان']","['4.13', '4.67']",[],[],[],"The Gardener, Rabindranath Tagore<br />عنوان: باغبان؛ نویسنده: رابیندرانات تاگور؛ مترجم: پژمان، کابل، 1336، در 88 ص"
23635157,29963,کوهولین,,,TR,https://i.gr-assets.com/images/S/compressed.photo.goodreads.com/books/1505653067l/23635157._SX98_.jpg,https://i.gr-assets.com/images/S/compressed.photo.goodreads.com/books/1505653067l/23635157._SX50_.jpg,1975,,,per,انتشارات محمدی,false,3248477,12,196,394,110,9,5:21|4:38|3:37|2:12|1:2|total:110,1903,,,3.58,8,4,['29963'],['W.B. Yeats'],['4.16'],['6471973'],['مسعود فرزاد'],['4.04'],"نمایشنامه ای براساس روایت ایرلندی رستم و سهراب<br /><br />این ترجمه نخستین بار در سال 1313 هجری شمسی که سال برگزاری جشن هزاره فردوسی در ایران بود در ""فردوسی نامه"" مجله مهر منتشر شد<br /><br />نمایشنامه ای است که ویلیام باتلر ییتس - نویسنده ی ایرلندی برنده ی نوبل ادبیات سال 1923 - بر مبنای یکی از اسطوره های ایرلندی نگاشته است. این اسطوره معادل اسطوره ی رستم و سهراب در فرهنگ ما است. کوهولین که پهلوانی است نامدار از سر اجبار به پیروی از کنوهار، شاه شاهان، تن می دهد و برای حفظ تاج و تخت او شاهزاده ای مهاجم را می کشد اما در نهایت متوجه می شود که او پسر خود او و فرزند زنی است که بسی دوستش می داشت"
6850875,29963,از شکسپیر تا الیوت,,9786005757224,TR,https://i.gr-assets.com/images/S/compressed.photo.goodreads.com/books/1345197211l/6850875._SX98_.jpg,https://i.gr-assets.com/images/S/compressed.photo.goodreads.com/books/1345197211l/6850875._SY75_.jpg,2010,,,per,کتاب آمه,false,7063744,1,102,124,33,4,5:6|4:17|3:7|2:2|1:1|total:33,2003,,,3.76,33,4,"['22583', '77318', '158432', '13453', '64845', '45882', '11978', '2697', '13638502', '67032', '24391', '1438', '101643', '143178', '7440', '38069', '29963', '7715', '16380', '947', '5144', '17623', '30055', '18540', '11154', '10547', '36910', '160070', '233593', '304341', '57189', '64716', '996', '4379', '1972315']","['Ben Jonson', 'John Donne', 'Andrew Marvell', 'William Blake', 'William Wordsworth', 'Percy Bysshe Shelley', 'John Keats', 'Henry Wadsworth Longfellow', 'Alfred Tennyson', 'Elizabeth Barrett Browning', 'Robert Browning', 'Walt Whitman', 'Dante Gabriel Rossetti', 'Christina Rossetti', 'Emily Dickinson', 'A.E. Housman', 'W.B. Yeats', 'Robert Frost', 'Carl Sandburg', 'William Shakespeare', 'James Joyce', 'D.H. Lawrence', 'Ezra Pound', 'T.S. Eliot', 'Archibald MacLeish', 'E.E. Cummings', 'Langston Hughes', 'Stevie Smith', 'W.H. Auden', 'Louis MacNeice', 'Dylan Thomas', 'Philip Larkin', 'Ted Hughes', 'Sylvia Plath', '(محمود مشرف آزاد تهرانی (م. آزاد']","['3.54', '4.14', '3.90', '4.17', '4.00', '4.01', '4.18', '4.01', '4.08', '4.03', '3.98', '4.13', '4.10', '4.03', '4.20', '4.04', '4.16', '4.25', '4.13', '3.87', '3.74', '3.59', '3.94', '4.16', '3.95', '4.24', '4.26', '3.83', '4.17', '4.12', '4.16', '4.07', '4.09', '4.04', '3.61']",['3071583'],['سعید سعیدپور'],['3.57'],استنلی برنشا، شاعر و مترجم آمریکایی معتقد است‌که «تنهاراه تجربۀ شعر در زبانی‌دیگر این است‌که یادبگیریم یک‌شعر را بشنویم و بخوانیم، یعنی بتوانیم آن‌را تلفظ کنیم». به‌پیشنهاد او مترجم از هر زبانی‌که ترجمه می‌کند، باید متن اصلی شعر را بیاورد و کلید تلفّظ شعر را به آن‌زبان به‌دست دهد، چنان‌که خواننده بتواند خصوصیات لفظی و بصری شعر را درک کند، یعنی آن‌بخش از زبان شعر را که در ترجمه ازدست می‌رود، برای خواننده مطرح‌کند (هرچند برنشا به‌جای ترجمۀ شعر معتقد به نوعی‌تفسیر شعری است).<br />هدف‌از دوزبانه‌کردن این‌مجموعه جز این نیست‌که خوانندگان با ویژگی‌های دیداری و شنیداری متن اصلی آشنا شوند. خواننده اگر خود دقت کند، می‌تواند مثلاً قافیه‌های درونی و بیرونی و جناس‌های لفظی و هماوایی مصوّت‌ها را در شعر به‌گوش بشنود و ساخت بصری شعر را به‌چشم ببیند.
40549541,29963,گربه و ماه,,9789642436972,TR,https://i.gr-assets.com/images/S/compressed.photo.goodreads.com/books/1529248076l/40549541._SX98_.jpg,https://i.gr-assets.com/images/S/compressed.photo.goodreads.com/books/1529248076l/40549541._SY75_.jpg,93,,,per,افراز,false,1991078,6,29,43,10,0,5:6|4:1|3:3|2:0|1:0|total:10,1924,,,4.30,1,0,['29963'],['W.B. Yeats'],['4.16'],['4129847'],['فرید قدمی'],['3.17'],گدای کور از «مسیحیت» حرف می زند و گفتار گناهکار- قدیس را (همچون دوتایی های دیگر مردم- دولت و بنده- ارباب) گفتار قدرت می داند. قدیس تا زمانی «قدیس» است که گناهکار «گناهکار» باشد. (آنچنان که ارباب تا زمانی «ارباب» است که بنده «بنده» باشد.) هرچه گناهکار بیشتر در جایگاه گناهکاری اش فرو برود، قدیس نیز محکم تر بر مسند قدیسی اش تکیه خواهد زد. قدیس علاقه ای به دست شستن گناهکار از گناهانش ندارد، چرا که در آن صورت اوست که جایگاه والایش را از دست خواهد داد. (از موخره ی مترجم)
26009855,29963,نمادگرایی (سمبولیسم) درادبیات نمایشی ٢,,,TR,https://i.gr-assets.com/images/S/compressed.photo.goodreads.com/books/1528934004l/26009855._SX98_.jpg,https://i.gr-assets.com/images/S/compressed.photo.goodreads.com/books/1528934004l/26009855._SX50_.jpg,1989,7,,per,برگ,false,45929068,1,5,5,2,0,5:0|4:0|3:1|2:1|1:0|total:2,1989,7,1,2.50,2,0,"['7857295', '29963']","['فرهاد ناظرزاده کرمانی', 'W.B. Yeats']","['3.32', '4.16']",[],[],[],به همراه ترجمه نمایشنامه برزخ از ویلیام باتلر ییتز
52658549,29963,دریانوردی به سمت بیزانس,,,TR,https://i.gr-assets.com/images/S/compressed.photo.goodreads.com/books/1585027490l/52658549._SX98_.jpg,https://i.gr-assets.com/images/S/compressed.photo.goodreads.com/books/1585027490l/52658549._SX50_.jpg,,,,per,ایهام,false,78459591,1,0,0,0,0,5:0|4:0|3:0|2:0|1:0|total:0,,,,0.00,0,0,['29963'],['W.B. Yeats'],['4.16'],['1401455'],['Rosa Jamali'],['3.97'],"ویلیام باتلر ییتس یکی از مهم ترین شاعران انگلیسی زبان در قرن بیستم است. او که از پدری نقاش و مادری که گنجینه ی ادبیات فلکلوریک ایرلند و داستان های جن و پری بود متولد شد کودکی خود را در اسلیگو گذراند؛ جائیکه آن چشم انداز بن بالبن و دریاچه ی اینزفری منبع الهام بسیاری از اشعارش شد.<br /> ییتس از طلایه داران سمبلیسم در شعر انگلیسی ست و از معاشران ازراپاوند بوده است. درباب سبک شعری او باید گفت که زبان او متاثر از شاعران پیشارافائلی ست که نقاشی و هنرهای تجسمی را در شعر احیاء کرده بودند. از طلایه داران جنبش پیشارافائلی در اینجا می توان به شاعری مثل دانته گابریل روزتی اشاره کرد که بر آثار آغازین ییتس موثر بوده است.در عین حال شعر ییتس را می توان متاثر از شعر مذهبی ویلیام بلیک دانست. نشانه ها و نشانه سازی در شعرش مهم است، نوعی از بیانگری، روایت، داستان پردازی و بی واسطه نویسی در آثارش دیده می شود. اشارات فراوان او به اساطیر یونان، کتاب مقدس و ادبیات عامه ی ایرلند به غنای کارش افزوده است. <br />از شخصیت های فولکلوریک در شعر او می توان به اوشین ( افسانه ای گیلیک) اشاره کرد. از شخصت های ملی می توان به مادگان ، اوئن هارن، لیدی گریگوری، هنرهن و غیره اشاره کرد.<br />او از شخصیت هایی ست که بر جنبش آزادیخواهانه ی ایرلند اثر بسیاری گذاشته است و در استقلال جمهوری ایرلند نقشی مهم را ایفا کرده است. آثار ییتس از منظر پسااستعماری مورد مطالعات فراوان قرار گرفته است و شعر او از جمله آثاری ست که پس از آزادی ایرلند از نقش مسلط امپراطوری بریتانیا بر بازیابی هویت ایرلندی ها تاثیر گذار بوده است.<br />ییتس به مثابه ی شاعری ملی گرا همیشه در جستجوی حقیقت است و گاه سیاستمداران دروغین سرزمین اش را به "" دلقکان از خویش زائیده‌ی کردار آدمی"" ماننده می کند. او از سیاستمداران دروغین و طبقه ی متوسط بی خیال انتقاد می کند و به جامعه ی دهقانان می پیوندد که ادبیات شفاهی را زنده نگه داشته اند. نمونه ای کم نظیر از ادبیات غرب است که با ذائقه ی شرقی همخوانی دارد. شعر او گاه سرشاراز لحن های متکثر نمایشی ست و گاه تک گویی هایی ساده. نمایشی از عرفان مدرن برگرفته از طبیعت گرایی، نگرش نئوافلاطونی ، شمنیسم و باورهای ایرلندی. <br />علت علاقه ی من به عنوان مترجم به شعرییتس یکی به خاطر شباهت های شعر او به بن مایه های عرفانی ادبیات کلاسیک فارسی ست و دیگری به خاطر استفاده ی فراوان از اشعار او درموسیقی فلکلور سلتیک است. بسیاری از شعرهای ییتس در ترانه های لورنا مکنیت به شکل بسیار زیبایی اجرا شده است. <br />ییتس همچنین پایه گذار تئاتر ملی ایرلند است. تئاتری که اسطوره های کهن سلتیک بنا شده است. نمایشنامه های ییتس همه غنی از ادبیات عامه ایرلند هستند. داستان کوهولین به داستان رستم و سهراب بی شباهت نیست . آثار نمایشی او در نگاه یک خواننده ی فارسی زبان قابل مقایسه با نمایشنامه های بیضایی ست که به نوعی اساطیر و تاریخ ایران را در قالب نمایش احیاء کرده است و به این قالب ادبی هویتی ملی بخشیده است به دیگر بیان شعرییتس ناخودآگاه جمعی ایرلندی هاست که در زمان رنسانس ایرلندی و باززائی گذشته ی اساطیری سلتیک آن معنا گرفته است.<br />ییتس نوعی نگرش نئوافلاطونی و عرفانی در شعر دارد. در شعرهای بیزانس و آمدنی دوباره نوعی بازگشت به دوران طلائی مذهب و تقدس در آثارش مشاهده می شود. ییتس بیش ازآنکه به مسیحیت متداول نزدیک شود به کشف رموز، سیر و سلوک در طبیعت، آئین کاهنان سلتی و الهامات عرفانی معتقد بود و در دنیای صوفیانه ی خانقاهی که آن را می جست به مقام سپیده دم طلایی رسید. او از شاعرانی ست که به اهمیت دانش پنهان، علوم خفیه و علم لدنی صحه می گذارد.<br />شاید ""هدیه ی هارون الرشید"" تنها شعری ازین مجموعه باشد که بازتاب دهنده ی شرق گرایی و شرق شناسی در ادبیات انگلیسی ست. پیش از ییتس لرد بایرون با سفر به امپراطوری عثمانی اسامی و فضاسازی شرقی را وارد شعر انگلیسی کرده بود و نیمه ی دوم قرن هجدهم را می توان اوج علاقه ی نویسندگان به مضامین شرق گرایانه دانست."
