id,author_id,title,isbn,isbn13,country_code,image_url,small_image_url,publication_year,publication_month,publication_day,language_code,publisher,is_ebook,work_id,total_editions_count,total_added_by,total_rating_sum,total_rating_count,total_text_reviews_count,rating_dist,original_publication_year,original_publication_month,original_publication_day,average_rating,ratings_count,text_reviews_count,authors_ids,authors_names,authors_average_rating,translators_ids,translators_names,translators_average_rating,description
2604056,18540,درباره فرهنگ,,9789643055134,TR,https://i.gr-assets.com/images/S/compressed.photo.goodreads.com/books/1450541734l/2604056._SX98_.jpg,https://i.gr-assets.com/images/S/compressed.photo.goodreads.com/books/1450541734l/2604056._SX50_.jpg,1990,,,per,مرکز,false,2051832,24,1225,1111,306,47,5:71|4:99|3:99|2:26|1:11|total:306,1948,,,3.63,9,2,['18540'],['T.S. Eliot'],['4.16'],['1852999'],['حمید شاهرخ'],['3.74'],"درباره فرهنگ مجموعه جستارهایی است از تی.اس.الیوت به ترجمه حمید شاهرخ که نشر مرکز نخستین بار در سال 1369 آن را منتشر کرد و بعد از آن کتاب تا سال 1387 به چاپ چهارم رسید. یعنی در قریب به 24 سال این کتاب 4 بار چاپ شده است که نظر به اهمیت و موضوعیت کتاب تجدید چاپ‌های آن قابل توجه نمی‌نماید. البته با توجه به شرایط نشر کتاب، به تعداد چاپ این کتاب نمی‌توان خرده گرفت اما با توجه به اینکه این کتاب آنچنان مورد توجه جامعه ادبی قرار نگرفته است می‌توان آن را ذیل ""ادبیات پشت پرده"" بررسی کرد.<br /><br />تقسیم‌بندی این کتاب به این شکل است: یادداشت مترجم، پیشگفتار، مفاهیم سه‌گانه فرهنگ، طبقه و برگزیدگان، وحدت و گوناگونی:خطه، وحدت و گوناگونی: فرقه و کیش، یادداشتی درباره سیاست و فرهنگ، یادداشت‌هایی در زمینه آموزش و فرهنگ: و نتیجه و در نهایت پیوست: وحدت فرهنگ اروپایی.<br /><br />تی. اس. الیوت در این کتاب تلاش می‌کند برای مفهوم ""فرهنگ"" تعریفی بیابد. او خود در پیشگفتار این کتاب می‌نویسد:""هدف من از نوشتن فصل‌های آینده، که ممکن است با مطالعه‌ی سطحی فهرست مطالب متوجه شده باشید، طرح یک فلسفه اجتماعی یا سیاسی نیست؛ و این کتاب قصد ندارد صرفا در حکم بهانه‌ای برای اظهار عقاید من درباره مجموعه متنوعی از موضوع‌ها باشد. قصد من یاری دادن به تعریف یک کلمه است، کلمه‌ی فرهنگ.""<br /><br />نویسنده در فصل ""مفاهیم سه گانه فرهنگ"" درباره این مفهوم می‌نویسد: اصطلاح فرهنگ، بر حسب اینکه پیشرفت فردی یا گروهی یا طبقاتی یا کل جامعه منظور باشد، تداعی‌های مختلفی به ذهن متبادر می‌کند. و این قسمتی از نهاده‌ی (thesis) من است که فرهنگ فردی وابسته به یک گروه یا طبقه، و فرهنگ گروهی یا طبقاتی وابسته به فرهنگ کل جامعه‌ای است که این گروه یا طبقه به آ« تعلق دارد. لذا، این فرهنگ جامعه است که کیفیتی بنیادی دارد، و مفهوم فرهنگ در ارتباط با کل جامعه است که باید در ابتدا مورد سنجش قرار گیرد<br /><br />حمید شاهرخ، مترجم اثر درباره این کتاب و نویسنده آن نوشته است: تی. اس. الیوت، بلندآوازه‌ترین شاعر معاصر انگلیسی، در این رساله قصد تبیین مفهوم ""فرهنگ"" در کاربرد درست آن، و زدودن ابهام‌ها در تعریف این مفهوم را دارد. طرح این رساله در اواخر جنگ جهانی دوم شکل گرفت و بخش‌هایی از آن در نشریات انگلستان چاپ شد. سپس در 1948 به صورت کتاب، زیر عنوان ""یادداشت‌هایی جهت تحدید مفهوم فرهنگ"" درآمد. سال‌ها بعد، در 1961، هنگامی آوری متوجه شدم نه چیزی هست که بخواهمش پس بگیرم و نه چیزی هست که بخواهمش گسترش دهم"
1570659,18540,آناباز,,,TR,https://s.gr-assets.com/assets/nophoto/book/111x148-bcc042a9c91a29c1d680899eff700a03.png,https://s.gr-assets.com/assets/nophoto/book/50x75-a91bf249278a81aabab721ef782c4a74.png,2002,,,per,هرمس,false,1345392,23,881,896,229,30,5:80|4:78|3:51|2:11|1:9|total:229,1924,,,3.91,9,4,['275175'],['Saint-John Perse'],['3.87'],['658209'],['محمدعلی سپانلو'],['3.40'],
26868438,18540,منشی رازدار,,9786001198052,TR,https://i.gr-assets.com/images/S/compressed.photo.goodreads.com/books/1444037292l/26868438._SX98_.jpg,https://i.gr-assets.com/images/S/compressed.photo.goodreads.com/books/1444037292l/26868438._SY75_.jpg,2015,,,per,نشر قطره,false,1874358,15,287,453,133,18,5:17|4:41|3:56|2:17|1:2|total:133,1950,,,3.41,2,1,['18540'],['T.S. Eliot'],['4.16'],['14436889'],['معصومه بوذری'],['2.50'],تی. اس. الیوت با نگارش نمایش نامه منشی رازدار بار دیگر به «جوهره ی زندگی» می‌اندیشد: اینکه آیا زندگی و سرنوشت همان ذهنیت آدمی است که به خواست فرد شکل می‌گیرد یا از جایی خارج از اختیار وی تحمیل می‌شود؟ این پرسش ها از غامض ترین مباحث فلسفی است که در داستانی ساده و بدون تنش به صورت سهل و ممتنع گنجانده شده است. در این اثر، رویداد خاصی رقم نمی‌خورد، هرچه هست بازنگری اشخاص داستان است نسبت به زندگی، و اعترافات هرکدام از آنها درباره وضعیت خواسته‌های گذشته و آرزوهای آینده‌شان. قلم جادویی الیوت، از خلال ترسیم وضعیت آدمهای معاصر و جامعه مدرن، ما را به اعماق تاریخ اساطیری می‌برد و این‌بار به نمایش نامه ایون، اثر اوریپید. نویسنده از ما می‌خواهد تا با نگاهی شایسته به سفالینه‌ها، در اصل سرشت و ذات طبیعت را به یاد آوریم.
24887944,18540,صخره,9646671179,9789646671171,TR,https://i.gr-assets.com/images/S/compressed.photo.goodreads.com/books/1423484854l/24887944._SX98_.jpg,https://i.gr-assets.com/images/S/compressed.photo.goodreads.com/books/1423484854l/24887944._SY75_.jpg,1999,,,per,انتشارات بهجت,false,41357774,6,119,142,35,8,5:12|4:16|3:4|2:3|1:0|total:35,1934,,,4.06,1,1,['18540'],['T.S. Eliot'],['4.16'],['3071350'],['فریده حسن\u200cزاده'],['3.32'],سال نشر: 1378
6850875,18540,از شکسپیر تا الیوت,,9786005757224,TR,https://i.gr-assets.com/images/S/compressed.photo.goodreads.com/books/1345197211l/6850875._SX98_.jpg,https://i.gr-assets.com/images/S/compressed.photo.goodreads.com/books/1345197211l/6850875._SY75_.jpg,2010,,,per,کتاب آمه,false,7063744,1,102,124,33,4,5:6|4:17|3:7|2:2|1:1|total:33,2003,,,3.76,33,4,"['22583', '77318', '158432', '13453', '64845', '45882', '11978', '2697', '13638502', '67032', '24391', '1438', '101643', '143178', '7440', '38069', '29963', '7715', '16380', '947', '5144', '17623', '30055', '18540', '11154', '10547', '36910', '160070', '233593', '304341', '57189', '64716', '996', '4379', '1972315']","['Ben Jonson', 'John Donne', 'Andrew Marvell', 'William Blake', 'William Wordsworth', 'Percy Bysshe Shelley', 'John Keats', 'Henry Wadsworth Longfellow', 'Alfred Tennyson', 'Elizabeth Barrett Browning', 'Robert Browning', 'Walt Whitman', 'Dante Gabriel Rossetti', 'Christina Rossetti', 'Emily Dickinson', 'A.E. Housman', 'W.B. Yeats', 'Robert Frost', 'Carl Sandburg', 'William Shakespeare', 'James Joyce', 'D.H. Lawrence', 'Ezra Pound', 'T.S. Eliot', 'Archibald MacLeish', 'E.E. Cummings', 'Langston Hughes', 'Stevie Smith', 'W.H. Auden', 'Louis MacNeice', 'Dylan Thomas', 'Philip Larkin', 'Ted Hughes', 'Sylvia Plath', '(محمود مشرف آزاد تهرانی (م. آزاد']","['3.54', '4.14', '3.90', '4.17', '4.00', '4.01', '4.18', '4.01', '4.08', '4.03', '3.98', '4.13', '4.10', '4.03', '4.20', '4.04', '4.16', '4.25', '4.13', '3.87', '3.74', '3.59', '3.94', '4.16', '3.95', '4.24', '4.26', '3.83', '4.17', '4.12', '4.16', '4.07', '4.09', '4.04', '3.61']",['3071583'],['سعید سعیدپور'],['3.57'],استنلی برنشا، شاعر و مترجم آمریکایی معتقد است‌که «تنهاراه تجربۀ شعر در زبانی‌دیگر این است‌که یادبگیریم یک‌شعر را بشنویم و بخوانیم، یعنی بتوانیم آن‌را تلفظ کنیم». به‌پیشنهاد او مترجم از هر زبانی‌که ترجمه می‌کند، باید متن اصلی شعر را بیاورد و کلید تلفّظ شعر را به آن‌زبان به‌دست دهد، چنان‌که خواننده بتواند خصوصیات لفظی و بصری شعر را درک کند، یعنی آن‌بخش از زبان شعر را که در ترجمه ازدست می‌رود، برای خواننده مطرح‌کند (هرچند برنشا به‌جای ترجمۀ شعر معتقد به نوعی‌تفسیر شعری است).<br />هدف‌از دوزبانه‌کردن این‌مجموعه جز این نیست‌که خوانندگان با ویژگی‌های دیداری و شنیداری متن اصلی آشنا شوند. خواننده اگر خود دقت کند، می‌تواند مثلاً قافیه‌های درونی و بیرونی و جناس‌های لفظی و هماوایی مصوّت‌ها را در شعر به‌گوش بشنود و ساخت بصری شعر را به‌چشم ببیند.
49589446,18540,از روی دست رمان نویس,,9789645067425,TR,https://s.gr-assets.com/assets/nophoto/book/111x148-bcc042a9c91a29c1d680899eff700a03.png,https://s.gr-assets.com/assets/nophoto/book/50x75-a91bf249278a81aabab721ef782c4a74.png,,,,,,false,4812076,2,31,31,7,2,5:4|4:2|3:1|2:0|1:0|total:7,1957,,,4.43,0,0,['777708'],['Kay Dick'],['3.80'],['2923990'],['محسن سلیمانی'],['4.04'],"For many years the ""Paris Review"" interviews have been justly famous for giving deeper insight and understanding of the creative process. In this selection from the interviews, 15 writers discuss what they think of their own, and other people's work, their lives and the problems of writing in the contemporary world."
35718383,18540,تی. اس. الیوت و نمایشنامه منظوم و مذهبی,,,TR,https://i.gr-assets.com/images/S/compressed.photo.goodreads.com/books/1500656787l/35718383._SX98_.jpg,https://i.gr-assets.com/images/S/compressed.photo.goodreads.com/books/1500656787l/35718383._SX50_.jpg,1987,,,per,جهاد دانشگاهي,false,57221522,1,5,8,2,0,5:1|4:0|3:1|2:0|1:0|total:2,1987,,,4.00,2,0,"['7857295', '18540']","['فرهاد ناظرزاده کرمانی', 'T.S. Eliot']","['3.32', '4.16']",[],[],[],تي .اس .اليوت و نمايشنامه منظوم و مذهبي ، همراه با ترجمه نمايشنامه جنايت در كليسا<br /><br />مباحث و سرفصل ها<br /> <br />فصل 1 : درباره نمایشنامه منظوم<br />فصل 2 : درباره نمایشنامه مذهبی<br />فصل 3 : درباره تی . اس . الیوت
35073292,18540,ویرانه‌های زمان (مقالاتی درباره‌ی سرزمین هرز),,9789644486692,TR,https://i.gr-assets.com/images/S/compressed.photo.goodreads.com/books/1494060831l/35073292._SX98_.jpg,https://i.gr-assets.com/images/S/compressed.photo.goodreads.com/books/1494060831l/35073292._SY75_.jpg,2016,,,per,نشر نیلوفر,false,56370700,1,13,6,2,0,5:0|4:1|3:0|2:1|1:0|total:2,,,,3.00,2,0,"['58765', '17083', '18540']","['Northrop Frye', 'Hugh Kenner', 'T.S. Eliot']","['4.10', '4.01', '4.16']","['14805597', '5010663', '15317830', '1114091', '14805598', '16822869', '15308361']","['مهدی امیرخانلو', 'هوشنگ رهنما', 'جواد گنجی', 'صالح نجفی', 'نیما پرژام', 'یونس\u200cسادات فخر', 'محسن ملکی']","['3.76', '3.91', '3.33', '3.75', '3.45', '3.00', '3.82']",این شعر بلند را الیوت در سال ۱۹۲۱ سرود و بلافاصله به نمادی از جنبش مدرنیسم در ادبیات تبدیل شد. در این مجموعه ۹ مقاله از منتقدان برجستۀ ادبی، مانند نورتراپ فرای، هیو کنر، جیمز ای. میلر و فرانکو مورتی، گرد آمده است تا اثر الیوت از زوایای گوناگون مورد بررسی قرار گرفته باشد.<br /><br />در ابتدا خواننده با سیر تکوین شعر از سال‌های دانشجویی الیوت در هاروارد تا روزهای اقامتش در بیمارستان روانی لوزان و همکاری الیوت و پاوند در شکل و معنا بخشیدن به شعر آشنا می‌شود، سپس با خوانشی دقیق از شعر و آشنایی با جایگاه آن در سنت ادبیات انگلیسی‌زبان و تأثیر شاعران پیشین بر شعر الیوت همراه خواهد شد، تا در ادامه از موقعیت شعر بر پس‌زمینۀ اجتماعی و اقتصادیِ سال‌های میان دو جنگ جهانی و موقعیت آن در سیر کلی تحول ادبیات در قرن بیستم آگاه شود.<br /><br />در پایان کتاب متن انگلیسی شعر به‌همراه ترجمه‌ای جدید از آن آمده است. گردآوری این مجموعه را مهدی امیرخانلو بر عهده داشته و هوشنگ رهنما، صالح نجفی، جواد گنجی، نیما پرژام، محسن ملکی و یونس سادات‌فخر او را در ترجمۀ مقالات یاری رسانده‌اند.<br /><br /> <br /><br />⚜بخشی از شعر درخشان سرزمین هرز الیوت با ترجمه ای جدید<br /><br />چيستند این ريشه‌ها كه چنگ مي‌اندازند، چه شاخه‌هايي<br /><br />از اين مزبلۀ سنگلاخ مي‌رويند؟ ای پسر انسان،<br /><br />نمي‌تواني گفت، حدس هم نتواني زد، زيرا تو تنها<br /><br />تلی از تصاویر شكسته را مي‌شناسي، آن‌جا كه خورشيد مي‌گدازد،<br /><br />و درخت مرده سايه‌اي نمي‌بخشد، زنجره تسكيني نمي‌دهد،<br /><br />و از سنگ خشك صداي آبي برنمي‌آيد. تنها<br /><br />در زير اين صخرۀ سرخ سايه هست<br /><br />(به زير سايۀ اين صخرۀ سرخ‌ بيا)،<br /><br />و من به تو چیزی نشان خواهم داد<br /><br />جز سايه صبحگاهي‌ات كه در پي‌ات شلنگ برمي‌دارد<br /><br />یا سايه شامگاهی‌ات كه به ديدارت برمي‌خيزد.<br /><br />به تو هراس را در مشتي خاك نشان خواهم داد.<br /><br /> <br /><br />متن کامل این شعر در کتاب ویرانه های زمان چاپ شده است
