id,author_id,title,isbn,isbn13,country_code,image_url,small_image_url,publication_year,publication_month,publication_day,language_code,publisher,is_ebook,work_id,total_editions_count,total_added_by,total_rating_sum,total_rating_count,total_text_reviews_count,rating_dist,original_publication_year,original_publication_month,original_publication_day,average_rating,ratings_count,text_reviews_count,authors_ids,authors_names,authors_average_rating,translators_ids,translators_names,translators_average_rating,description
2590729,4280,هرگز رهایم مکن,9643116271,9789643116279,TR,https://i.gr-assets.com/images/S/compressed.photo.goodreads.com/books/1380908362l/2590729._SX98_.jpg,https://i.gr-assets.com/images/S/compressed.photo.goodreads.com/books/1380908362l/2590729._SX50_.jpg,,,,per,انتشارات ققنوس,false,1499998,225,896809,1690993,442510,30082,5:129619|4:161983|3:104965|2:34128|1:11815|total:442510,2005,4,11,3.82,476,76,"['4280', '5755846']","['Kazuo Ishiguro', 'سهیل سمی']","['3.84', '3.59']",[],[],[],"From the Booker Prize-winning author of <i>The Remains of the Day</i> and <i>When We Were Orphans</i>, comes an unforgettable edge-of-your-seat mystery that is at once heartbreakingly tender and morally courageous about what it means to be human.<br /><br />Hailsham seems like a pleasant English boarding school, far from the influences of the city. Its students are well tended and supported, trained in art and literature, and become just the sort of people the world wants them to be. But, curiously, they are taught nothing of the outside world and are allowed little contact with it.<br /><br />Within the grounds of Hailsham, Kathy grows from schoolgirl to young woman, but it’s only when she and her friends Ruth and Tommy leave the safe grounds of the school (as they always knew they would) that they realize the full truth of what Hailsham is.<br /><br /><i>Never Let Me Go</i> breaks through the boundaries of the literary novel. It is a gripping mystery, a beautiful love story, and also a scathing critique of human arrogance and a moral examination of how we treat the vulnerable and different in our society. In exploring the themes of memory and the impact of the past, Ishiguro takes on the idea of a possible future to create his most moving and powerful book to date."
9202239,4280,هرگز ترکم مکن,,9789643692421,TR,https://s.gr-assets.com/assets/nophoto/book/111x148-bcc042a9c91a29c1d680899eff700a03.png,https://s.gr-assets.com/assets/nophoto/book/50x75-a91bf249278a81aabab721ef782c4a74.png,2010,,,per,نشر افق,false,1499998,225,896809,1690993,442510,30082,5:129619|4:161983|3:104965|2:34128|1:11815|total:442510,2005,4,11,3.82,219,39,['4280'],['Kazuo Ishiguro'],['3.84'],['18128397'],['مهدی غبرایی'],['3.91'],رمان تکان‌دهنده‌ای است آکنده از احساس شکنندگی انسان معاصر، خاطرات به یادماندنی شخصیت‌هایی که رفته رفته به حقیقت دوران کودکی به ظاهر شاد و نیز آینده‌ی خود پی می‌برند. آن‌ها پس از سال‌ها در می‌یابند که چرا موسسه‌ی «هیلشم» آنان را از کودکی پناه داده است؛<br />حالا که در در و دشت رانندگی می‌کنم، هنوز چیزهایی را می‌بینم که مرا یاد هیلشم می‌اندازد. شاید از کنج مزرعه‌ای مه‌آلود بگذرم با قسمتی از خانه‌ی بزرگی را هم چنان که از دامنه ی تپه‌ای پایین می‌آیم، یا حتی دسته‌ای سپیدار را با ترتیب خاصی در کمرشکن تپه‌ای ببینم و با خود بگویم: «شاید همین باشد! پیدایش کردم!»؛
8572691,4280,هرگز ترکم مکن,,,TR,https://s.gr-assets.com/assets/nophoto/book/111x148-bcc042a9c91a29c1d680899eff700a03.png,https://s.gr-assets.com/assets/nophoto/book/50x75-a91bf249278a81aabab721ef782c4a74.png,2009,,,per,نشر افق,false,1499998,225,896809,1690993,442510,30082,5:129619|4:161983|3:104965|2:34128|1:11815|total:442510,2005,4,11,3.82,12,2,"['4280', '18128397']","['Kazuo Ishiguro', 'مهدی غبرایی']","['3.84', '3.91']",[],[],[],"From the Booker Prize-winning author of <i>The Remains of the Day</i> and <i>When We Were Orphans</i>, comes an unforgettable edge-of-your-seat mystery that is at once heartbreakingly tender and morally courageous about what it means to be human.<br /><br />Hailsham seems like a pleasant English boarding school, far from the influences of the city. Its students are well tended and supported, trained in art and literature, and become just the sort of people the world wants them to be. But, curiously, they are taught nothing of the outside world and are allowed little contact with it.<br /><br />Within the grounds of Hailsham, Kathy grows from schoolgirl to young woman, but it’s only when she and her friends Ruth and Tommy leave the safe grounds of the school (as they always knew they would) that they realize the full truth of what Hailsham is.<br /><br /><i>Never Let Me Go</i> breaks through the boundaries of the literary novel. It is a gripping mystery, a beautiful love story, and also a scathing critique of human arrogance and a moral examination of how we treat the vulnerable and different in our society. In exploring the themes of memory and the impact of the past, Ishiguro takes on the idea of a possible future to create his most moving and powerful book to date."
17240181,4280,هرگز تركم مكن,,,TR,https://i.gr-assets.com/images/S/compressed.photo.goodreads.com/books/1358163743l/17240181._SX98_.jpg,https://i.gr-assets.com/images/S/compressed.photo.goodreads.com/books/1358163743l/17240181._SX50_.jpg,2009,,,per,نشر افق,false,1499998,225,896809,1690993,442510,30082,5:129619|4:161983|3:104965|2:34128|1:11815|total:442510,2005,4,11,3.82,9,4,"['4280', '18128397']","['Kazuo Ishiguro', 'مهدی غبرایی']","['3.84', '3.91']",[],[],[],رمان تكان‌دهنده‌اي است آكنده از احساس شكنندگي انسان معاصر، خاطرات به يادماندني شخصيت‌هايي كه رفته‌رفته به حقيقت دوران كودكي به ظاهر شاد و نيز آينده‌ي خود پي مي‌برند. آن‌ها پس از سال‌ها در مي‌يابند كه چرا موسسه «هيلشم» آنان را از كودكي پناه داده است. <br />حالا كه در در و دشت رانندگي مي‌كنم، هنوز چيزهايي را مي‌بينم كه مرا ياد هيلشم مي‌اندازد. شايد از كنج مزرعه‌اي مه‌آلود بگذرم با قسمتي از خانه‌ي بزرگي را هم‌چنان كه از دامنه‌ي تپه‌اي پايين مي‌آيم، يا حتي دسته‌اي سپيدار را با ترتيب خاصي در كمرشكن تپه‌اي ببينم و با خود بگويم: «شايد همين باشد! پيدايش كردم!
36661437,4280,هرگز رهایم مکن,,,TR,https://s.gr-assets.com/assets/nophoto/book/111x148-bcc042a9c91a29c1d680899eff700a03.png,https://s.gr-assets.com/assets/nophoto/book/50x75-a91bf249278a81aabab721ef782c4a74.png,1385,,,per,ققنوس,false,1499998,225,896809,1690993,442510,30082,5:129619|4:161983|3:104965|2:34128|1:11815|total:442510,2005,4,11,3.82,9,4,['4280'],['Kazuo Ishiguro'],['3.84'],['5755846'],['سهیل سمی'],['3.59'],کتی، پرستار سی و یک ساله، مسئولیت مراقبت از بیمارانی را دارد که می‌خواهند اعضای بدنشان را اهدا کنند. بیش از یک دهه است که کتی در این شغل تجربه کسب کرده و حالا به درجه‌ای از اعتبار رسیده که می‌تواند بیمارانش را خودش انتخاب کند. اما چرا میان آن همه بیمار روت را ترجیح می‌دهد؟ این‌جاست که نویسنده دست به مرور خاطرات کتی می‌زند و خواننده را با دانش‌آموزانی آشنا می‌کند که در مدرسه‌ای خاص تربیت شده‌‌اند: مدرسه‌ای شبانه روزی مخصوص کودکانی که باید طوری آموزش ببینند تا بتوانند سرنوشتی محتوم را بپذیرند، سرنوشتی که از پیش برایش انتخاب شده‌اند...<br />این کتاب از پرفروش‌ترین آثار ایشی گورو در جهان است اما نه به خاطر عاشقانه‌هایی که در آن اتفاق می‌افتد، بلکه به دلیل تلاشی که قهرمانانش در آن پیش می‌گیرند تا با وجود جبر دردناکی که بر سرنوشتشان سایه انداخته، بتوانند طعم زندگی را مزه مزه کنند.
36290511,4280,هرگز رهایم مکن,,9786008008132,TR,https://i.gr-assets.com/images/S/compressed.photo.goodreads.com/books/1506176122l/36290511._SX98_.jpg,https://i.gr-assets.com/images/S/compressed.photo.goodreads.com/books/1506176122l/36290511._SY75_.jpg,2015,,,per,نوید ظهور,false,1499998,225,896809,1690993,442510,30082,5:129619|4:161983|3:104965|2:34128|1:11815|total:442510,2005,4,11,3.82,4,2,['4280'],['Kazuo Ishiguro'],['3.84'],['17177355'],['فاطمه امینی'],['2.80'],کتی اچ سی و یک ساله داستان زندگیش را برای ما روایت می کند. کتی، تامی و روت دانش آموزان مدرسه ی شبانه روزی نامعمولی به نام هیلشم هستند. در هیلشم دانش آموزان فقط به یادگیری و آفرینش هنر هایی مثل نقاشی، سفال گری و کاردستی می پردازند و بر سلامتی بچه ها نظارت شدیدی اعمال می شود. همچنان که کتی داستان بزرگ شدن خودش و دوستانش، عشق ناگفته‌اش به تامی و دوستی پر فراز و نشیبش با روت را پیش می برد، ما هم به آهستگی پی به حقیقت وجود این بچه ها می بریم.
40191203,4280,کتاب صوتی هرگز رهایم مکن,,,TR,https://i.gr-assets.com/images/S/compressed.photo.goodreads.com/books/1526969031l/40191203._SX98_.jpg,https://i.gr-assets.com/images/S/compressed.photo.goodreads.com/books/1526969031l/40191203._SX50_.jpg,2016,4,8,per,آوانامه,false,1499998,225,896809,1690993,442510,30082,5:129619|4:161983|3:104965|2:34128|1:11815|total:442510,2005,4,11,3.82,1,1,"['4280', '15818351', '5755846', '17776952']","['Kazuo Ishiguro', 'دامون آذری', 'سهیل سمی', 'مریم پاک ذات']","['3.84', '4.06', '3.59', '4.56']",[],[],[],"""هرگز رهایم مکن"" رمانی نوشته کازوئو ایشی گورو نویسنده ژاپنی _ بریتانیایی برنده جایزه نوبل ادبیات است، که در سال ۲۰۰۵ منتشر شد. این رمان در همان سال نامزد جایزه بوکر و در سال ۲۰۰۶ نامزد جایزه آرتور سی کلارک شد. مجله تایم نیز آن را به عنوان بهترین رمان سال ۲۰۰۵ برگزید و آن را در لیست ۱۰۰ رمان برتر انگلیسی زبان، از سال ۱۹۲۳ تا ۲۰۰۵ قرار داد. بخشی از کتاب: حالا که با ماشین در اطراف کشور پرسه می زنم، چیزهایی می‌بینم که مرا به یاد هیلشم می‌اندازد. گاه از گوشه مزرعه‌ای مه‌آلود می‌گذرم یا حین پایین آمدن از کنار دره‌ای، از دور، بخشی از خانه‌ای بزرگ و گاه حتی درختان سپیدار دامنه تپه را با نظم و آرایشی خاص می‌بینم، و با خود می‌گویم:«شاید خودش باشه! پیداش کردم!این واقعا هیلشمه!» بعد متوجه می‌شوم که محال است، و افکارم گرد جایی دیگر می‌چرخد و به رانندگی ادامه می‌دهم.<br /><br />این کتاب صوتی را می توانید از سایت های آوانامه و آدیولیب دریافت کنید:<br />AvaNameh.com<br />AudioLib.ir<br /><br /><br />."
139514,4280,بازمانده روز,,9789644310621,TR,https://i.gr-assets.com/images/S/compressed.photo.goodreads.com/books/1370154622l/139514._SX98_.jpg,https://i.gr-assets.com/images/S/compressed.photo.goodreads.com/books/1370154622l/139514._SX50_.jpg,2006,,,per,کارنامه,false,3333111,260,390470,777388,188612,13186,5:75784|4:71837|3:31391|2:7347|1:2253|total:188612,1989,,,4.12,867,185,['4280'],['Kazuo Ishiguro'],['3.84'],['851957'],['نجف دریابندری'],['3.75'],در سال ۱۹۵۶، استیونز، پیش‌خدمت پیر عمارت دارلینگتن، سفری را با ماشین به سمت غرب انگلستان آغاز کرده که به سفری درون گذشته‌اش منتهی می‌شود...
4922862,4280,بازمانده روز,,,TR,https://s.gr-assets.com/assets/nophoto/book/111x148-bcc042a9c91a29c1d680899eff700a03.png,https://s.gr-assets.com/assets/nophoto/book/50x75-a91bf249278a81aabab721ef782c4a74.png,2006,,,per,,false,3333111,260,390470,777388,188612,13186,5:75784|4:71837|3:31391|2:7347|1:2253|total:188612,1989,,,4.12,167,27,['4280'],['Kazuo Ishiguro'],['3.84'],['851957'],['نجف دریابندری'],['3.75'],داستان مردی به نام استیونز که بیش از سی سال در خانه یکی از اشراف انگلستان به نام لرد دارلینگتن پیش خدمت بوده است و اکنون که بساط آن خانه برچیده شده است دارد خاطراتش را به صورت یادداشت‌هایی که از یک سفر شش روزه به صفحات غرب انگستان باز مانده است روایت می‌کند.
24413395,4280,بازمانده روز,,,TR,https://i.gr-assets.com/images/S/compressed.photo.goodreads.com/books/1420876502l/24413395._SX98_.jpg,https://i.gr-assets.com/images/S/compressed.photo.goodreads.com/books/1420876502l/24413395._SX50_.jpg,1996,,,per,نشر کارنامه,false,3333111,260,390470,777388,188612,13186,5:75784|4:71837|3:31391|2:7347|1:2253|total:188612,1989,,,4.12,5,0,['4280'],['Kazuo Ishiguro'],['3.84'],['851957'],['نجف دریابندری'],['3.75'],"In the summer of 1956, Stevens, a long-serving butler at Darlington Hall, decides to take a motoring trip through the West Country. The six-day excursion becomes a journey into the past of Stevens and England, a past that takes in fascism, two world wars, and an unrealised love between the butler and his housekeeper."
2590839,4280,وقتی یتیم بودیم,9643630978,9789643630973,TR,https://i.gr-assets.com/images/S/compressed.photo.goodreads.com/books/1473062632l/2590839._SY160_.jpg,https://i.gr-assets.com/images/S/compressed.photo.goodreads.com/books/1473062632l/2590839._SY75_.jpg,2000,,,per,انتشارات هرمس,false,3333606,111,51850,90205,25828,2482,5:3651|4:9417|3:9373|2:2776|1:611|total:25828,2000,,,3.49,157,22,['4280'],['Kazuo Ishiguro'],['3.84'],['1524528'],['مژده دقیقی'],['3.64'],"When 9-year-old Christopher Banks's father--a British businessman involved in the opium trade--disappears from the family home in Shanghai, the boy and his friend Akira play at being detectives: ""Until in the end, after the chases, fist-fights and gun-battles around the warren-like alleys of the Chinese districts, whatever our variations and elaborations, our narratives would always conclude with a magnificent ceremony held in Jessfield Park, a ceremony that would see us, one after another, step out onto a specially erected stage ... to greet the vast cheering crowds.""<p> But Christopher's mother also disappears, and he is sent to live in England, where he grows up in the years between the world wars to become, he claims, a famous detective. His family's fate continues to haunt him, however, and he sifts through his memories to try to make sense of his loss. Finally, in the late 1930s, he returns to Shanghai to solve the most important case of his life. But as Christopher pursues his investigation, the boundaries between fact and fantasy begin to evaporate. Is the Japanese soldier he meets really Akira? Are his parents really being held in a house in the Chinese district? And who is Mr. Grayson, the British official who seems to be planning an important celebration? ""My first question, sir, before anything else, is if you're happy with the choice of Jessfield Park for the ceremony? We will, you see, require substantial space.""</p><p> In <i>When We Were Orphans</i> Kazuo Ishiguro uses the conventions of crime fiction to create a moving portrait of a troubled mind, and of a man who cannot escape the long shadows cast by childhood trauma. Sherlock Holmes needed only fragments--a muddy shoe, cigarette ash on a sleeve--to make his deductions, but all Christopher has are fading recollections of long-ago events, and for him the truth is much harder to grasp. Ishiguro writes in the first person, but from the beginning there are cracks in Christopher's carefully restrained prose, suggestions that his version of the world may not be the most reliable. Faced with such a narrator, the reader is forced to become a detective too, chasing crumbs of truth through the labyrinth of Christopher's memory. </p><p> Ishiguro has never been one for verbal pyrotechnics, but the unruffled surface of this haunting novel only adds to its emotional power. <i>When We Were Orphans</i> is an extraordinary feat of sustained, perfectly controlled imagination, and in Christopher Banks the author has created one of his most memorable characters. <i>--Simon Leake</i></p>"
16028792,4280,هنرمندی از جهان شناور,9642436750,9789642436750,TR,https://i.gr-assets.com/images/S/compressed.photo.goodreads.com/books/1347808078l/16028792._SX98_.jpg,https://i.gr-assets.com/images/S/compressed.photo.goodreads.com/books/1347808078l/16028792._SX50_.jpg,2012,,,per,انتشارات افراز,false,2464610,102,48801,80259,21366,1857,5:4226|4:9359|3:6337|2:1238|1:206|total:21366,1986,,,3.76,62,13,['4280'],['Kazuo Ishiguro'],['3.84'],['6432436'],['یاسین محمدی'],['3.55'],"In the face of the misery in his homeland, the artist Masuji Ono was unwilling to devote his art solely to the celebration of physical beauty. Instead, he put his work in the service of the imperialist movement that led Japan into World War II. <br /><br />Now, as the mature Ono struggles through the aftermath of that war, his memories of his youth and of the “floating world”—the nocturnal world of pleasure, entertainment, and drink—offer him both escape and redemption, even as they punish him for betraying his early promise. Indicted by society for its defeat and reviled for his past aesthetics, he relives the passage through his personal history that makes him both a hero and a coward but, above all, a human being."
11476122,4280,منظرِ پریده‌رنگِ تپه‌ها,9646900158,9789646900158,TR,https://i.gr-assets.com/images/S/compressed.photo.goodreads.com/books/1313083447l/11476122._SX98_.jpg,https://i.gr-assets.com/images/S/compressed.photo.goodreads.com/books/1313083447l/11476122._SX50_.jpg,,,,per,انتشارات نیلا,false,1676317,93,36507,68419,18266,1768,5:3698|4:7846|3:5332|2:1159|1:231|total:18266,,,,3.75,82,17,['4280'],['Kazuo Ishiguro'],['3.84'],['4077271'],['امیر امجد'],['3.48'],"In his highly acclaimed debut, <i>A Pale View of Hills</i>, Kazuo Ishiguro tells the story of Etsuko, a Japanese woman now living alone in England, dwelling on the recent suicide of her daughter. Retreating into the past, she finds herself reliving one particular hot summer in Nagasaki, when she and her friends struggled to rebuild their lives after the war. But then as she recalls her strange friendship with Sachiko - a wealthy woman reduced to vagrancy - the memories take on a disturbing cast."
23385147,4280,منظر پریده‌رنگ تپّه‌ها,,,TR,https://i.gr-assets.com/images/S/compressed.photo.goodreads.com/books/1413511748l/23385147._SX98_.jpg,https://i.gr-assets.com/images/S/compressed.photo.goodreads.com/books/1413511748l/23385147._SX50_.jpg,2001,,,per,نیلا,false,1676317,93,36507,68419,18266,1768,5:3698|4:7846|3:5332|2:1159|1:231|total:18266,,,,3.75,82,14,['4280'],['Kazuo Ishiguro'],['3.84'],['4077271'],['امیر امجد'],['3.48'],رمان «منظر پریده‌رنگ تپه‌ها» به ظاهر ماجرایی خانوادگی است که در آن زنی ژاپنی ـ مقیم انگلیس؛ خاطراتش را از دوران جوانی باز می‌گوید و طی آن روایتی از تقابل سنت و تجدد در جامعه‌ای در مرحله گذار را ارایه می‌دهد.
6328001,4280,منظرِ پریده‌رنگِ تپه‌ها,9646900151,,TR,https://i.gr-assets.com/images/S/compressed.photo.goodreads.com/books/1306535716l/6328001._SX98_.jpg,https://i.gr-assets.com/images/S/compressed.photo.goodreads.com/books/1306535716l/6328001._SX50_.jpg,2001,,,per,نیلا,false,1676317,93,36507,68419,18266,1768,5:3698|4:7846|3:5332|2:1159|1:231|total:18266,,,,3.75,20,3,"['4280', '4077271']","['Kazuo Ishiguro', 'امیر امجد']","['3.84', '3.48']",[],[],[],"In his highly acclaimed debut, <i>A Pale View of Hills</i>, Kazuo Ishiguro tells the story of Etsuko, a Japanese woman now living alone in England, dwelling on the recent suicide of her daughter. Retreating into the past, she finds herself reliving one particular hot summer in Nagasaki, when she and her friends struggled to rebuild their lives after the war. But then as she recalls her strange friendship with Sachiko - a wealthy woman reduced to vagrancy - the memories take on a disturbing cast."
11394094,4280,شبانه‌ها,,9786005733068,TR,https://i.gr-assets.com/images/S/compressed.photo.goodreads.com/books/1525540710l/11394094._SX98_.jpg,https://i.gr-assets.com/images/S/compressed.photo.goodreads.com/books/1525540710l/11394094._SX50_.jpg,2010,,,per,کتاب پارسه,false,4836931,100,33276,59829,17289,1859,5:2281|4:5997|3:6736|2:1953|1:322|total:17289,2009,5,5,3.46,87,19,['4280'],['Kazuo Ishiguro'],['3.84'],['877895'],['خجسته کیهان'],['3.59'],داستان‌ها و رمان‌های جدید ژاپنی چند سالی است که در ایران به کتاب‌هایی پرطرفدار و پرتیراژ تبدیل شده اند. نگاه نویسندگان نسل جدید ژاپن همپای سایر هنرمندان این کشور نگاهی مدرن و متفاوت است. ساختارها و شخصیت‌هایی که در دل داستان‌های ژاپنی قابل مشاهده است برای مخاطبان کتاب در سراسر دنیا از جمله ایران بکر و نوآورانه بوده است.<br />یکی از نویسندگان خوشنام این کشور کازوئو ایشی گورو است. او متولد ۱۹۵۴ در ناکازاکی است اما ساکن انگلستان است و به زبان انگلیسی می‌نویسد. ایشی گورو در سال ۱۹۸۶ برای کتاب “هنرمندی در دنیای شناور” برنده جایزه وایت‌برد و در سال ۱۹۸۹ به خاطر کتاب “بازمانده روز” برنده جایزه بوکر شد.<br />از این نویسنده ژاپنی تاکنون چند کتاب به فارسی برگردانده شده که مجموعه حاضر دربرگیرنده پنج داستان درباره موسیقی و شب است. ایشی گورو درونمایه این داستان‌هایش را آگاهانه انتخاب کرده و پیش از نوشتن می‌خواسته درباره همین دو موضوع بنویسد؛ موسیقی و شب. این نویسنده خودش فعالیت موسیقی انجام می‌دهد و برای همین می توانید در این کتاب با دنیای موسیقی و اصطلاحات مربوط به آن آشنا نیز شوید.<br />پنج داستان این مجموعه عمدتا در شب اتفاق می‌افتد و به ترتیبی با موسیقی و خوانندگی در ارتباط است. او تعلقات خود را به موسیقی با ساختن شخصیت‌هایی که دلبسته ساز و ترانه و آواز هستند به خوبی نشان داده است. شاید از این جهت بتوان گفت دوستداران موسیقی علاقه دوچندانی به این کتاب نشان خواهند داد. او در این داستان ها نیز چون سایر آثارش به گذشته و خاطرات توجه نشان داده است. او در این‌باره می‌گوید: ” وظیفه من و هم‌نسلانم زنده نگاه داشتن خاطرات است؛ نسلی که اگرچه در جنگ شرکت نکرده اما زیر سایه آن بزرگ شده است. حال بیش از هر زمان دیگری خطر فراموشی این خاطرات در کمین نشسته است. می‌هراسم از این که خاطرات جمعی افرادی که از نعمت زیستن در گوشه آسوده‌ای از تاریخ برخوردارند به فراموشی سپرده شود؛ گوشه آسوده‌ای که از جنگ و خونریزی در امان است.”
