id,author_id,title,isbn,isbn13,country_code,image_url,small_image_url,publication_year,publication_month,publication_day,language_code,publisher,is_ebook,work_id,total_editions_count,total_added_by,total_rating_sum,total_rating_count,total_text_reviews_count,rating_dist,original_publication_year,original_publication_month,original_publication_day,average_rating,ratings_count,text_reviews_count,authors_ids,authors_names,authors_average_rating,translators_ids,translators_names,translators_average_rating,description
51409841,6410,زنی که با من در یک خانه زندگی می‌کرد: مجموعه داستان برگزیدگان جایزه اُ. هنری ۲۰۱۲,,9789643378387,TR,https://i.gr-assets.com/images/S/compressed.photo.goodreads.com/books/1581966119l/51409841._SX98_.jpg,https://i.gr-assets.com/images/S/compressed.photo.goodreads.com/books/1581966119l/51409841._SX50_.jpg,2016,,,per,نیستان,false,17617882,5,596,1020,269,40,5:56|4:123|3:72|2:14|1:4|total:269,2012,4,17,3.79,0,0,['8992'],['Laura Furman'],['3.89'],['20018507'],['زهرا سلیمی'],['0.0'],مجموعه داستان «زنی که با من در یک خانه زندگی می‌کرد» عنوان گزیده داستان‌های برگزیده جایزه ادبی اُ. هنری در سال ۲۰۱۲ است که با سرپرستی علی فامیان و با ترجمه زهرا سلیمی منتشر شده است. داستان‌هایی که فلسفه بودنشان در ذیل برگزیدگان و کتاب منتخب این جایزه به دلیل نگاه انسانی و متفاوت آنها به زیست انسانی در زمین و نیز خلق نگاهی تازه و بدیع به انسانیت بوده است.<br /><br />مجموعه حاضر که متعلق به داستان‌های منتخب این جایزه در سال‌ ۲۰۱۲ است، از نقطه نظر نویسندگان انگلیسی زبان در جامعه فرا مدرن معاصر به زیست انسانی و نیز نوع زاویه دید آنها به زندگی و روابط خانوادگی قابل اعتناست و به نظر می‌رسد این موضوع در انتخاب آنها به عنوان اثر داستانی برگزیده خالی از تأثیر نبوده است.<br /><br />در مجموعه داستان «زنی که با من در یک خانه زندگی می‌کرد» مخاطب با ۱۲ داستان کوتاه همراه می‌شود که هر یک به نوعی تشریح‌کننده این موقعیت به شمار می‌روند. در داستان نخست از مجموعه با عنوان «زنی که با من در یک خانه زندگی می‌کرد» نویسنده تلاشی تحسین‌برانگیز برای نمایش شیوه‌های زیستن و همزیستی را به نمایش می‌کشد. در این اثر با مجموعه‌ای از افراد روبروییم که به نوعی با یکدیگر دارای پیوند انسانی بوده و از این نقطه نظر هر یک در مواجهه با دیگری ناچار از اخذ رفتاری متفات هستند که بتواند زندگی در کنار هم را تجربه کنند.<br /><br />در داستان دوم با عنوان «ژرفا» روایتی است جذاب از تلاش یک کودک برای درک معنای زندگی در حالی که او با بیماری‌ای مواجه است که زندگی را برای وی بسیار محدود کرده است. او در این وقت اندک فرصت دارد تا رابطه خود را با تمامی نهاده‌های جهان پیرامونی خود تنظیم و زندگی را با توجه به موقعیتش برای خود تعریف کند.<br /><br />در داستان «تولدی میان جنگل» مخاطب با فضایی مواجه می‌َشود که طی آن پدر و مادر سعی دارند باور و تصور زیستی خود را بر کودکشان تحمیل کرده و او را از فضای عادی و معمول زندگی اجتماعی خود جدا و بر پایه تصورات خود به زندگی وادارند.<br /><br />حشام متر نویسنده انگلیسی‌زبان لیبیایی‌الاصل که سال‌هاست در نیویورک زندگی می‌کند نیز در این مجموعه داستانی با عنوان «نعیمه» منتشر کرده است که در آن شرح تلاش‌های یک کودک برای درک ساختار زیستی تعریف شده میان وی و پدر و مادرش است.<br /><br />از مارک اسلوکا نویسنده‌ای که در سال ۲۰۱۱ و ۲۰۱۲ در فهرست آثار برگزیده جایزه اُ. هنری قرار داشت، داستانی با عنوان «صورتک‌ خرگوش» برگزیده شده که روایت‌کننده تلاش یک پسربچه برای کشف ساختار فکری و همذات‌پنداری با پدرش است و در ادامه تلاش او برای پذیرش برخی از مسئولیت‌های پدر و نیز آرزو برای قرار گرفتن در موقعیت او به منظور رفع و رجوع کارها را روایت می‌کند که در قاموس داستان تلاشی است قابل احترام.<br /><br />داستان‌های دیگر این مجموعه نیز هر یک راوی نوعی نگاه تازه و بدیع به زندگی انسانی و انسانیت به عنوان صفتی محوری برای زندگی انسانی است؛ نگاهی که هر زاویه از آن یادآوری نوعی نگاه بدیع و تازه و تحسین‌برانگیز به مسئله حیات جسمی و روحی انسانی است که این روزها کیمیایی کمیاب به شمار می‌رود.
34260068,6410,زیر درخت سیب,,9789648329926,TR,https://i.gr-assets.com/images/S/compressed.photo.goodreads.com/books/1486981675l/34260068._SX98_.jpg,https://i.gr-assets.com/images/S/compressed.photo.goodreads.com/books/1486981675l/34260068._SX50_.jpg,2017,,,per,چلچله,false,42295919,3,557,721,178,17,5:66|4:69|3:31|2:10|1:2|total:178,2011,,,4.05,4,0,['6410'],['Alice Munro'],['3.92'],['16436692'],['مصطفی شایان'],['3.50'],روزها می‌گذشت و من همچنان منتظر بودم، تا این که یک روز به زن‌هایی فکر کردم که این‌گونه فکرشان و زندگی‌شان را نابود کرده بودند. زن‌هایی که ماه‌ها و سال‌ها چشم به راه نامه‌ای مانده بودند، اما سرانجام هیچ‌کس برایشان نامه‌ای نفرستاده بود. خودم را تصور کردم که سال‌های زیادی گذشته است، موهایم دیگر سفید شده‌اند و من هم‌چنان منتظرم. سپس فکر کردم که نباید این کار را انجام دهم، بنابراین از آن روز به بعد نرفتم که آنجا بنشینم و انتظار بکشم؛
35058487,6410,پناهگاه,,,TR,https://i.gr-assets.com/images/S/compressed.photo.goodreads.com/books/1493842625l/35058487._SX98_.jpg,https://i.gr-assets.com/images/S/compressed.photo.goodreads.com/books/1493842625l/35058487._SX50_.jpg,2015,,,per,,false,56349132,1,98,173,72,10,5:3|4:5|3:27|2:20|1:17|total:72,,,,2.40,72,10,['6410'],['Alice Munro'],['3.92'],[],[],[],کتاب صوتی «پناهگاه»، نوشته آلیس مونرو ( -1931) و داستانی کوتاه از مجموعه داستان‌های کتاب «زندگی عزیز» است.<br />آلیس مونرو نویسنده کانادایی و برنده جایزه نوبل ادبیات سال 2013 است. او جوایز متعددی را برنده شده و به نوشتن داستان‌های کوتاه شهرت دارد. مونرو غالباً در داستان‌هایش به زندگی زنان و مشکلات آن‌ها در خانواده و جامعه می‌پردازد.<br />داستان کوتاه «پناهگاه» از زبان یک دختر نوجوان روایت می‌شود، دختری که به واسطه سفر پدر و مادرش به کشور غنا نزد خاله و شوهرخاله‌اش زندگی می‌کند. اما برخلاف داستان‌های مشابه خودش ماجرای مشکلات این شخصیت مربوط نمی‌شود، چنانکه می‌شنویم زندگی مرفه و آسوده‌ای را تجربه می‌کند. درعوض این ماجرا بستری می‌شود تا مونرو از ویژگی کنجکاوی مختص این دوره از زندگی بهره ببرد و بذر سؤالاتی مهم را در ذهن شنونده بکارد.<br />کنجکاوی و توجه شخصیت اصلی داستان به زندگی خاله و شوهرخاله‌اش و تفاوت آن‌ها با چیزهایی که از پدر و مادر خود آموخته معطوف است و مدام نگرش‌های متفاوت به زندگی را با یکدیگر قیاس می‌کند و به دنبال یافتن راه بهتر زیستن است.<br />این پرسش و پاسخ‌ها شنونده را با خود همراه می‌کند و ما را وا می‌دارد تا به آن‌ها بیندیشیم و خود نیز به دنبال یافتن پاسخ برای آن‌ها باشیم.<br />در بخشی از کتالب می‌شنویم:<br />«مهم‌ترین وظیفه زن ساختن جای امن برای همسرش است»
20813762,6410,پاییز داغ و هشت داستان دیگر,,,TR,https://i.gr-assets.com/images/S/compressed.photo.goodreads.com/books/1392475961l/20813762._SX98_.jpg,https://i.gr-assets.com/images/S/compressed.photo.goodreads.com/books/1392475961l/20813762._SY75_.jpg,2013,,,per,کوله پشتی,false,21484529,2,62,68,20,4,5:2|4:6|3:11|2:0|1:1|total:20,2010,1,1,3.40,6,1,"['6410', '7728', '3190', '48535', '1240', '6451182']","['Alice Munro', 'Doris Lessing', 'F. Scott Fitzgerald', 'Anatole France', 'Jack London', 'شیرین احدزاده']","['3.92', '3.65', '3.90', '3.90', '3.96', '3.30']",[],[],[],پاییز داغ یک مجموعه داستان کوتاه است، عناوین داستان‌ها و نویسندگان آنها به ترتیب زیر هستند: «پاییز داغ، از: آلیس مونرو»؛ «نگاه خیره، تونل، و مزاحمت، سه داستان از: دوریس لسینگ هستند»؛ «جنایت سیلوستر بونارد، از: آناتول فرانس»؛ «ماجرای مرموز بنجامین باتن، آبی و صورتی داستان‌هایی از اسکات فیتز جرالد هستند»؛ «افروختن آتش و گرگ خفته هم از آثار: جک لندن»؛ انتخاب و ترجمه شده‌اند
6940474,6410,اشتياق (مجموعه‌اي از بهترين داستان‌هاي آمريكايي و كانادايي),,9789648838893,TR,https://s.gr-assets.com/assets/nophoto/book/111x148-bcc042a9c91a29c1d680899eff700a03.png,https://s.gr-assets.com/assets/nophoto/book/50x75-a91bf249278a81aabab721ef782c4a74.png,2008,10,,per,مروارید,false,59195398,1,24,26,7,1,5:1|4:3|3:3|2:0|1:0|total:7,,,,3.71,7,1,"['6410', '3524', '3670']","['Alice Munro', 'Joyce Carol Oates', 'Jhumpa Lahiri']","['3.92', '3.69', '4.03']",['7393667'],['آذر عالی\u200cپور'],['3.37'],
40379446,6410,بیا با هم در ایرلند برقصیم,,9786008209553,TR,https://i.gr-assets.com/images/S/compressed.photo.goodreads.com/books/1528104977l/40379446._SY160_.jpg,https://i.gr-assets.com/images/S/compressed.photo.goodreads.com/books/1528104977l/40379446._SY75_.jpg,2019,,,per,فرهنگ جاوید,false,62675861,1,27,23,6,1,5:1|4:4|3:0|2:1|1:0|total:6,2019,,,3.83,6,1,"['128382', '51575', '5144', '112535', '7973', '957894', '13388', '6410']","['Leo Tolstoy', 'Colette', 'James Joyce', 'Silvina Ocampo', 'Eudora Welty', 'Albert Camus', 'Shirley Jackson', 'Alice Munro']","['4.06', '3.80', '3.74', '4.10', '3.87', '4.00', '3.95', '3.92']",['5287948'],['محبوبه مهاجر'],['3.56'],دروغ نیست که عذاب‌وجدان گرفته‌ایم. چو انداخته‌اند به‌خاطر ماست که آدم‌ها رشد طبیعی خود را ندارند. منظورم همان بدقوارگی‌های رایج و مخصوص آدم‌بزرگ‌هاست. بعضی همقدّ بچه‌ای ده‌ساله‌اند و خوش‌شانس‌ترها همقدّ هفت‌ساله‌ها. آن‌ها وانمود می‌کنند که بچه‌اند و نمی‌فهمند که با یکی‌ـ‌دو وجب کوتاه‌تر که آدم بچه نمی‌شود. درصورتی‌که خود ما بر طبق آخرین آمارها کوتوله‌ایم ولی نه ضعیف‌تریم و نه بی‌اصل‌ونسب و نه کسی را گول می‌زنیم.
26857052,6410,ما یک خانه‌ی آبی داریم,,9786006955087,TR,https://i.gr-assets.com/images/S/compressed.photo.goodreads.com/books/1443868218l/26857052._SX98_.jpg,https://i.gr-assets.com/images/S/compressed.photo.goodreads.com/books/1443868218l/26857052._SX50_.jpg,2012,,,per,شور آفرين,false,46895617,1,9,16,6,1,5:0|4:1|3:3|2:1|1:1|total:6,2012,1,1,2.67,6,1,"['6410', '6878', '1489116', '57415', '823063']","['Alice Munro', 'John Updike', 'Noëlle Revaz', 'Kate Walbert', 'Alistair Morgan']","['3.92', '3.80', '3.70', '3.35', '3.35']",['3260466'],['مرجان حسنی\u200cراد'],['3.41'],برگزیده ی داستان های کوتاه نیویورکر و پاریس ریویو<br /><br />مردم همه جا برای یافتن راهی در جستجو هستند. روح شان از جستجوکردن ریش ریش است. چیزهای زیادی به آنها فشار می آورد و به آنها ضربه می زند. می توانی در چهره های شان تمام درد و رنجی را که در وجودشان نقش بسته ، ببینی. آنها در عذاب هستند.<br /><br />با عجله از این سو به آن سو می روند. مجبور هستند خرید کنند و به خشک شویی بروند و موهایشان را کوتاه کنند و پول در بیاورند یا چک های رفاه اجتماعی شان را دریافت کنند. آدم های فقیر باید این کار را بکنند و آدم های ثروتمند مجبور هستند به دنبال بهترین راه ها برای خرج کردن پول شان باشند. این هم یک نوع کار است. آنها مجبور هستند بهترین خانه ها را با شیرهای آب طلا برای آب سرد و گرم بسازند. و ماشین های آئودی شان و مسواک های جادویی شان و همه دستگاه های هوشمندشان و بعد آژیرهای دزدگیر برای جلوگیری از قتل عام شدن و هیچ کدام از آنها چه گدا و چه غنی روحشان در آرامش نیست. داشتم به جای هیچ کدام می نوشتم همسایه ها. چرا؟<br /><br />من این جا هیچ همسایه اي ندارم. جایی که من هستم انسانها به جایی فراتر از یک دنیا پریشانی قدم نهاده اند. می دانند دارایی های شان چه هستند و خواهند بود و حتي مجبور نیستند خرید کنند و برای خودشان غذا بپزند یا حتي انتخابش کنند. انتخاب ها حذف شده اند. همه کسانی که اینجا هستند تنها چیزی که می توانند تولید کنند، آن چیزی است که در ذهن شان تولید می کنند.
27982309,6410,جان شیرین و شش داستان دیگر,,,TR,https://i.gr-assets.com/images/S/compressed.photo.goodreads.com/books/1448538416l/27982309._SX98_.jpg,https://i.gr-assets.com/images/S/compressed.photo.goodreads.com/books/1448538416l/27982309._SX50_.jpg,2015,,,per,انتشارات نگاه,false,47984585,1,7,9,3,2,5:0|4:1|3:1|2:1|1:0|total:3,,,,3.00,3,2,['6410'],['Alice Munro'],['3.92'],[],[],[],از پشت جلد کتاب:<br />آن طرف رودخانه، یک گُله درختِ همیشه‌سبز تیره بود، احتمالا سرو آزاد، اما آن‌قدر دور بودند که نمی‌شد به یقین گفت. و حتی دورتر از آن، روی دامنه‌ی تپه‌ی دیگری، خانه‌ای بود که از دور خیلی کوچک به نظر می‌رسید. رویش به طرف خانه‌ی ما بود. ما هیچ‌وقت به دیدن‌شان نرفتیم و با آن‌ها آشنا نشدیم. به چشم من شبیه خانه‌ی کوتوله‌های توی قصه بود. ولی اسم مردی را که در آن‌جا زندگی می‌کرد، یا زمانی زندگی می‌کرد چون شاید تا حالا مرده باشد، می‌دانستیم. رالی گرین، اسمش این بود، و به رغم این که شبیه اسم کوتوله‌هاست، نقش بیشتری در چیزی که می‌نویسم ندارد. چون این داستان نیست، همه‌اش زندگی‌ست.<br />(از داستان جان شیرین)<br /><br />*<br /><br />کتاب اصلی شامل چهارده داستان می‌باشد که در این کتاب هفت داستان از آن مجموعه آمده است:<br />ریگ<br />آموندسن<br />غرور<br />دالی<br />چشم<br />شب<br />جان شیرین
